id,user_id,post_id,parent_id,content,create_time
235,73,25,25.0,这篇游记生动地介绍了秦皇岛当地的特色小吃，从酸甜可口的炸糕到香辣鲜美的烤鱼，每一种美食都让人垂涎欲滴。作者不仅详细描述了食材和制作过程，还分享了与当地人的交流经历，增加了旅行的真实感。,1742843821
236,20,33,,这篇《秦皇岛沙滩玩耍亲子攻略》确实为带孩子出游提供了不少实用建议。文中推荐的沙雕艺术节和海洋馆非常吸引人，特别是对孩子来说是一次生动有趣的科普之旅。不过，如果能加入一些关于海滩安全的小贴士会更好，比如防晒和溺水预防措施，这样更加周到全面。,1741912369
237,93,88,88.0,这篇《秦皇岛海钓乐趣海滨攻略》真的写得很详实！不仅介绍了海钓的乐趣和技巧，还详细规划了行程和推荐了当地美食。对于像我这样的初学者来说非常有帮助。不过如果能增加一些安全提示就更好了，毕竟海洋变幻莫测嘛。强烈推荐给喜欢户外活动的朋友们！,1742535869
238,13,177,,这篇游记生动描绘了秦皇岛螃蟹宴的美味，让人垂涎欲滴。作者详细介绍了从选蟹到烹调的各种技巧，让读者仿佛亲临其境。不过，如果能加入一些关于当地特色蟹种的小知识就更好了，这样不仅能增加文章的专业性，也能帮助游客更好地了解和品尝这些独特的海味。,1741738197
239,88,80,80.0,这篇游记生动描绘了秦皇岛鸽子窝公园的美景，让人仿佛置身于海边的浪漫之中。除了赞叹这里的日出和海景外，作者还提到了一些实用的游览建议，非常适合准备前往的朋友参考。不过如果能加入一些关于最佳拍照时间和地点的小贴士就更完美了！,1741836133
240,75,161,,这篇《秦皇岛海鲜大餐美食攻略》真是干货满满！不仅详细介绍了当地的特色海鲜种类，还贴心地推荐了多家口碑极佳的餐厅。对于喜爱海鲜的旅行者来说，绝对是一份不可多得的好指南。不过如果能增加一些价格信息和预订小贴士就更完美了！,1742353800
241,30,152,,这篇游记生动描绘了北戴河海景的魅力。作者不仅详细记录了每处景点的独特风光，还分享了许多实用的小贴士，比如最佳观景时间、拍照技巧等，非常适合初访北戴河的旅行者参考。建议在文中加入更多个人体验和感受，让读者更能感同身受。,1741845189
242,44,79,79.0,这篇《秦皇岛鸽子窝日出风光攻略》真是让我大开眼界！文中的美景描写细腻生动，仿佛将我带到了那片沙滩之上。作者不仅分享了最佳观赏时间、拍摄技巧，还贴心提供了交通信息和注意事项。对于像我这样的旅游爱好者来说，这简直就是一份完美的旅行指南。,1742679004
243,76,85,,这篇游记生动描绘了山海关古城的魅力。作者不仅详细介绍了历史背景和文化特色，还分享了许多实用旅行贴士，非常适合初访秦皇岛的朋友参考。不过，如果能加入一些个人体验或情感描述会更加吸引人，让读者更能感同身受。期待下一次更精彩的内容！,1742576173
244,7,54,,这篇游记详细描绘了秦皇岛海滨乐园的无限魅力，让人仿佛置身于海风轻拂、沙粒细腻的场景中。作者不仅分享了丰富的游玩体验，还贴心提供了交通和餐饮推荐，非常适合初访者参考。,1741938787
245,78,65,65.0,读了这篇《秦皇岛湿地观鸟风光攻略》，收获颇丰！文中不仅详细介绍了秦皇岛湿地的美丽风景和丰富的鸟类资源，还分享了许多实用的观鸟技巧。对于喜爱鸟类和自然风光的旅行者来说，这是一份不可多得的宝典。,1742143912
246,50,87,,这篇游记生动描绘了秦皇岛森林公园的美丽景色。秋日的红叶和清新的空气令人陶醉，但记得提前了解开放时间和门票信息会更方便哦！如果你对户外活动感兴趣，可以考虑租一辆自行车，享受更多探索的乐趣。希望这篇游记能为你的旅行提供灵感！,1742261187
247,31,187,,这篇《秦皇岛渔岛美景风光攻略》真是一篇不可多得的好文章！作者不仅详尽地介绍了渔岛的自然景观和人文风情，还贴心提供了实用的旅行建议。对于像我这样的旅游爱好者来说，这不仅是一份攻略，更是一张通往美丽渔岛的地图。,1742476003
248,41,54,244.0,这篇游记详细记录了作者在秦皇岛的欢乐时光，尤其是海滨乐园的部分让人印象深刻。沙滩上的亲子活动和水上娱乐项目都极具趣味性，非常适合家庭出游。不过，如果能提前了解一些门票优惠政策，或许可以更好地规划行程，节省开支。,1742713814
249,29,149,149.0,这篇游记生动描绘了秦皇岛的海滨风光和夏日乐趣，非常推荐给渴望亲近海洋的旅行者。不过，如果能加入一些关于海鲜美食的信息就更完美了，相信会给计划度假的朋友提供更多灵感！,1742081031
250,49,125,125.0,这篇《秦皇岛一日游：体验老龙头入海》的游记生动地描绘了老龙头的壮丽景色和历史底蕴。作者不仅分享了美丽的风景照片，还详细介绍了沿途的历史文化，让人仿佛身临其境。,1741888788
251,77,99,,这篇游记生动描绘了北戴河海景的独特魅力，从细腻的日出到壮阔的日落，每一幕都让人赞叹不已。作者不仅分享了自己的美好体验，还贴心地提供了交通和住宿的实用建议，非常适合计划前往的朋友参考。不过，如果能加入一些当地特色小吃推荐就更完美了！,1741829187
252,12,138,,这篇游记生动描绘了秦皇岛动物园的家庭之旅，让人仿佛身临其境。不仅记录了动物们的可爱瞬间，还分享了许多实用的游玩技巧和注意事项。建议可以在游记中加入更多关于动物保护的知识，这样不仅能丰富内容，还能增强游客的责任感和环保意识。（字数：103）,1742541251
253,9,180,180.0,这篇游记生动描绘了秦皇岛鸽子窝的日出美景，令人仿佛身临其境。作者不仅记录下了壮丽的日出景色，还分享了许多实用的旅行贴士，对于计划前往的朋友非常有帮助。不过，如果能加入一些当地特色美食的推荐就更完美了！,1742169640
254,33,53,53.0,这篇《秦皇岛凉爽体验避暑攻略》确实很贴心！文中详细介绍了秦皇岛的海滩风光、海鲜美食和清凉夜市，让人仿佛身临其境。不过，如果能加入一些关于最佳出行时间和当地交通的信息就更好了，这样对计划暑期出游的朋友更有帮助。,1741812736
255,62,84,,《秦皇岛亲子时光旅行日记》真是温馨又实用！记录了全家人的欢笑和成长，让人羡慕。建议可以增加一些当地美食推荐和亲子互动游戏的玩法，这样能更好地帮助其他家庭规划行程。期待作者分享更多美好回忆！,1742639535
256,97,80,239.0,这篇游记生动描绘了秦皇岛鸽子窝公园的美丽风光，让人仿佛置身海边，感受到了海风的轻拂和鸥鸟的鸣叫。不过，如果能介绍一些具体的游览路线和注意事项，相信会更方便其他游客规划行程。期待更多精彩的旅行分享！,1742276323
257,61,121,,这篇游记详细介绍了秦皇岛沙滩露营的各种玩法和技巧，对于初次尝试露营的朋友非常有帮助。不过，如果能加入一些关于选择装备和天气预报的建议就更好了。总体来说，作者的热情和经验让人感到受益匪浅！适合热爱自然、追求户外乐趣的旅行者参考。,1742717078
258,49,167,233.0,这篇游记详细描绘了秦皇岛沿海公路的美景与风情，让人仿佛身临其境。作者不仅分享了沿途的风光，还贴心地提供了实用的行车建议和注意事项，对于计划自驾游的朋友非常有帮助。不过，如果能增加一些对当地特色美食或文化介绍会更好，让旅程更加丰富多彩！,1741955252
259,38,151,212.0,这篇游记生动描绘了秦皇岛森林公园的美景，让人仿佛身临其境。作者不仅介绍了各种植物和景点，还分享了如何更好地欣赏自然风光的技巧，非常实用。对于想要亲近自然、寻找心灵慰藉的朋友来说，是一篇不可多得的好文。,1741829117
260,8,93,93.0,这篇《秦皇岛烤鱿鱼美食攻略》真是让人垂涎三尺！文中详细介绍了几家口碑极佳的烤鱿鱼店，每一家都有独特的风味和制作手法。对于喜爱海鲜的旅行者来说，这篇攻略绝对值得一读再读。不过，如果能增加一些价格信息和营业时间，那就更完美了！,1742524829
261,24,125,250.0,这篇游记生动描绘了秦皇岛老龙头景区的独特魅力。作者从海边入海长城的壮丽景观出发，带我们领略了历史的沧桑与现代的活力交织之美。不过，文中提到部分设施需改进以提升游客体验，比如增加更多指示标识和改善休息区环境。,1742462157
262,10,121,216.0,这篇游记详细介绍了秦皇岛的沙滩露营攻略，从装备准备到安全须知一应俱全。作者不仅分享了个人经历，还贴心地给出了不少实用小贴士，让初次尝试的朋友也能轻松上手。不过，如果能加入一些当地特色小吃或活动推荐就更完美了，毕竟这是丰富旅行体验的好方式嘛！,1742411514
263,85,67,,这篇游记生动描绘了秦皇岛游乐场的家庭游玩体验。从亲子互动到刺激游玩项目，作者细腻地捕捉到了每一个欢乐瞬间。不过，如果能结合一些实用的行程规划建议和注意事项，会更有帮助。期待更多分享！,1742813667
264,19,86,,这篇游记生动描绘了秦皇岛渔民的文化魅力，让人仿佛置身于海风中。作者不仅细腻地捕捉到了渔村的生活气息，还深入介绍了当地丰富的海洋文化。建议可以加入一些当地的特色美食推荐，相信会给读者带来更全面的旅行体验。总的来说，这是一篇值得一读的好文章！,1741719459
265,3,196,196.0,这篇游记详细介绍了秦皇岛的古城风貌，不仅勾勒了历史的轮廓，还生动描绘了古迹的魅力。文中提到的每一道城墙、每一个文物都仿佛被赋予了生命，让人感受到浓厚的历史气息。,1742786222
266,73,137,137.0,这篇《秦皇岛沙滩露营海滨攻略》真是让人眼前一亮！攻略详细介绍了如何在海风中享受露营的乐趣，特别推荐的扎营位置和避暑技巧让人心生向往。不过，如果能加入一些关于潮汐时间和海滩安全提示的内容就更完美了，这样不仅增加了安全性，也让计划更加周全。,1741810298
267,82,62,,这篇游记生动地描绘了老龙头景区的历史风貌和自然美景，让人仿佛亲临其境。建议作者可以加入更多个人体验分享，如拍照技巧或是休息点推荐，这样更便于其他旅行者参考。整体来说是一篇值得一看的优秀游记！,1742575095
268,47,16,16.0,这篇《秦皇岛沙滩玩耍亲子攻略》确实详细且实用！对于带孩子出行的家庭来说，提供了很多贴心的小贴士。不过，如果能增加一些关于海滩安全提示和急救知识的内容就更好了，这样家长在游玩时会更加安心。整体而言，是一篇值得推荐的游记！,1742658208
269,53,186,186.0,这篇游记生动描绘了碣石山的壮丽风光和深厚文化底蕴。作者对沿途风景的细腻描写让人仿佛身临其境，特别是对于栈道奇观的描述尤为精彩，让人赞叹不已。,1742251009
270,53,120,,这篇游记生动描绘了秦皇岛鸽子窝公园的美景，尤其是日落时分的海天一色令人难忘。文中建议游客不妨清晨来此看日出，或许会有不一样的惊喜。对于喜欢摄影的朋友来说，这里绝对是个好去处。推荐大家跟随作者的脚步，亲自探索这片美丽的海岸风光。（95字）,1742279846
271,80,12,,这篇游记生动描绘了秦皇岛海边的美景，分享了许多实用的摄影技巧。作者不仅记录了拍摄地点和时间的选择，还贴心地提供了后期处理的小贴士，对摄影初学者非常有帮助。不过，如果能加入一些个人情感的表达会更添色彩，让读者更能感受到那份海滨的独特魅力。,1741599897
272,58,41,41.0,这篇游记生动描绘了秦皇岛海滨的美景和悠闲时光，让人仿佛身临其境。文中对海浪拍打岩石的声音、沙滩细腻的感觉描写得尤为传神，给读者留下了深刻印象。不过，如果能加入一些关于当地海鲜美食的信息就更完美了，这对于喜爱美食的旅行者来说是一大吸引力。,1742648847
273,13,200,200.0,这篇游记生动地描绘了秦皇岛的历史氛围和人文景观，特别是对秦始皇东巡遗迹的介绍让人印象深刻。作者细致入微的观察和丰富的历史知识让读者仿佛亲身经历了那段波澜壮阔的历史。,1741748715
274,68,160,160.0,这篇《我的秦皇岛亲子时光之旅》真是让人向往！作者详细记录了家庭出游的乐趣，从美丽的海滨风光到有趣的亲子互动游戏，每一处都充满温馨和快乐。,1742867189
275,47,126,126.0,这篇《秦皇岛海滨漫步海滨攻略》确实为计划海边休闲度假的人提供了很多实用信息。文中详细介绍了秦皇岛的海滩风光、海鲜美食以及夜间活动，让人仿佛身临其境。不过，如果能加入一些关于当地特色文化和历史的介绍会更好，这样能让旅行更加丰富多彩。,1742750429
276,76,69,,这篇《秦皇岛烤鱿鱼美食攻略》详细介绍了当地特色小吃，让食客们对烤鱿鱼有了全方位的认识。作者不仅分享了制作方法，还贴心地推荐了几家口碑极佳的店铺。不过，如果能增加一些价格信息和营业时间，就更完美了。非常适合即将踏上旅行之旅的朋友参考！,1741991669
277,86,147,,这篇游记详细介绍了秦皇岛鸽子窝公园的美景和游玩体验。作者不仅捕捉了海滩日落的壮丽景色，还分享了许多实用的游览贴士，如最佳观景点和非高峰时间出行建议，对计划前往的朋友非常有帮助。,1741756550
278,9,119,119.0,这篇游记生动描绘了秦皇岛游乐场的欢愉时光。作者不仅详细分享了各个游乐设施的乐趣，还贴心地给出了亲子互动的小贴士，非常适合家庭出游参考。不过，如果能增加一些对周边美食和住宿的介绍就更加完美啦！,1742154097
279,8,106,,这篇游记生动地描绘了秦皇岛的美食风情，让人口水直流。作者不仅介绍了传统的海鲜大餐，还推荐了一些地道的小吃摊位，令人印象深刻。不过，如果能分享一些实用的交通和预订攻略会更好，帮助更多的旅行者轻松享受美食之旅。,1742323752
280,10,122,122.0,这篇游记生动地记录了作者在秦皇岛的自驾经历，从海边的日出到山间的清风，每一个细节都让人仿佛身临其境。建议加入一些实用的小贴士，比如最佳观景点推荐和路线规划，这样对计划类似行程的朋友会有更大帮助。整体来说，是一篇值得分享的好文章！,1742582058
281,72,163,163.0,这篇《秦皇岛森林公园风光攻略》真不错！图文并茂地展示了森林的美丽景色和丰富的野生动植物资源。不过如果有更多关于徒步路线和野餐地点的推荐就更好了，这样我们就能更好地规划行程啦！强烈推荐给喜欢自然风光的旅行者。,1742741029
282,26,101,,这篇游记生动描绘了老龙头景区的独特魅力。不仅让我了解了丰富的历史背景，还感受到了秦皇岛海滨文化的独特韵味。建议增加一些关于如何避开人流高峰的实用建议，以及哪些景点特别推荐体验的细节描述，这样对打算前往的朋友会更有帮助。,1742157085
283,34,83,83.0,这篇游记生动描绘了秦皇岛独特的海滨风光和丰富的海上活动。不仅详细介绍了冲浪、帆板等项目，还分享了当地美食和文化体验，为寻求刺激的旅行者提供了宝贵建议。不过，如果能加入一些个人经历或趣事，内容会更加吸引人。,1742356940
284,28,118,118.0,这篇游记生动地描绘了秦皇岛秦始皇东巡文化的魅力。作者不仅详细介绍了景点的历史背景，还分享了许多实用旅行小贴士，让人仿佛身临其境。建议增加一些个人体验和感受的描述，这样能更好地引起读者共鸣。整体来说，是一篇值得推荐的旅游攻略！,1742652109
285,38,41,272.0,这篇游记真是让人如临其境！作者生动描绘了秦皇岛海滨的独特魅力，从细腻的沙滩到辽阔的大海，每一处景色都令人心旷神怡。不过，如果能多分享些当地美食和人文故事就更好了，相信会给读者更多的惊喜和灵感。强烈推荐给正在计划海边旅行的朋友！,1742176946
286,19,101,,这篇游记详细描绘了秦皇岛老龙头景区的独特魅力。文章不仅介绍了历史背景和建筑特色，还分享了一些实用旅行贴士，非常值得参考。不过，如果能加入更多个人体验和感想会更精彩，让人更有代入感。,1742841699
287,38,54,,这篇游记详细介绍了秦皇岛海滨乐园的游玩体验，从沙滩戏水到海上游乐设施，每一处都让人印象深刻。推荐带孩子去尝试各种水上项目，尤其是海豚表演和潜水艇观光，亲子互动非常丰富。不过可以提前了解园区开放时间及人流情况，避免高峰期排队等待。,1741713287
288,14,180,180.0,这篇游记生动地描绘了秦皇岛鸽子窝的日出美景。作者细腻的文字让人仿佛置身于那朝霞满天的海边，感受到海风拂面、阳光洒落的温暖与希望。不过，如果能加上些实用的小贴士，比如最佳观赏时间或交通信息，会更加方便其他旅行者参考哦！,1742855735
289,71,71,,这篇《秦皇岛必吃的海鲜市场美食》游记生动地描绘了当地的美食风情。作者不仅分享了详细的菜单推荐，还贴心地介绍了购买和品尝海鲜的小技巧。对于像我这样的旅行者来说，这些实用的信息无疑是一大帮助。,1742777460
290,60,121,,这篇游记详细描绘了秦皇岛沙滩露营的魅力，从搭帐篷到篝火晚会，每一步都让人跃跃欲试。不过，文中提到的风力较大时扎营需要注意安全，建议增加一些防风措施的小贴士会更好。适合热爱自然、寻求探险乐趣的朋友阅读！,1742402763
291,20,20,,这篇《秦皇岛夏日乐趣避暑攻略》真是让人眼前一亮！文中不仅详尽介绍了秦皇岛的海滨风光、美食小吃，还贴心推荐了多个免费开放的景区和活动。对于寻求清凉与娱乐并重的游客来说，绝对是一份不可多得的好指南。,1742475042
292,46,161,,这篇《秦皇岛海鲜大餐美食攻略》非常实用！详细介绍了多种特色海鲜，让人垂涎三尺。不过，希望作者能加入一些餐厅推荐和评分，这样对打算独自出行的朋友更有帮助。总体来说，是一篇值得分享的游记。,1742523605
293,47,9,,这篇《秦皇岛夏日乐趣避暑攻略》真是让人心动！详细介绍了海边、山间和美食，尤其是那些建议都很实用。不过如果能加入一些亲子活动或者夜游项目的推荐就更好了，这样不同年龄层的游客都能找到乐子。期待亲身体验一番！,1741751001
294,77,55,,这篇游记生动描绘了秦皇岛碣石山的壮丽景色。作者细致入微地记录了从山脚到山顶的所见所感，让人仿佛身临其境。建议可以多分享一些当地的特色美食和人文故事，这样旅行的乐趣会更丰富多彩！,1742205858
295,4,6,6.0,这篇游记详细介绍了秦皇岛鸽子窝公园的独特魅力，风景如画，尤其是日出时分的美景令人难忘。建议不妨早上早点出发，避开人群，享受更加宁静的观赏时光。同时，也可以带上相机捕捉更多美好瞬间。适合喜欢自然风光和摄影的朋友参考！,1741632140
296,56,161,161.0,这篇《秦皇岛海鲜大餐美食攻略》真是让人垂涎三尺！攻略中推荐的各种海鲜餐厅和特色菜品都非常诱人。尤其是那些地道的小吃，更是让人口水直流。不过，如果能增加一些关于季节性食材的信息就更好了，这样可以根据不同季节规划美食之旅。,1742763944
297,43,165,165.0,这篇《秦皇岛一日游：体验老龙头入海》的游记详实生动，不仅详细记录了作者在老龙头景区的独特体验，还对沿途风景进行了细致描绘。文中对于老龙头的历史背景介绍也十分到位，让人更深刻地理解其文化价值。,1741616280
298,51,127,127.0,这篇游记生动地描绘了秦始皇东巡的历史遗迹，让人仿佛穿越回那个雄伟的时代。作者不仅详细介绍了碣石山、祖山等地的景点，还分享了许多实用的旅行贴士，对喜欢历史和古迹探索的旅游爱好者来说非常有价值。,1742602293
299,84,23,,这篇游记生动描绘了秦皇岛渔民文化的独特魅力。作者深入体验渔村生活，记录了富有地方特色的民俗活动和传统手工艺品，让人仿佛置身于那个淳朴而充满活力的时代。对于旅游爱好者而言，不仅提供了丰富的旅行灵感，还强调了保护和传承文化遗产的重要性。,1742327792
300,32,185,185.0,这篇游记生动描绘了秦皇岛古城的魅力，从历史遗迹到现代风情，让人仿佛亲身游历。建议增加一些当地美食推荐和交通攻略，这样对计划前往的朋友会更有帮助哦！绝对值得一读再读，激发你探索的热情。,1741983832
301,98,96,96.0,这篇《秦皇岛碣石山景点推荐》游记生动详实地介绍了碣石山的独特魅力。作者不仅分享了美丽的风景照片，还贴心地提供了多条徒步路线和注意事项，对喜爱户外探险的旅行者非常有帮助。,1741994218
302,77,103,,这篇游记生动地描绘了秦皇岛的历史韵味。从老街的沧桑到海鸥的翱翔，作者细腻入微的观察让人仿佛身临其境。建议可以增加一些当地特色美食的介绍，相信会给读者更多元化的旅行灵感。推荐给所有想要深入了解中国北方历史文化的朋友们！,1742825037
303,38,180,180.0,这篇游记详细描绘了秦皇岛鸽子窝的日出美景，让人仿佛身临其境。作者不仅记录了壮观的日出画面，还分享了许多实用的小贴士，对于计划前往的游客非常有帮助。不过，如果能增加一些关于当地气候和着装建议的内容会更好，这样读者更能做好充分准备，享受旅行。,1741879015
304,30,20,20.0,这篇《秦皇岛夏日乐趣避暑攻略》真给力！不仅详细介绍了各大景区和美食，还贴心推荐了清凉避暑的好去处。不过我觉得可以再加入一些户外活动的介绍，比如冲浪、沙滩排球等，这样更能吸引热爱运动的小伙伴哦！整体来说，这是一篇不可多得的好游记！,1742081115
305,78,101,,这篇游记生动描绘了老龙头景区的历史文化底蕴，让人仿佛置身于那段波澜壮阔的历史之中。建议作者可以加入更多个人体验分享，比如在海边漫步时的所见所感，这样会让文章更加丰富有趣。对于第一次到访的朋友来说，这样的细节分享非常有帮助！,1742790938
306,47,185,300.0,这篇《秦皇岛的古城风貌文化》游记详实地记录了作者在秦皇岛古城的所见所感。不仅描写了古朴的老街、古色古香的建筑，还融入了当地的历史故事和人文情怀，让人仿佛穿越时空。,1742159275
307,60,41,,这篇《我的秦皇岛海滨漫步之旅》游记生动描绘了秦皇岛的美景和人文风情。作者细腻的笔触让人仿佛亲临其境，感受到海风的轻拂和沙滩的柔软。建议可以增加一些当地美食推荐或特色活动介绍，让读者在享受视觉盛宴的同时也能有所参考。,1742744157
308,8,113,113.0,这篇《秦皇岛海滨乐园亲子攻略》真是干货满满！攻略里详细介绍了游乐设施和游玩路线，非常适合带孩子出游的家庭参考。不过，如果能增加一些季节性活动的信息就更好了，这样可以根据不同的时间段做出更合适的安排。期待秦皇岛带来更多精彩体验！,1742854561
309,84,49,49.0,这篇《秦皇岛一日游：体验古城风貌》真是让人心动！作者详细描述了老龙头、山海关等景点的历史韵味和现代风情。不过，如果能增加一些实用的小贴士，比如最佳游览时间或是美食推荐，那会更好，毕竟这些都是旅途中不可或缺的精彩啊！,1742733217
310,28,104,,这篇游记生动描绘了秦皇岛海滨的迷人风光，让人仿佛身临其境。文中的细腻描述和优美语句，为读者展现了一个既浪漫又充满活力的海滨城市。不过，如果能加入一些关于当地美食或者活动推荐，将会更吸引旅游爱好者哦！,1742777951
311,64,70,,这篇《秦皇岛海滨度假避暑攻略》游记非常实用！详细介绍了秦皇岛的美景、美食和住宿推荐。不过，如果能增加一些关于当地节庆活动的信息就更好了，这样可以帮助计划行程的时间更加精准。期待下次去时还能遇到这样的好建议！,1741815014
