id,user_id,post_id,parent_id,content,create_time
156,77,156,,这篇游记详细介绍了秦皇岛老龙头景区的特色景点和游玩攻略。作者不仅分享了亲身体验，还提供了实用建议，让人对这个海滨胜地充满了期待。不过，如果能加入一些关于最佳游览时间和天气情况的信息就更好了，这样对计划前往的朋友更有帮助。,1741784393
157,12,157,,这篇《秦皇岛采摘体验亲子攻略》非常实用！不仅详细介绍了当地的水果种类和采摘季节，还贴心地规划了交通路线和注意事项。对于带孩子出游的家庭来说是一份难得的好资源。不过，如果能增加一些关于天气变化的提示就更完美啦！,1742108516
158,12,158,,这篇关于《秦皇岛的碣石山传说历史》的游记让人仿佛穿越回了古代，感受到浓厚的历史氛围。作者不仅描绘了碣石山壮丽的风光，还生动地讲述了当地的传说故事，让这次旅行充满了神秘色彩。,1742781991
159,28,159,,这篇游记生动描绘了秦皇岛的明代遗迹之美。作者不仅详细记录了行程中的所见所感，还深入探讨了这些历史遗址的文化价值和保护意义。,1742368811
160,90,160,,读罢《我的秦皇岛亲子时光之旅》，心中不禁对那片海滨留下了深刻印象。不仅风景美如画，更重要的是亲子间的温馨互动令人动容。建议攻略中可以增加更多关于当地特色美食的信息，让旅程更加完美。,1741904833
161,40,161,,这篇《秦皇岛海鲜大餐美食攻略》真是让人垂涎三尺！作者不仅详细介绍了各种海鲜的特色和烹饪方法，还贴心地分享了性价比高的餐厅推荐。对于喜欢探索美食的旅行者来说，这简直是一份不可多得的宝典。,1742635156
162,11,162,,这篇游记生动描绘了秦皇岛段长城的独特魅力，从沧桑的历史遗迹到壮丽的海景风光，让人仿佛身临其境。建议增加一些实用信息，如最佳游览时间和交通方式，这样对初次前往的朋友更有帮助。总体来说，是一篇值得一读的好文章！,1741865212
163,77,163,,这篇《秦皇岛森林公园风光攻略》游记详细介绍了公园内的美景和活动，非常适合初访者。不过，作者提到的某些小道信息可能不够精准，如果能加入一些官方验证过的路线图就更好了。,1742843370
164,67,164,,这篇游记生动描绘了秦皇岛日落时分的壮丽景色，夕阳洒在海面上金光闪烁，令人心旷神怡。作者分享了详细的路线和拍摄技巧，非常实用。不过，如果能加入一些当地海鲜美食的介绍就更加完美了。对于喜爱自然美景与摄影的朋友来说，这无疑是一篇不可多得的好文。,1742094547
165,81,165,,这篇《秦皇岛一日游：体验老龙头入海》的游记真是生动详实！老龙头的壮丽景色和深厚历史让人印象深刻。建议增加一些实用信息，如最佳游览时间和交通指南，方便更多人计划行程。期待作者未来分享更多精彩旅程！,1742396787
166,79,166,,这篇游记生动描绘了北戴河海滨的魅力。从细腻的文字中，仿佛能感受到海风轻拂、浪花拍岸的清凉。不过，如果能加入一些关于最佳游玩时间和当地特色小吃的信息就更完美了！这份旅行指南对我计划下次度假非常有帮助。,1742799889
167,69,167,,这篇游记对秦皇岛沿海公路的路线规划提供了详细的指导和实用贴士。作者不仅分享了沿途美丽的风景点，还贴心地标注了许多容易忽略的小细节，如最佳观赏时间、停车位置等，让人感觉仿佛亲身参与了一次海边自驾之旅。,1742132515
168,18,168,,这篇游记生动描绘了秦皇岛的一日行程，让人仿佛亲身经历了那里的古城魅力。作者不仅详细介绍了景点，还分享了一些实用的小贴士，非常适合初次来访的朋友参考。不过，如果能加入一些个人体验和感受的描述，内容会更加丰富有趣，更能激发读者的兴趣呢！,1742400445
169,10,169,,这篇游记生动描绘了秦皇岛的古朴风情和秦始皇东巡的历史遗迹。作者不仅详细介绍了景点，还分享了许多实用的旅行贴士，对喜欢历史文化的游客来说非常有参考价值。不过，如果能加入一些个人体验或感想会更加引人入胜。期待看到更多精彩的旅行故事！,1742812906
170,30,170,,这篇《秦皇岛海鲜大餐美食攻略》真是让人垂涎三尺！作者详细介绍了各种海鲜的烹饪方法和必去的餐厅，让准备前往的朋友心中有数。不过，如果能增加一些季节性的食材推荐就更完美了。整体来说，是一篇实用性很强的游记，对喜爱美食的旅行者非常有用！,1741728161
171,74,171,,这篇关于《秦皇岛必吃的海鲜大餐美食》的游记真是让人垂涎三尺！作者详细介绍了几家特色餐馆和几道必尝海鲜菜式，对于喜爱海鲜的食客来说非常有帮助。,1742508250
172,45,172,,这篇《我的秦皇岛自驾体验之旅》游记生动有趣，让人仿佛身临其境。文中不仅详细介绍了沿途风景，还分享了实用的自驾技巧和注意事项，对于计划前往的朋友极具参考价值。不过，如果能加入一些当地特色美食推荐就更好了，这样旅行的幸福感会更强！,1741836703
173,65,173,,这篇游记详细描绘了秦皇岛日出的壮丽景象，让人仿佛置身于海天之间。文中作者对天气变化、观景点选择以及拍摄技巧的分享非常实用，特别是那句“耐心等待总是值得的”，深深触动了我。建议可以增加一些当地美食推荐，让旅行更加完美。期待更多的精彩分享！,1741791568
174,2,174,,这篇游记生动描绘了秦皇岛的采摘乐趣，家庭氛围浓厚，让人感受到亲子时光的美好。建议增加一些关于当地特色水果的信息，以及交通和住宿的推荐，这样更能吸引计划出行的家庭参考。整体来说，是一篇值得一看的分享！,1742728058
175,48,175,,这篇游记生动地展现了秦皇岛的历史韵味。从北戴河到山海关，作者细致入微地描绘了每一个景点的魅力，让读者仿佛身临其境。不过，如果能增加一些当地美食的介绍和推荐，相信会更加吸引食客兼游客的心呢！,1741800298
176,72,176,,这篇游记让人感受到秦皇岛独特的海风清凉。作者详细描述了海边漫步和品尝海鲜的乐趣，让人垂涎欲滴。建议增加一些夏季避暑活动的介绍，如游泳、沙滩排球等，会更有助于读者规划行程。期待更多精彩的分享！,1742569302
177,25,177,,这篇游记详细介绍了秦皇岛品尝螃蟹的绝佳时机和地点，让我对当地海鲜美食垂涎三尺。不过，如果能提供更多关于如何挑选新鲜螃蟹的小贴士就更好了，这样初来乍到的朋友也能享受美味。推荐尝试当地的特色烹饪方式，绝对让你大呼过瘾！,1741723611
178,50,178,,这篇游记生动描绘了秦皇岛海鲜的美味，推荐前往当地市场亲自挑选食材。作者细致入微地介绍了每道菜品的独特风味和烹饪技巧，让人仿佛置身其中，回味无穷。不过，如果能加入一些关于季节性海鲜的选择建议，会更加实用哦！,1742645809
179,25,179,,这篇《秦皇岛一日游：体验长城文化》的游记写得生动有趣。作者不仅详细描述了游览过程中的所见所感，还分享了许多实用的小贴士，如最佳观赏点和拍照技巧等，对准备去长城游玩的朋友非常有帮助。,1742501312
180,88,180,,这篇游记生动描绘了秦皇岛鸽子窝的日出美景，让人仿佛身临其境。文中细腻地捕捉到了海风、霞光与波涛交织的瞬间，为读者提供了一次心灵的洗礼。如果能多加入一些实用的小贴士，比如最佳观赏时间和注意事项，相信会更受旅行者的青睐。,1742463001
181,85,181,,这篇《秦皇岛一日游：体验天下第一关》游记真是令人向往！作者生动描绘了雄关壮美的风景和深厚的历史文化，让人仿佛身临其境。不过，如果能加入一些实用的旅行小贴士就更好啦，比如最佳游览时间或周边美食推荐，这样对计划去的朋友会更有帮助。,1741719140
182,81,182,,这篇《秦皇岛自驾体验旅行日记》真是让人看了心痒痒！作者详实地记录了从城市到海边的每一处风景变化，每一道美食尝试。尤其是夜幕下的北戴河，那些灯光与海浪交织的画面，简直让人心动不已。,1742381298
183,68,183,,这篇《秦皇岛螃蟹盛宴美食攻略》真是让人垂涎三尺！文中详细介绍了多种美味螃蟹的做法和当地特色餐馆，对于喜爱海鲜的旅行者来说非常实用。不过，如果能加入一些关于购买螃蟹的小贴士就更好了，比如如何挑选新鲜螃蟹等。总体而言，是一篇值得推荐的游记。,1742535573
184,93,184,,这篇《秦皇岛凉爽体验避暑攻略》真是实用！不仅详细介绍了当地的避暑胜地和美食推荐，还贴心分享了交通和住宿信息。特别推荐鸽子窝公园的日出和渔岛的海风，让人心动不已。,1742229473
185,27,185,,这篇游记生动描绘了秦皇岛古城的独特魅力。漫步在古街巷中，仿佛穿越回那个烽火连天的时代，让人深刻感受到历史的厚重。建议作者可以增加一些当地美食推荐，为读者提供更全面的旅行指南。期待更多这样的文化之旅分享！,1742830944
186,20,186,,这篇游记详细介绍了碣石山的美景和特色活动，非常值得一读！文中提到的“看海听涛”体验确实令人向往。不过，对于想要更深入了解当地文化的游客，能否推荐一些周边的文化遗产或特色小店呢？这会让人更加全方位地感受这个地区的魅力。,1741993521
187,28,187,,这篇《秦皇岛渔岛美景风光攻略》真是干货满满！作者不仅详细介绍了渔岛的美丽风光和特色活动，还贴心地提供了交通路线、最佳游览时间等实用信息。对于喜欢探索自然风景的旅行者来说，这是一份不可多得的好资料。,1742835379
188,72,188,,这篇游记生动地描绘了秦皇岛老龙头的历史文化和壮丽景色。作者不仅详细介绍了这里的建筑特色和海洋风光，还分享了许多实用的游览建议，如最佳观赏时间和交通指南，让读者仿佛身临其境。对于喜爱历史文化与自然景观相结合的旅游者来说，是一篇不可多得的好文。,1741718691
189,78,189,,这篇游记详细介绍了秦皇岛的海鲜市场美食，让我对当地美食充满期待。作者不仅分享了各种海鲜的做法和味道，还贴心地给出了购买和食用的小贴士。对于喜爱尝试新鲜海味的旅行者来说，非常实用！建议加入一些当地人推荐的特色菜，这样会更有本地风情哦。,1742322699
190,67,190,,这篇《秦皇岛一日游：体验文化遗产》游记生动有趣，详细记录了作者在秦皇岛的一天行程。从历史古迹到现代建筑，作者对每个景点都做了深入细致的探索，并分享了许多实用建议和小贴士，非常适合准备去秦皇岛旅游的朋友参考。,1742548141
191,100,191,,这篇游记生动描绘了秦皇岛独特的海滨风光和丰富的海上运动项目。作者分享了自己亲身体验冲浪、帆船等项目的乐趣，还详细介绍了当地特色海鲜美食，让人垂涎欲滴。不过，如果能增加一些关于最佳旅行时间和天气条件的信息就更完美了！,1742551640
192,82,192,,这篇游记生动地描绘了秦皇岛海胆炒饭的独特风味，让人垂涎欲滴。建议作者多分享一些挑选新鲜海胆的小贴士和烹饪技巧，这样能帮助其他旅行者更好地体验这一美食。期待下次能看到更多关于秦皇岛的地道美食探索！,1742475898
193,73,193,,这篇游记详细介绍了在秦皇岛度夏凉快假期的方法。作者分享了多个实用建议，如选择海边散步、品尝海鲜等，让人感觉仿佛亲身经历一般。特别推荐尝试当地特色美食，体验自然风光与城市文化相结合的完美假日。,1741953522
194,85,194,,这篇游记详细介绍了秦皇岛的明代遗迹，让人仿佛穿越时空，感受到那段辉煌的历史。文章不仅文字生动，还配有精美的图片，让人身临其境。对于计划前往的朋友，可以提前了解一下相关背景知识，更有利于理解和欣赏这些历史遗存的独特魅力。,1741679173
195,20,195,,这篇《秦皇岛山海关古道自驾体验》真是让人耳目一新！作者详细记录了沿途的历史遗迹和自然风光，让人仿佛亲身经历了那段历史。建议增加一些实用路线规划和注意事项，会更方便自助游的朋友参考哦。强烈推荐给喜欢探索历史文化与自然美景的旅行者们！,1742824172
196,45,196,,这篇游记生动描绘了秦皇岛古迹的魅力。作者不仅详细介绍了历史背景，还分享了许多实用的旅行贴士，让读者仿佛身临其境。建议增加一些个人体验感悟，这样更能激发其他游客的兴趣和共鸣。期待更多精彩分享！,1742795716
197,33,197,,这篇《秦皇岛停车指南自驾游攻略》非常实用！作者详细介绍了各个景点附近的停车场信息，特别是对喜欢摄影和海滩风光的游客来说很贴心。不过，考虑到节假日可能会出现停车位紧张的情况，建议多关注一下实时的停车情况，或者提前在线预订车位。,1742390405
198,41,198,,这篇游记生动描绘了秦皇岛夏日的乐趣，从细腻的海滩风光到丰富的户外活动，让人仿佛置身其中。不过，文中提及的海鲜餐厅推荐是否还有更新更地道的选择值得探索？期待更多关于当地特色和隐藏美景的分享！适合计划夏季海滨之旅的朋友参考。,1741980808
199,47,199,,这篇游记生动描绘了秦皇岛沿海公路的美景和自驾的乐趣。海岸线绵延不绝，海风轻拂，让人心旷神怡。作者建议驾驶SUV以应对复杂路况，不失为明智之选。我推荐大家选择清晨或傍晚出行，享受更加宁静迷人的海岸风光。不过，也提醒游客注意保护环境，文明旅游。,1742423724
200,20,200,,这篇游记生动地描绘了秦皇岛的迷人风光，特别是秦始皇的历史遗迹令人印象深刻。对于历史爱好者和自然探索者来说，这里绝对值得一游。不过，文中提到的部分景点开放时间不详，希望作者能补充相关信息，帮助其他游客更好地规划行程。,1742606455
201,20,37,37.0,这篇《秦皇岛当地小吃美食攻略》真是让我大开眼界！作者不仅详细介绍了各种特色美食，还分享了许多实用的就餐小贴士。对于像我这样的吃货来说，这绝对是一份宝贵的旅行指南。不过，如果能加入一些个人体验感言就更好了，这样读者更能感同身受。,1742776869
202,66,79,,这篇《秦皇岛鸽子窝日出风光攻略》非常详实，为喜欢摄影和追求美景的旅行者提供了极大的帮助。作者不仅分享了最佳观景时间、天气条件，还贴心地推荐了几处拍摄点，让人仿佛身临其境。,1742608161
203,92,149,,这篇游记生动地描绘了秦皇岛的海滩美景和海鲜美食，让人心生向往。不过，作者没有提到当地的夜生活，对于喜欢探索城市夜景的旅行者来说，这方面的信息会更有帮助。总体而言，是一篇值得推荐的好文！,1742646655
204,60,143,,这篇游记生动描绘了北戴河的海景魅力，让人仿佛置身于细腻绵延的金色沙滩和碧蓝的大海之间。不过，作者提到的最佳观景点在黄昏时刻人满为患，建议可以尝试清晨或傍晚时分前往，这样既能避开人群，又能享受更为宁静美丽的海岸线景色。,1742538208
205,3,99,99.0,这篇游记生动描绘了北戴河的壮丽海景，让人仿佛置身海边。作者不仅分享了拍摄角度和技巧，还提供了实用的小贴士，比如最佳观景点和潮汐时间，非常适合初访北戴河的朋友参考。建议增加一些当地风土人情的介绍，会让游记更丰富有趣！,1742727453
206,27,94,,这篇《我的秦皇岛自驾体验之旅》游记非常生动有趣，让人仿佛亲身感受到了海边的清新空气和独特的风景。作者详细分享了自驾路线和沿途见闻，给其他旅行者提供了宝贵的参考。不过，如果能加入一些关于当地美食的小贴士就更好了！这样的细节能够让旅程更加完美。,1742275560
207,27,187,,这篇游记生动地描绘了秦皇岛渔岛的美丽景色，给我留下了深刻印象。作者详细介绍了景点特色和游玩路线，对于准备前往的朋友非常有帮助。不过如果能增加一些关于最佳观赏时间和当地风俗习惯的信息就更好了。期待更多精彩的旅行分享！,1741880572
208,5,70,70.0,这篇《秦皇岛海滨度假避暑攻略》确实为计划暑期旅行的朋友提供了不少实用信息。攻略中不仅详细介绍了当地的热门景点和特色美食，还贴心地提醒了游客需要注意的事项，如防晒、防蚊等小贴士。,1742285308
209,2,93,,这篇《秦皇岛烤鱿鱼美食攻略》详实有趣，不仅能让人一睹秦皇岛的海鲜风采，还能学到不少烤制技巧。不过，希望作者能增加一些关于购买食材地点的信息，这样初来乍到的朋友也能轻松品尝到地道美味。强烈推荐！,1742875146
210,51,151,,这篇游记生动描绘了秦皇岛森林公园的秀美景色，让人仿佛置身其中。作者详细介绍了不同季节的美丽风光和徒步路线，为游客提供了实用的信息。不过，如果能结合一些植物科普知识，会更加丰富内容，帮助游客更好地理解自然之美。期待更多这样的分享！,1742870022
211,10,111,111.0,读了这篇《秦皇岛避暑山庄避暑攻略》，真是受益匪浅！攻略中详细介绍了避暑山庄的历史文化、景点分布和游玩路线，非常适合初来乍到的朋友。不过，如果能加入一些关于最佳游览时间及穿着建议的内容就更完美了。期待下次去时能有更多实用信息参考。加油！,1742187046
212,59,151,151.0,这篇游记不仅详细介绍了秦皇岛森林公园的美丽景色和丰富植物种类，还分享了一些实用的游览技巧。对于准备前往的朋友来说，是一份非常有用的指南。不过，如果能加入一些个人体验或者特定季节的独特风景描述，会更加吸引人哦！,1741720349
213,44,77,77.0,这篇游记生动描绘了秦皇岛夏日的乐趣，让人仿佛置身于海边，感受到海风拂面和沙滩上的欢声笑语。推荐尝试当地特色美食，如海鲜烧烤，别有一番风味。此外，夜游山海关古城也很有看点，建议安排在行程中。整体来说，这是一篇值得参考的旅行指南！,1741755759
214,36,62,62.0,这篇游记生动地描绘了秦皇岛老龙头景区的魅力。从关城的历史厚重感，到海岸线的壮丽风光，作者细腻地捕捉到了每一个令人难忘的瞬间。建议加入一些关于最佳游览时间和天气状况的信息，这样对计划前往的朋友会更有帮助。总体来说，这是一篇值得推荐的好游记！,1742346915
215,56,138,138.0,这篇《秦皇岛的动物园探秘家庭游》真是图文并茂！动物园里小动物们活泼可爱，孩子们玩得不亦乐乎。不过，希望园区能增加更多互动环节，比如喂食体验等，让亲子互动更丰富。适合所有年龄段的家庭游玩，强烈推荐！,1742764000
216,1,121,121.0,这篇游记生动地描绘了秦皇岛沙滩露营的乐趣，从装备准备到夜幕下的篝火晚会，每一步都写得详尽而有趣。不过，如果能提供一些关于潮汐时间表的提示就更好了，这样初学者可以更好地规划活动避免危险。整体而言，强烈推荐给喜欢户外探险的朋友！,1742809176
217,40,169,169.0,这篇游记生动地描绘了秦皇岛的古韵风情。作者不仅详细介绍了秦始皇东巡的历史背景，还分享了许多游览景点的心得体会。文中对山海关的雄伟和老龙头的壮观描写尤为精彩，让人仿佛身临其境。,1741952248
218,47,171,171.0,这篇游记详细介绍了秦皇岛的各种海鲜佳肴，让人垂涎欲滴。文章不仅分享了美味的食谱，还贴心地推荐了几家口碑极好的餐厅。不过，如果能增加一些个人体验或者与其他地方海鲜对比的小贴士，那就更完美了。非常适合计划探访秦皇岛的朋友参考！,1742692059
219,2,160,160.0,这篇游记生动地描绘了秦皇岛亲子旅行的美好时光，不仅详细介绍了景点和美食，还分享了许多实用的小贴士。对于寻求家庭出游灵感的朋友们来说，这真是一篇不可多得的好文！不过，如果有更多关于儿童友好的活动推荐就更好了。,1742183552
220,52,199,199.0,这篇游记生动描绘了秦皇岛沿海公路的美景和自驾的乐趣。海岸线的风光令人流连忘返，但要注意潮汐时间，以免发生危险。同时，提前规划路线并携带足够的水和食物也很重要。期待更多这样的分享！,1742208724
221,80,89,89.0,这篇游记生动描绘了秦皇岛海滨度假的独特魅力。作者不仅详细记录了海滩上的欢愉时光，还分享了许多实用的小贴士，如选择最佳时间去沙滩和品尝当地美食的推荐地点。对于计划前往的朋友来说，是一份非常宝贵的参考指南。,1742632068
222,10,86,86.0,这篇游记生动地描绘了秦皇岛渔民文化的独特魅力。作者不仅详细介绍了当地的海产品美食，还深入分享了渔民的生活习俗和传统节庆活动，让人仿佛身临其境。,1742470250
223,13,199,,这篇《秦皇岛沿海公路自驾体验》游记生动描绘了沿途的美景和独特的海风味道。作者推荐的路线非常值得尝试，特别是日落时分，海天一色，美不胜收。,1741869244
224,3,57,,这篇游记生动地描绘了秦皇岛的自驾之旅，让人仿佛置身于那美丽的海岸线和雄伟的山峦之间。作者对沿途风景的细腻描写和对当地人文风情的介绍，都让人印象深刻。,1742863024
225,18,5,5.0,这篇游记详细介绍了秦皇岛的各种海上运动项目和体验方法。作者不仅分享了自己参与帆船、冲浪等项目的经历，还贴心地给出了装备选择和安全须知的建议。对于初次尝试这些活动的朋友来说非常有参考价值。,1742294199
226,57,178,,这篇游记生动描绘了秦皇岛的海鲜盛宴，让人垂涎欲滴。建议作者增加一些当地海鲜的历史和文化背景介绍，让读者不仅能品尝美食，还能深入了解地方风情。期待更多这样的美味探索之旅！,1742047482
227,73,106,,这篇游记生动地描绘了秦皇岛的独特魅力，从海鲜美食到古城风光，每一处都充满了惊喜。文中推荐的几家餐厅也让人垂涎欲滴，强烈建议亲身体验一下烤鱼和海鲜大餐。不过，如果能多介绍一些当地的特色小吃和小众景点，那就更完美了！,1742472626
228,88,148,148.0,这篇游记生动描绘了秦皇岛市内一片隐藏的绿肺——森林氧吧的独特魅力。作者详细分享了漫步林间的小径、呼吸清新的空气以及享受大自然宁静时光的美好体验，给读者带来身临其境之感。,1741708393
229,91,18,,这篇游记生动地描绘了秦皇岛一日游中的军事历史探索之旅。作者不仅详细记录了参观北戴河海军博物馆的经历，还分享了亲身体验老炮台的感慨，让人仿佛置身于那段峥嵘岁月之中。,1741607109
230,55,79,79.0,这篇《秦皇岛鸽子窝日出风光攻略》真是干货满满！文中不仅详细介绍了最佳观景时间和路线规划，还贴心分享了拍摄技巧和注意事项。对于摄影新手来说，是个很好的学习资源。唯一的小建议是，能否增加一些关于住宿推荐的内容？这样计划出行会更加方便哦！,1742497167
231,44,102,102.0,这篇游记详细介绍了山海关古城的历史和美景，让人仿佛身临其境。文中提到的关隘、古建筑和海景都描绘得非常生动。不过，如果能加入一些个人体验或者实用的小贴士就更好了，比如最佳游览时间或注意事项，这样对想要亲自走访的朋友会有很大帮助。,1742518477
232,34,22,22.0,这篇《秦皇岛渔岛美景风光攻略》非常实用！作者详细介绍了渔岛的特色景点和游玩路线，特别是对海鲜餐厅推荐令人垂涎。不过，如果能加入一些季节性活动介绍就更好了，这样可以根据不同的旅行时间做出更精准的选择。强烈推荐给计划前往的朋友！,1742664382
233,71,167,,这篇游记为我描绘了秦皇岛沿海公路的美丽风光，尤其是那绵延不绝的海岸线和随风摇曳的松树，让人仿佛身临其境。不过，如果能结合一些具体的导航信息或加油站、观景点推荐，那就更完美了！这样的补充对计划自驾游的朋友非常有帮助。,1741775407
234,22,170,170.0,这篇《秦皇岛海鲜大餐美食攻略》确实为热爱美食和旅行的朋友提供了宝贵的参考。文中详细介绍了各种新鲜美味的海鲜菜品及其烹饪方法，让人口水直流。,1741712080
