id,user_id,post_id,parent_id,content,create_time
312,25,16,16.0,这篇《秦皇岛沙滩玩耍亲子攻略》真是干货满满！详细介绍了如何带孩子享受海滩乐趣，从安全须知到游玩项目都考虑周全。不过，如果能加入一些关于当地海鲜美食的推荐就更完美了。对喜欢家庭出游的朋友来说，绝对是一份不可多得的好资源！,1741846477
313,58,195,,这篇《秦皇岛山海关古道自驾体验》真是让人神往！作者详细记录了从城市到古关隘的沿途风光和历史故事，让人仿佛亲身穿越时空。建议可以增加一些实用路线规划和停车点推荐，这样对自驾游的朋友更有帮助。期待更多这样的深度探索分享！,1741912619
314,61,191,,这篇游记生动描绘了秦皇岛的海滨风光和丰富多样的海上运动。作者详细分享了冲浪、帆板等项目的体验感受，让人仿佛身临其境。建议增加一些关于当地海鲜美食的信息，这样对食物爱好者的吸引力会更强。总体来说，是一篇值得推荐的好文！,1742710931
315,13,96,,读完这篇《秦皇岛碣石山景点推荐》，对碣石山的好奇心更加强烈了。游记中细腻描绘了山景的魅力和活动的乐趣，特别是攀岩体验非常吸引人。不过，如果能多分享一些登山路线的选择和注意事项，对于初学者来说会更有帮助哦！期待亲自踏上这片神奇的土地。,1742625147
316,35,57,57.0,这篇游记生动描绘了秦皇岛自驾游的独特魅力，让人仿佛置身于海边的清风之中。不过，如果能加入一些关于最佳自驾路线的小贴士就更好了，相信会给其他喜欢自驾的朋友更多的灵感和帮助！,1742883392
317,14,76,76.0,这篇游记生动地描绘了秦皇岛天下第一关的历史文化。作者不仅详细介绍了关城的建筑特色和历史背景，还分享了许多实用旅行贴士，如最佳游览时间和注意事项，非常适合计划前往的朋友参考。,1742005951
318,73,4,,这篇游记详细描绘了秦皇岛日落的魅力，让人仿佛置身于那金色余晖之中。作者不仅分享了最佳观赏地点，还贴心地介绍了拍照技巧和注意事项，非常适合摄影新手参考。不过，如果能加入一些个人感受或情感描写，会更加触动人心。期待你能带来更多精彩的旅行故事！,1742669382
319,80,139,,这篇游记生动描绘了秦皇岛海滨乐园的美景和乐趣。沙细腻软、海水清澈，孩子们在海边尽情玩耍，欢声笑语不断。不过，如果能提前查看潮汐表安排活动时间会更好，避免遇到退潮时沙坑变少的情况。推荐给带孩子出行的家庭参考！,1742507711
320,25,63,63.0,这篇游记生动地描绘了秦皇岛丰富的文化遗产和悠久的历史。作者不仅详细介绍了著名景点，还分享了许多鲜为人知的小众地点，让读者仿佛亲身经历了一次文化之旅。建议增加一些个人体验和感受的描述，这样更能引起共鸣。期待更多这样的旅行故事！,1742460440
321,14,11,11.0,这篇《秦皇岛海上运动海滨攻略》真是让人眼前一亮！不仅介绍了丰富的海上活动项目，还分享了实用的旅行贴士。对于喜欢户外运动和海景的旅行者来说，是一份不可多得的好资源。不过，如果能加入一些当地美食推荐就更完美了。期待更多的精彩内容！,1742725038
322,36,25,,这篇游记生动地介绍了秦皇岛当地的特色小吃，让人垂涎欲滴。尤其是提到的烧烤和海鲜，更是让人迫不及待想要一尝鲜！不过，如果能加入一些个人体验或推荐购买的小吃店铺信息就更好了，这样对初次前往的朋友更有帮助。,1742580722
323,11,33,33.0,这篇《秦皇岛沙滩玩耍亲子攻略》确实为家庭出游提供了不少实用信息。作者详细介绍了海滩游玩的最佳时间、必备物品和安全须知，特别提到在孩子玩沙筑堡时要多加引导，增添趣味性。,1742184037
324,55,82,82.0,这篇游记生动地描绘了探索山海关古道的乐趣，不仅详细介绍了路线规划，还分享了许多实用的小贴士。对于喜爱历史和徒步旅行的游客来说，是一份难得的好指南。不过，可以增加一些关于天气变化对行程的影响以及安全注意事项的内容，让读者更好地准备自己的旅程。,1742313447
325,18,78,78.0,这篇游记生动地描绘了秦皇岛丰富多彩的节庆活动，从沙滩音乐节到国际灯会，每一项活动都充满了当地的文化特色和热情好客。建议作者可以加入更多关于当地人参与活动的故事，这样能更好地展现出秦皇岛的人文气息。这将对其他旅游爱好者更具吸引力！,1742654770
326,87,63,,这篇《探秘秦皇岛的文化遗产历史》游记生动地描绘了秦皇岛丰富的文化遗产和悠久的历史。作者不仅详细介绍了当地的历史遗迹，还分享了许多实用的小贴士，让读者仿佛身临其境。,1742127780
327,51,151,,这篇游记生动地描绘了秦皇岛森林公园的美景，让人仿佛置身于绿意盎然的世界。作者不仅详细介绍了最佳观赏时间，还贴心分享了徒步路线和必备装备，对喜爱自然风光的旅行者极具参考价值。建议增加一些关于植物知识的小贴士，让游览更加丰富有趣。,1742566501
328,25,87,246.0,这篇游记生动描绘了秦皇岛森林公园的自然美景，特别是红叶、瀑布和溪流，令人心旷神怡。建议添加一些实际的游玩路线推荐，方便读者更好地规划行程，相信会给更多的旅行者带来灵感与乐趣！,1742095531
329,92,56,,这篇游记生动描绘了秦皇岛动物园之行的趣事，让人仿佛置身其中。尤其是孩子们在喂食小动物时的欢呼声，给整个旅程增添了无限乐趣。建议作者可以分享更多关于动物的知识和保护信息，让这次旅行更有教育意义。推荐给所有亲子家庭，一起探索自然界的奇妙！,1742621702
330,73,152,,这篇游记生动描绘了北戴河海景的独特魅力。作者不仅分享了细腻的感官体验，还贴心地提供了实用的旅行建议。对于渴望探索海滨风光的朋友来说，这是一份难得的好资源。不过，如果能加入一些当地文化的介绍就更完美了！,1742693861
331,47,114,,读完这篇《秦皇岛海风吹拂避暑攻略》，真是收获颇丰！文章不仅详细介绍了秦皇岛的海滩美景和美食推荐，还贴心地分享了避开人流高峰的妙招。不过，对于喜欢潜水和冲浪的朋友，能否增加一些水上活动的信息就更好了。期待下次去秦皇岛时能有更多精彩的体验！,1742053155
332,57,17,17.0,这篇游记详细描绘了秦皇岛渔岛风景区的魅力，让人仿佛身临其境。建议增加一些关于海上项目的安全须知，让读者游玩更安心。对于喜欢探险的游客来说，这里绝对值得一去！,1742033303
333,65,194,194.0,这篇游记以细腻笔触描绘了秦皇岛的明代遗迹，让人仿佛穿越时空，亲临其境。文中不仅详尽介绍了各个景点的历史背景，还分享了许多实用的游览小贴士，非常适合规划类似行程的朋友参考。建议作者今后可以增加一些个人体验和感悟，让文章更加生动有趣。,1742417305
334,82,55,,这篇游记详细描绘了秦皇岛碣石山的自然风光，让人仿佛身临其境。作者不仅记录了壮丽的山景和清新的空气，还分享了一些实用的旅行小贴士，如最佳游览时间和必备装备。,1741717177
335,84,168,,这篇《秦皇岛一日游：体验古城风貌》的游记生动地描绘了秦皇岛的历史底蕴和现代魅力。作者不仅详细介绍了景点，还分享了许多实用的游玩贴士，让人如临其境。不过，如果能加入一些当地美食推荐就更完美了！这样的补充会让旅程更加丰富多彩，值得点赞。,1742252670
336,64,193,193.0,这篇游记详细介绍了在秦皇岛度夏的种种乐趣，从海上冲浪到山间徒步，活动多样且富有趣味。作者还分享了当地美食和住宿推荐，为想要来此避暑的人提供了宝贵的参考。,1741723063
337,47,46,46.0,这篇游记生动描绘了在秦皇岛品蟹的美妙体验。作者不仅分享了蟹宴菜单，还详细介绍了当地特色蟹种及其烹饪方式，让人仿佛置身其间。不过，如果能加入一些与当地人互动的小故事，会更加鲜活有趣，让读者更感同身受。推荐给喜爱美食和自然风光的朋友们！,1741841988
338,32,36,,这篇游记详细介绍了秦皇岛特色海胆炒饭的做法和食用体验，让人垂涎欲滴。推荐尝试正宗的做法，并注意食材的新鲜度。如果有机会，不妨也探索一下当地的海鲜市场，亲自挑选新鲜的海胆，现场品尝更地道的味道。适合喜欢海鲜、追求美食旅行的朋友参考！,1742551186
339,38,57,,这篇《记录秦皇岛的自驾体验》游记生动有趣，让人仿佛亲身感受到了秦皇岛的海风和阳光。不过，如果能加入一些关于最佳观景时间和交通状况的信息就更好了，相信会对计划类似旅行的朋友大有帮助！,1741715176
340,89,135,135.0,这篇《秦皇岛的海钓乐趣海滨体验》游记生动地描绘了秦皇岛迷人的海岸风光和丰富的海洋资源。作者细腻地记录了每一次钓获的乐趣，让读者仿佛亲身经历了一次激动人心的海上冒险。对于渴望亲近自然、享受宁静时光的旅游爱好者来说，这无疑是一个绝佳的选择。,1742591615
341,74,157,157.0,这篇《秦皇岛采摘体验亲子攻略》游记详尽实用，为带孩子出游的家庭提供了宝贵的参考。作者分享了丰富的采摘点信息和路线规划，使原本可能枯燥的旅程变得趣味盎然。,1742612429
342,28,197,,这篇《秦皇岛停车指南自驾游攻略》对自驾游客非常实用。文中详细介绍了停车场的位置和特点，还分享了一些免费车位的信息，非常适合计划前往秦皇岛的自驾游爱好者参考。,1742168565
343,10,152,,这篇游记生动描绘了北戴河海景的魅力，让人仿佛身临其境。作者不仅记录了壮阔的海景，还分享了许多实用的游玩建议和美食推荐，非常适合打算前往的朋友参考。不过，如果能更多地描述一天中不同时间点的景色变化就更好了，相信会给读者带来更丰富的视觉享受。,1742310367
344,95,163,281.0,这篇《秦皇岛森林公园风光攻略》真是让人眼前一亮！图文并茂地展示了公园内的美景和游玩路线。不过，如果能加入一些季节性活动的信息就更完美了，比如春季赏花、秋季观叶等，这样不同季节来的朋友也能更好地安排行程。推荐给所有热爱自然的朋友们！,1742184406
345,86,188,,这篇游记生动描绘了老龙头景区的历史文化和壮丽景色。作者深入浅出地介绍了古战场遗址、观澜亭等重要景点，并分享了自己漫步海岸线的独特体验。建议可以增加一些当地美食推荐和实用旅行小贴士，这样对准备前往的游客会有更大的帮助。（约98字）,1741700387
346,22,103,302.0,这篇游记生动描绘了秦皇岛丰富的历史遗迹，让人仿佛身临其境。作者不仅详细介绍了山海关、北戴河等著名景点，还提到了一些鲜为人知的历史故事，增加了旅行的趣味性。建议多分享一下当地的美食和人文风情，这样能更好地让读者感受到这座城市的魅力。,1741609575
347,49,72,72.0,这篇游记详细描绘了秦皇岛黄金海岸的壮丽景色，从细腻的沙滩到连绵的海岸线，再到远处壮观的大海，让人仿佛身临其境。建议作者可以加入更多关于当地海鲜美食和特色人文风情的内容，让读者不仅享受视觉盛宴，还能体验味觉与文化之旅。,1742058171
348,35,83,83.0,这篇《秦皇岛的海上运动海滨体验》游记生动描绘了秦皇岛独特的海景和丰富的水上活动。作者不仅分享了个人在风帆冲浪中畅快淋漓的感受，还贴心地推荐了一些性价比高的海滩游玩项目。对于热爱海洋冒险的朋友来说，这里绝对是一个不可错过的好去处！,1742640558
349,48,103,346.0,这篇游记生动描绘了秦皇岛的历史遗迹，让人仿佛亲临其境。作者不仅详细记录了景点特色，还分享了许多实用信息和有趣的小故事，非常吸引人。不过，如果有更多关于当地文化背景的介绍就更好了，这样能让读者更加深入地了解这些历史遗迹背后的故事。,1742596770
350,5,11,,这篇《秦皇岛海上运动海滨攻略》非常实用！攻略详细介绍了秦皇岛的各种水上活动和海滩风情，对于喜欢冲浪、帆船等户外运动的朋友来说是个宝藏。,1742531251
351,22,172,,这篇游记详细描绘了秦皇岛的自驾乐趣，风景优美，推荐线路合理。不过，如果能加入一些当地美食和特色小店的介绍就更完美啦！这样的分享对计划前往的朋友非常有帮助，期待作者更多精彩内容！,1742702903
352,87,24,24.0,这篇游记生动描绘了北戴河海滨的独特魅力，从细腻的海浪声到绵延的沙滩，每一处景致都让人流连忘返。建议作者可以分享更多关于当地海鲜美食的信息，相信会给准备出行的朋友更多的参考和惊喜！,1742840378
353,97,95,,这篇《秦皇岛自驾游攻略》非常实用！详细介绍了沿途风景和必去景点，还贴心提醒了路况和停车问题。对于像我这样的自驾游新手来说，是一份很好的参考指南。建议增加一些美食推荐，比如当地海鲜特产的介绍，这样能更好地让旅程丰富多彩。,1742008492
354,54,10,10.0,这篇游记生动描绘了秦皇岛的美丽海岸线。作者不仅分享了沿途的风景美照，还详细介绍了当地的美食和人文故事，让人仿佛身临其境。不过，如果能加入一些实用的小贴士，比如最佳游览时间或交通信息，会更有助于其他旅行者安排行程。期待你更多的精彩分享！,1741702001
355,43,38,,这篇《秦皇岛科普活动亲子攻略》游记非常详尽，为家长和孩子们提供了丰富的科普知识和趣味活动。建议增加一些当地特色美食推荐，这样能让旅程更加丰富多彩，更加吸引家庭游客。总体来说，是一篇值得收藏的实用攻略！,1741784275
356,30,90,,这篇游记生动地描绘了碣石山的壮美景色。作者不仅详细记录了沿途的风景变化，还分享了许多实用的游览建议和小贴士。特别是关于最佳观景点的选择，让读者仿佛身临其境。,1742497202
357,76,58,,读罢这篇《我的秦皇岛海滨漫步之旅》，仿佛亲身走过了那一片细腻柔软的沙滩。作者生动描绘了海浪拍打岸边、鸥鸟翱翔的景象，令人心驰神往。建议可以在文中加入更多关于当地美食和人文风情的介绍，让读者更加全面地感受秦皇岛的魅力。期待更多的旅行分享！,1741880768
358,10,28,,这篇关于秦皇岛山海关古道的自驾游攻略非常实用！详细介绍了沿途的历史文化和风景名胜。不过如果能增加一些美食推荐就更完美了，毕竟自驾旅行中找吃的也是乐趣之一。期待作者后续更新更多有趣的内容！,1741647782
359,88,21,,这篇《如何玩转秦皇岛的海滨漫步》游记详细介绍了秦皇岛的美景和游玩攻略，非常实用。特别是对于喜欢海边的人，推荐尝试日落时分的海畔散步，美不胜收。不过文中提到的个别餐饮店信息已经更新了，希望作者能及时补充最新资讯，方便更多旅行者。,1741665402
360,68,73,73.0,这篇游记详细介绍了秦皇岛的海钓乐趣和海滨风光，对初次体验的朋友非常有帮助。不过，如果能增加一些具体装备推荐和个人技巧分享就更好了。对于资深钓友来说，这样的细节会更有价值，也能让更多人爱上这项运动。,1742492747
361,14,9,9.0,这篇《秦皇岛夏日乐趣避暑攻略》真是诚意满满！详细介绍了如何在秦皇岛享受清凉一夏，从海滩玩沙到海鲜美食，再到夜景游玩，每一项活动都让人跃跃欲试。不过，如果能加入一些关于夏季防晒和防蚊的小贴士就更好了，这样小伙伴们就能更安心地享受夏日乐趣啦！,1742464897
362,29,126,275.0,这篇《秦皇岛海滨漫步海滨攻略》真的值得一读！作者详细介绍了秦皇岛的海岸线美景和隐藏的小众景点，让我对这个海滨城市充满了期待。建议可以增加一些实用贴士，比如最佳观潮时间和交通信息，这样对计划前往的朋友会更有帮助。,1742769386
363,97,185,,读罢这篇《秦皇岛的古城风貌文化》，仿佛身临其境，感受到了那份古朴与现代交融的独特魅力。文中对山海关历史文化的描绘生动细腻，令人印象深刻。不过，若能增加一些个人体验分享和实用旅行贴士，相信会吸引更多读者。期待作者未来带来更多精彩的游记！,1742763464
364,20,47,,这篇游记《记录秦皇岛的美食之旅》详实地介绍了秦皇岛的特色美食，让人心生向往。尤其是对海鲜的描述，让人仿佛能闻到海的味道。不过，如果能加入一些当地人推荐的小吃和隐藏菜单，会更加全面。适合准备旅行的朋友参考！,1742591570
365,79,193,,这篇游记以细腻的笔触描绘了秦皇岛的夏日风情。作者不仅分享了寻找避暑胜地的小窍门，还推荐了几处隐藏美景。对于喜欢探索海滨风光和体验当地文化的旅行者来说，非常有参考价值。不过，若是能加入一些亲身体验的故事或趣事，可能会让整篇游记更生动有趣呢！,1741866751
366,41,160,,这篇游记生动描绘了秦皇岛的亲子旅行体验，让人感受到家庭出游的乐趣。建议增加一些关于当地特色美食的介绍，这样不仅能让读者了解美景，还能满足味蕾，为下一次旅行提供更多参考。总体来说，是一篇值得一读的好文章！,1741639037
367,51,152,330.0,这篇游记详细描绘了北戴河的海景魅力，让人仿佛身临其境。文中不仅介绍了最佳观景点和拍摄技巧，还分享了一些实用的小贴士，对计划前往的朋友非常有帮助。不过，如果有更多的个人体验或感受就更好了，比如某个特定时刻的独特风景或者与人共游的美好回忆。,1742503360
368,44,178,,这篇游记生动地描绘了秦皇岛海鲜的鲜美与多样性。作者不仅分享了各种海味的独特风味，还贴心地介绍了购买和品尝的小技巧，对于像我这样的旅行新手来说非常实用。不过，如果能加入一些当地的特色餐馆推荐就更好了，这样我们就可以在旅途中更好地享受美食之旅。,1742392048
369,33,114,114.0,这篇《秦皇岛海风吹拂避暑攻略》真不错！详尽介绍了秦皇岛夏季游玩的好去处，如老龙头、渔岛等。不过，如果能增加一些交通和餐饮方面的信息就更完美了。推荐给正在寻找清凉一夏的朋友们！,1741657395
370,68,108,,这篇游记生动描绘了秦皇岛湿地的自然美景和丰富的鸟类生态。作者细致入微地记录了每一次观鸟的经历，让人仿佛身临其境。对于喜欢自然风光和摄影的旅友来说，这里不仅提供了绝佳的观鸟机会，还能近距离感受大自然的魅力。,1742514514
371,63,54,287.0,这篇游记生动描绘了秦皇岛海滨乐园的迷人风光和亲子乐趣。作者不仅详细介绍了各种游乐设施，还分享了宝贵的游玩经验和注意事项，对于计划家庭旅行的朋友非常有参考价值。建议多拍些照片记录下孩子的笑脸，这样回忆起来更温馨。,1742001472
372,43,72,,这篇游记生动描绘了秦皇岛黄金海岸的迷人景色。沙滩细腻柔软，海风轻拂，美不胜收。作者详细记录了海边漫步、日落观赏的经历，为其他旅行者提供了宝贵的参考。,1742859627
373,68,26,,这篇游记生动描绘了秦皇岛黄金海岸的美丽风光和丰富活动，让人仿佛身临其境。不过，如果能加入一些关于最佳旅行时间的小贴士就更好了，这样准备出行的人可以更好地享受旅程。总体来说，是一篇值得推荐的好文章！,1742764872
374,58,170,170.0,这篇《秦皇岛海鲜大餐美食攻略》非常实用！作者不仅详细介绍了各种特色海鲜的做法和风味，还贴心地推荐了几家口碑极佳的餐厅。对于像我这样的海鲜控来说，简直就是一场味蕾盛宴。,1741845459
375,25,175,,这篇游记生动描绘了秦皇岛丰富的历史遗迹，让人仿佛身临其境。作者不仅介绍了北戴河海滨的美丽风光，还详细讲述了老龙头、山海关等古迹的历史背景，令人深受启发。,1741784569
376,74,122,,这篇《我的秦皇岛自驾体验之旅》真是让人羡慕！作者不仅详细记录了沿途风景，还分享了许多实用攻略。不过如果能加入一些当地特色的美食推荐就更好啦，这样读者们不仅能欣赏美景还能品尝美味，完美契合一次旅行的双重享受。,1742361139
377,34,139,319.0,这篇游记生动地描绘了秦皇岛海滨乐园的魅力，特别是那里的亲子设施和海景让人心旷神怡。不过，作者提到的人流高峰时段有些拥挤，建议避开节假日，选择工作日出行，能更好地享受游玩的乐趣。整体来说，这是一篇值得参考的好游记！,1741611039
378,25,112,,这篇《秦皇岛的避暑山庄体验》游记真是让人向往！作者详细描绘了秦皇岛避暑山庄的美景和历史底蕴，以及当地的风土人情。不仅有优美的风景描写，还有实用的游玩攻略和美食推荐，对于计划前往的朋友非常有帮助。,1742239821
379,73,66,,这篇游记详细介绍了秦皇岛黄金海岸的美景和特色。沙滩细腻柔软，海水清澈碧蓝，真的是个放松的好去处！不过，文中提到人多时会有些拥挤，可以考虑避开节假日错峰出行，享受更加宁静的海滩时光。总体来说，推荐给喜欢海景和自然风光的游客。,1742363436
380,57,72,,这篇游记生动描绘了秦皇岛黄金海岸的美丽景色，让人仿佛置身其中。细腻的文字不仅记录了海滩、礁石和蓝天白云的壮丽景象，还分享了当地的风土人情，为读者提供了一份详尽而感性的旅行指南。,1742602817
381,64,4,,这篇游记详细描绘了秦皇岛日落时分的绝美风光。作者不仅分享了最佳观景点的选择，还贴心地给出了拍照技巧和时间安排建议，非常适合打算探访的朋友参考。不过如果能加入一些当地的特色美食推荐就更完美啦！这样的补充能让旅程更加丰富多彩。,1742791018
382,45,139,139.0,这篇游记生动描绘了秦皇岛海滨乐园的美景和乐趣。作者分享了许多实用信息，比如最佳游玩时间和交通方式，对于带孩子出行的家庭非常有参考价值。不过，如果能增加一些关于如何应对大风天气或海浪的小贴士就更好了。整体来说，是一篇值得推荐的好文！,1741953207
383,92,8,8.0,这篇游记详细介绍了秦皇岛的扇贝烧烤美食，不仅让人垂涎欲滴，还提供了实用的就餐推荐。不过，如果能加上一些亲自品尝的心得或者与其他地方对比的小贴士就更好了，这样读者不仅能了解到哪里好吃，还能学到如何更好地享受这一美味。,1742587734
384,88,7,7.0,这篇《秦皇岛夏日乐趣避暑攻略》真是让人眼前一亮！文中不仅详细介绍了秦皇岛的海滩风光和海鲜美食，还贴心地分享了避暑的好去处。不过，如果能多些关于夜游的推荐就更好了，比如海边的夜间活动或者特色小吃店。,1741646324
385,90,95,,这篇关于秦皇岛自驾游的攻略非常实用！作者不仅详细介绍了沿途风景，还贴心地提醒了交通情况和停车问题。对我计划暑假自驾游的朋友帮助很大。唯一建议是增加一些美食推荐，这样就能兼顾味蕾享受啦！强烈推荐给准备前往秦皇岛自驾游的朋友们！,1742444676
386,10,166,166.0,这篇游记生动描绘了北戴河海滨的美景和魅力，让人仿佛身临其境。作者不仅详细介绍了当地的海滩、美食，还分享了一些实用的小贴士，非常值得参考。不过，如果能加入一些关于当地风土人情的描述就更完美了，这样会让文章更加丰富多彩！,1741611205
387,95,105,,这篇游记详细介绍了秦皇岛的小吃文化，让人垂涎欲滴。特别是提到了海鲜饺子和炸酱面的做法，让我对这里的传统风味有了更深的认识。不过，如果能加入一些个人体验或者推荐最佳品尝时间会更好哦！这样的建议对于准备前往的旅行者非常有帮助。,1741646292
388,72,103,349.0,这篇游记生动描绘了秦皇岛的历史韵味，从老街巷到海边古堡，每一处都充满了故事。作者不仅带领我们一同领略了那些历史遗迹的美丽，还分享了许多实用的旅行小贴士，让计划前往的朋友更有信心。,1741609452
