id,user_id,post_id,parent_id,content,create_time
1,50,1,,这篇游记生动描绘了秦皇岛港的历史变迁，让人仿佛穿越时空。作者不仅介绍了丰富的历史文化背景，还分享了许多实用的旅行小贴士，如最佳游览时间、美食推荐等，非常适合计划前往的朋友参考。不过，如果能加入更多个人体验和感受就更完美了！,1741812225
2,66,2,,这篇游记生动地描绘了秦皇岛日落的美丽景色，让我对当地的夕阳美景充满了向往。作者不仅分享了最佳观赏点和拍摄技巧，还提醒游客要注意安全，选择合适的时间出行。,1742365107
3,72,3,,这篇游记生动描绘了秦皇岛的古迹魅力，特别是秦始皇东巡的遗迹。文章不仅让人感受到历史的厚重，还详细介绍了当地的美食和风土人情，非常适合计划前往的朋友参考。不过，如果能加入一些个人体验或建议，比如最佳游览时间和注意事项，会更加实用。（约97字）,1741870242
4,74,4,,这篇游记详细介绍了秦皇岛日落的独特魅力，让人仿佛身临其境。作者不仅捕捉到了夕阳西下的壮丽景色，还分享了许多实用的小贴士，如最佳观赏时间、拍照技巧等。不过，如果能加入一些当地特色小吃的推荐，相信会更加完美，让旅行体验更丰富。,1742010065
5,24,5,,这篇游记生动描绘了秦皇岛海边的无限乐趣！作者详细介绍了冲浪、帆船等海上活动，不仅让读者感受到了海风拂面的畅快，还分享了实用的小贴士。对于渴望探索海洋奥秘的旅行者来说，是一份不容错过的好指南。,1741822569
6,2,6,,这篇游记详细介绍了鸽子窝公园的独特魅力，让人仿佛置身于蓝天白云下的壮丽海岸。文章不仅分享了美丽的风景照片，还提供了实用的游玩建议和美食推荐，非常适合准备探访秦皇岛的旅行者参考。不过，如果能加入一些个人体验或感受，会更加吸引人哦！,1742554264
7,96,7,,这篇《秦皇岛夏日乐趣避暑攻略》确实让人眼前一亮！不仅介绍了丰富的游玩项目和美食推荐，还贴心地提醒了避暑的小技巧。对于像我这样的旅行新手来说，简直是完美的暑期度假指南。不过，如果能加入一些当地居民的生活点滴或者更多关于海滩安全的信息就更好了。,1741910102
8,51,8,,这篇游记详细介绍了秦皇岛的扇贝烧烤美食，味道鲜美，做法独特。尤其是炭火烤制的方式，让人回味无穷。不过文中提到的价格有些偏高，或许可以增加一些性价比更高的推荐选项，让旅行者有更多选择。适合寻找海鲜美食的旅游爱好者参考！,1742582664
9,6,9,,这篇《秦皇岛夏日乐趣避暑攻略》确实很实用！文中不仅详细介绍了各种消暑的好去处，还贴心地推荐了当地的美食和夜生活。尤其喜欢作者对老龙头的描述，让人仿佛身临其境。,1741949963
10,5,10,,这篇《记录秦皇岛的海滨漫步》真是一篇引人入胜的游记！作者生动描绘了秦皇岛的海滩风光和独特魅力。漫步在细腻的沙滩上，欣赏着壮丽的日落，让人仿佛置身于一幅动人的画卷中。,1742575372
11,14,11,,这篇《秦皇岛海上运动海滨攻略》真是干货满满！不仅详细介绍了各种水上活动，还贴心分享了最佳游玩时间和装备推荐。不过，希望能加入一些当地美食的推荐，让这次旅行更加完美。期待着按着这份攻略去体验一番！,1742708674
12,27,12,,这篇《如何玩转秦皇岛的海景摄影》游记详细介绍了拍摄技巧和最佳时间地点，非常实用！不过，如果能加入一些个人创意的照片分析就更完美了。另外，建议增加关于天气对摄影影响的部分，这样初学者可以更好地把握时机，拍出震撼海景照片。,1742435181
13,46,13,,这篇游记生动描绘了秦皇岛壮丽的海岸线风光。作者详细分享了拍摄技巧和心得，对旅行者极具启发性。建议增加一些当地特色美食的介绍，让读者更好地体验海滨风情。整体而言，是一篇值得一读的好文章！,1741992693
14,99,14,,这篇游记生动地描绘了老龙头景区的历史风貌和自然美景，让人仿佛身临其境。作者不仅详细介绍了景点特色，还贴心分享了游玩路线及注意事项，对喜爱秦皇岛的游客非常有帮助。只是希望以后能加入更多个人体验或感悟，让文章更加丰富多彩。,1742749764
15,86,15,,这篇《记录秦皇岛的亲子时光》游记真是温馨又实用！作者详细分享了当地的美食、游玩项目和交通信息，让家人出行更加轻松。不过，如果能多介绍一些隐藏的小众景点，想必会更吸引人呢。期待下次与家人再次踏上这片美丽的海岸线！,1742370645
16,89,16,,这篇《秦皇岛沙滩玩耍亲子攻略》非常实用！文中详细介绍了秦皇岛的海滩特色和亲子活动，还特别提到了几家适合家庭的餐厅。不过，如果能加入一些关于防晒和急救的小贴士就更好了。毕竟阳光强烈，安全第一嘛。推荐给准备带孩子来海边游玩的家庭参考！,1742034368
17,70,17,,这篇游记生动地描绘了秦皇岛渔岛风景区的美丽风光。作者细腻地捕捉到了海风、沙滩和夕阳的美好瞬间，让人仿佛身临其境。不过，如果能加入一些实用信息，比如最佳游玩时间和交通指南，就更完美了。这样的细节对计划前往的朋友非常有帮助！,1742059823
18,64,18,,这篇游记生动地记录了作者在秦皇岛的一日游经历，特别是对军事历史的兴趣让人印象深刻。建议增加一些个人感想和互动体验的描述，比如参观时的心得或是与当地居民交流的故事，这会让文章更加立体有趣。适合计划相似行程的朋友参考！,1741926183
19,84,19,,这篇《秦皇岛渔岛风景区景点推荐》游记详细介绍了渔岛的美景和特色活动。文中提到的海底世界、沙滩漫步和海鲜美食都令人向往。不过，作者似乎对岛上部分设施维护不够满意。,1742541422
20,33,20,,这篇《秦皇岛夏日乐趣避暑攻略》真是让人眼前一亮！作者详细介绍了秦皇岛的海滩、美食和夜景，让人仿佛置身其中。不过，如果能增加一些关于夏季海滩安全的小贴士，就更完美了。总之，强烈推荐给正在计划暑期旅行的朋友！,1742727413
21,91,21,,这篇游记生动地描绘了秦皇岛的海岸风光和独特魅力。作者不仅分享了详细的路线规划，还贴心推荐了几处必去的景点。不过，如果能加入一些关于季节变化对海滨景色影响的小贴士会更好，这样不同时间出行的朋友也能获得实用信息。,1741893825
22,79,22,,这篇游记详细描绘了秦皇岛渔岛的迷人风光，对于想要探索这片海域美景的旅行者来说非常实用。文中的摄影技巧和路线规划也非常值得借鉴。不过，如果能加入一些关于当地特色海鲜的小贴士就更好了，相信会给读者带来更多的惊喜！,1741833823
23,33,23,,这篇游记生动描绘了秦皇岛渔民的独特文化和悠久历史。作者细腻地记录了渔村的生活场景和传统习俗，让人仿佛身临其境。不过，如果能增加一些当地美食的介绍就更好了，这样能让读者更有食欲地探索这个海滨城市。,1742632965
24,90,24,,这篇游记生动描绘了北戴河海滨的美景，让人仿佛置身于海风中。文中的摄影技巧也让读者直观感受到秦皇岛的独特魅力。不过，如果能加入一些关于当地美食和特色活动的介绍就更好了，这样旅行规划会更加全面丰富！适合热爱自然风光与海鲜美食的旅游爱好者参考。,1741693976
25,16,25,,这篇游记生动地描绘了秦皇岛当地的美食文化，从海鲜到面食，每一道菜品都让人垂涎欲滴。作者不仅介绍了食材的选择和烹饪技巧，还分享了与当地人的交流故事，增加了游记的真实感。,1742705419
26,45,26,,这篇游记详细描绘了秦皇岛黄金海岸的美景，让人仿佛身临其境。文章不仅介绍了海岸线的壮丽风光，还贴心地推荐了几处隐蔽的观景台和美食店，非常适合计划前往的朋友参考。不过，如果能加上一些个人体验或注意事项，内容会更加丰富有趣哦！,1742469186
27,11,27,,这篇游记详细记录了在秦皇岛的一次难忘亲子露营经历。作者不仅分享了精致的营地布置和美味的食物，还提及了海滩附近丰富的野生动植物观察机会，让孩子们亲近自然。强烈推荐准备家庭户外活动的人参考，但记得提前检查天气预报，确保行程顺利！,1742098038
28,27,28,,这篇《秦皇岛山海关古道自驾游攻略》非常实用！作者详细介绍了沿途的历史文化景点和美食推荐，让自驾旅行更有意义。不过如果能增加一些路线规划的小贴士就更完美了。对了，自驾要注意天气变化哦，祝大家旅途愉快！,1741767517
29,64,29,,这篇游记生动描绘了秦皇岛港的历史韵味和现代风貌，让人仿佛亲临其境。作者不仅详细介绍了港口的发展历程，还分享了许多实用的旅行建议，如最佳游览时间和注意事项等，非常适合计划前往的朋友参考。,1742423875
30,39,30,,这篇《秦皇岛鸽子窝日出风光攻略》真是写得太精彩了！作者详细分享了观赏日出的最佳时间、注意事项和拍摄技巧，让人仿佛身临其境。不过，如果能增加一些当地特色美食的推荐就更好啦，这样旅行体验会更完整呢！,1742570661
31,6,31,,这篇游记生动描绘了在秦皇岛一日游中的独特经历。通过作者细腻的笔触，不仅让人仿佛身临其境地感受到了军港的魅力，还深入了解了那段厚重的历史。对于喜欢军事历史和寻求新奇体验的旅行者来说，是一次不容错过的旅程。,1742274475
32,90,32,,这篇游记生动地描绘了秦皇岛碣石山的壮丽景色。作者详细分享了登山路线和沿途风光，让人仿佛身临其境。不过，如果能增加一些关于季节变化对景点影响的内容就更好了，这样可以帮助计划不同时间出游的朋友更有针对性地准备。总体来说，是一篇值得推荐的好游记！,1742157395
33,95,33,,这篇《秦皇岛沙滩玩耍亲子攻略》真是让人眼前一亮！文中详细介绍了秦皇岛多个游玩胜地和注意事项，非常适合带孩子出游的家庭参考。不过，如果能加入一些关于季节选择的建议会更好，比如哪个时间段天气更适宜、海浪更温柔，这样可以让计划更加周全。,1742087806
34,99,34,,这篇《秦皇岛北戴河路线自驾游攻略》非常实用！详细介绍了景点分布、交通方式和必去之处。不过，如果能增加一些美食推荐就更好了，毕竟吃也是旅行的一大乐趣嘛。强烈推荐给准备自驾游的朋友！,1742732610
35,68,35,,这篇关于秦皇岛亲子露营家庭游的游记真是令人向往！作者不仅详细记录了沿途风景和营地环境，还分享了许多实用贴士，让准备带孩子出游的家庭受益匪浅。不过，如果能加入一些互动体验活动的介绍就更好了，比如篝火晚会或户外游戏，这样更能增加亲子间的乐趣。,1741863762
36,95,36,,这篇游记详实地介绍了秦皇岛海胆炒饭的独特风味和烹饪技巧，让人垂涎三尺。不过，如果能加入一些当地人推荐的餐厅信息就更好了，这样我们这些旅行者可以更容易地找到正宗的味道。期待更多美食探索分享！,1742555180
37,69,37,,这篇《秦皇岛当地小吃美食攻略》真是宝藏！作者详细介绍了多种特色美食和推荐的小吃店，让我对秦皇岛的风味有了更深入的了解。不过，如果能加入一些个人尝试后的点评，会更加生动有趣。期待未来有更多这样的实用攻略！,1742238685
38,86,38,,这篇《秦皇岛科普活动亲子攻略》真是干货满满！作者不仅详细介绍了适合家庭游玩的景点和项目，还贴心地分享了交通、住宿信息。不过，若能加入一些特色美食推荐就更好啦，这样不仅能让孩子玩得开心，还能让家长体验当地风情。强烈推荐给计划带孩子出游的家庭！,1742440926
39,92,39,,这篇游记生动地描绘了秦皇岛港的历史变迁，让我仿佛亲临其境。作者不仅介绍了港口的建筑特色，还分享了许多鲜为人知的故事，增加了游览的兴趣。,1742183016
40,10,40,,这篇游记详细介绍了秦皇岛当地的特色美食，让人垂涎三尺。作者不仅分享了每道菜的独特风味，还贴心地推荐了几家值得打卡的小吃店。对于热爱尝试各地美食的旅行者来说，这无疑是一份宝贵的指南。不过，如果能加入一些个人体验和感受会更加生动有趣哦！,1742502053
41,92,41,,这篇《我的秦皇岛海滨漫步之旅》游记真是让人向往！作者细腻地描绘了海风轻拂、沙滩细腻的场景，让人仿佛身临其境。不过，如果能加入一些关于当地特色美食和必去景点的介绍就更完美啦。这样的补充会让读者在旅行计划中更有灵感哦！,1741759075
42,29,42,,这篇游记生动地描绘了秦皇岛浓厚的民俗风情和独特魅力。作者细腻入微的观察让人仿佛身临其境，感受到了当地的渔家文化与海景之美。建议加入一些实用旅行贴士，比如最佳游览时间或推荐的小吃，会更有助于读者规划行程。总体来说，这是一篇引人入胜的好文章！,1742245431
43,12,43,,这篇《秦皇岛沿途美景自驾游攻略》真是让人眼前一亮！作者详细记录了从市区到北戴河、南戴河的每一处风景点，不仅路线清晰，还附带了许多实用的小贴士。对于想要深入了解秦皇岛的自驾游爱好者来说，是一份不可多得的好资料。,1742286632
44,54,44,,这篇《秦皇岛的亲子露营家庭游》游记生动有趣，为读者详细介绍了秦皇岛周边适合亲子活动的露营地。作者不仅分享了露营装备的选择经验，还贴心地提供了户外安全须知和亲子互动游戏的小贴士，让人仿佛身临其境。,1742188186
45,87,45,,这篇游记生动地再现了秦皇岛一日游的魅力。作者详细介绍了“天下第一关”的历史背景和壮丽景观，让读者仿佛身临其境。建议可以增加一些个人体验或趣事分享，会更吸引人。总体来说，对于计划前往的朋友非常有参考价值！,1741749513
46,55,46,,这篇游记生动描绘了秦皇岛螃蟹节的热闹景象和美食体验，让人垂涎三尺。不过如果能加入一些当地蟹宴的历史背景和个人品尝心得就更好了，这样会更有代入感。期待作者下次分享更多精彩旅行故事！,1742554679
47,10,47,,这篇游记生动描绘了秦皇岛的美食风情，让人仿佛置身其间。特别是对于海鲜类的详细介绍，让人口水直流。不过，如果能加入一些当地的特色小吃和饮品推荐就更好了，这样读者在旅行时可以更全面地体验当地文化。期待作者分享更多精彩内容！,1742863967
48,74,48,,这篇游记详细介绍了老龙头景区的历史背景和游玩攻略。老龙头作为长城的一部分，不仅风景如画，还能感受到深厚的文化底蕴。建议增加一些关于最佳游览时间和天气情况的信息，这样更方便计划行程。强烈推荐！,1742768468
49,19,49,,这篇《秦皇岛一日游：体验古城风貌》游记描绘了秦山的雄伟和老龙头的历史魅力。作者细致入微地记录了从海滩漫步到古迹探访的过程，让人仿佛身临其境。不过，如果能增加一些关于当地美食的信息就更完美了！,1742182980
50,91,50,,这篇《秦皇岛动物园探秘亲子攻略》真是干货满满！详细介绍了园区布局、特色动物以及互动体验项目。对于带孩子出游的家庭来说，是一份难得的实用指南。不过，作者提到园区有时会有些拥挤，建议错峰出行或提前预约。,1742487382
51,44,51,,这篇游记生动描绘了秦皇岛丰富的明代遗迹文化，让人仿佛身临其境。作者不仅详尽介绍了山海关、角楼等古迹的历史背景，还分享了亲自探索的趣事与心得，非常值得参考。不过，若能增加一些实用的旅行小贴士，比如最佳游览时间或注意事项，则会更完美！,1742233356
52,86,52,,这篇游记详细介绍了秦皇岛的特色美食——海胆炒饭。文中不仅描述了海胆炒饭的独特风味和制作过程，还分享了几家值得一试的小吃店。对于喜爱海鲜且对尝试不同地方菜肴感兴趣的旅行者来说，这是一篇非常实用的推荐。,1741936508
53,38,53,,这篇《秦皇岛凉爽体验避暑攻略》真是好！文中详细介绍了秦皇岛的海滩风光和夏日清凉活动，让人仿佛置身其中。不过，如果能增加一些关于当地美食的信息就更完美了。推荐尝试当地的海鲜大餐，绝对是一绝！适合正在计划暑期旅行的朋友参考。,1742623825
54,80,54,,这篇游记生动地描述了秦皇岛海滨乐园的迷人之处。作者不仅分享了丰富的活动体验，还贴心推荐了几处隐蔽的好去处。对于想要逃离城市喧嚣的家庭来说，这里无疑是个好选择。不过，如果能提供更多关于最佳游玩时间及交通信息，那就更完美了！,1741762110
55,69,55,,这篇游记生动描绘了秦皇岛碣石山的壮丽景色，让人心驰神往。作者详细记录了登山的过程和所见美景，尤其是对怪石嶙峋、云雾缭绕的描写，令人印象深刻。建议增加一些实用信息，如最佳游览时间和交通方式，将更方便计划旅行的朋友。,1742156715
56,70,56,,这篇游记生动地描绘了秦皇岛动物园之旅的乐趣。孩子们在各种动物面前兴奋不已，而我也被那些精心设计的互动环节深深吸引。不过，如果能提前了解开放时间并合理安排行程，可能会更加完美。期待更多类似的旅行分享！,1741910647
57,69,57,,这篇《记录秦皇岛的自驾体验》游记真是生动有趣！作者详细介绍了沿途风光和当地特色美食，让人心驰神往。不过，如果有更多关于最佳季节出行、路线规划的小贴士就更好了。对于像我这样的自驾新手来说，非常实用。强烈推荐给正在计划秦皇岛自驾游的朋友！,1742104303
58,5,58,,这篇游记生动描绘了秦皇岛的海滨风光，作者细腻地捕捉了海风、沙滩和夕阳的变化，让读者仿佛身临其境。建议增加一些当地特色美食介绍，或者分享一些建议游玩的时间节点，这样更能激发旅行欲望。总体来说，这是一篇值得推荐的好文！,1741947307
59,87,59,,这篇关于《秦皇岛必吃的当地小吃美食》的文章真是让人垂涎三尺！文章不仅详细介绍了各种地道的小吃，还分享了每种食物背后的故事和制作方法。对于像我这样的旅行者来说，这简直就像是一个美味的指南，让我迫不及待想要再去一次秦皇岛，亲自品尝这些美味佳肴。,1742651538
60,40,60,,这篇《秦皇岛一日游：体验天下第一关》游记生动有趣，详细介绍了游览过程和感受。对于喜爱历史文化的旅行者来说，这是一篇很好的参考。建议增加一些实用信息，如开放时间、门票价格等，会更有帮助哦！,1741901021
61,45,61,,这篇《秦皇岛夏日乐趣避暑攻略》真的详细实用！不仅推荐了清凉海滩、美味海鲜，还贴心提醒了防晒防蚊的小贴士。不过，如果能加入一些亲子游玩项目的介绍就更好啦，这样带娃的家庭也能找到合适的玩法。期待下次亲自体验！,1741824633
62,65,62,,这篇游记生动描绘了老龙头景区的壮丽风光和深厚历史底蕴。作者不仅带我们领略了大海、长城交织的独特美景，还分享了许多实用的信息，如最佳游览时间和注意事项。对于计划前往的朋友来说，是一份宝贵的指南。,1742064446
63,89,63,,这篇游记生动再现了秦皇岛的历史魅力，从古老的长城到现代的城市风光，每一个景点都充满了故事。作者的文字富有感染力，让人仿佛身临其境。不过，如果能增加一些当地风土人情的介绍，或许会让旅程更加丰富多彩。推荐给正在计划探访东北海岸线的朋友！,1742014417
64,15,64,,这篇《秦皇岛停车指南自驾体验》游记非常实用，详细介绍了秦皇岛市区及周边景区的停车情况。对于自驾游的朋友来说是一大福音！不过如果能增加一些实时停车信息和APP推荐就更好了，毕竟有些停车场的信息可能会发生变化。期待更多这样的分享！,1742871226
65,17,65,,这篇《秦皇岛湿地观鸟风光攻略》真是让人眼前一亮！文中不仅详细介绍了秦皇岛湿地的自然景观，还贴心地分享了观鸟的最佳时间和注意事项。对于鸟类摄影爱好者来说，这简直是一份宝藏攻略。,1742809739
66,15,66,,这篇游记生动地描绘了秦皇岛黄金海岸的迷人风光。作者不仅详细介绍了各个景点的特点，还分享了实用的游玩贴士和美食推荐，对计划前往的朋友极具参考价值。不过，如果能加入一些个人经历中的趣事或挑战，会更加吸引读者，激发更多的共鸣哦！,1742126776
67,24,67,,这篇《秦皇岛的游乐场欢乐家庭游》真是让人充满期待！文中描述的家庭活动丰富多样，亲子互动环节温馨又有趣。不过，如果能增加一些关于如何避开高峰时段和节省费用的小贴士就更好了，这样我们全家也能更好地规划行程，享受更多乐趣。,1741683418
68,88,68,,这篇《秦皇岛海景摄影海滨攻略》真是干货满满！攻略中不仅详细介绍了拍摄的最佳时间、地点和技巧，还贴心分享了当地的美食推荐。对摄影爱好者来说，是一份非常实用的指南。不过，如果能加上一些关于交通信息和个人体验感想就更好了。,1742547040
69,60,69,,这篇《秦皇岛烤鱿鱼美食攻略》真是吃货的福音！详细介绍了几种烤鱿鱼的做法和推荐店铺，让人垂涎欲滴。不过如果能增加一些周边景点或游玩建议就更完美了，毕竟来秦皇岛除了品尝美食，还想探索更多有趣的地方嘛！,1742700558
70,78,70,,这篇《秦皇岛海滨度假避暑攻略》确实详实且实用！攻略中不仅介绍了秦皇岛的美景和美食，还贴心地规划了最佳出行时间和游玩路线。不过，如果能增加一些关于当地特色文化和历史的小贴士就更完美了。,1741768451
71,42,71,,这篇游记详细介绍了秦皇岛的海鲜市场美食，让人垂涎欲滴。尤其是烤生蚝和海蟹，新鲜程度让人口感极佳。不过文中对一些小海鲜的具体做法介绍较少，如果能增加这方面的内容就更完美了。推荐给正在计划海边美食之旅的朋友！,1742875363
72,99,72,,这篇游记生动描绘了秦皇岛黄金海岸的壮丽景色。细腻的文字让人仿佛身临其境，感受到了海风拂面、浪花拍岸的惬意。不过，如果能加入一些实用的信息，比如最佳游玩时间或是推荐的景点路线，将更有利于其他旅游爱好者计划行程。,1742439729
73,95,73,,这篇游记生动描绘了秦皇岛海钓的乐趣，对垂钓点的选择和装备准备给出了宝贵的建议。作者不仅分享了丰富的经验和技巧，还介绍了当地的美食和美景，为旅行者提供了全面的参考。,1741955628
74,46,74,,这篇《秦皇岛亲子露营亲子攻略》真是干货满满！文中不仅详细介绍了露营地的选择、必备装备清单，还贴心分享了安全须知和游玩技巧。特别是关于海滩活动的描述，激发了我的兴趣。不过，如果能加入一些亲子互动游戏的建议就更好了，让孩子们也能玩得开心。,1742769061
75,65,75,,这篇游记详细介绍了秦皇岛沙滩露营的点点滴滴，从装备选择到安全提示，每一步都写得生动具体。特别是对于初学者来说，这些经验和建议非常实用。不过，如果能加入一些个人体验和趣事就更好了，这样读起来会更有亲切感。,1741877288
76,12,76,,这篇游记生动地描绘了秦皇岛“天下第一关”的历史底蕴和壮丽风光。作者不仅介绍了山海关的历史沿革，还分享了许多实用的旅行贴士，对于计划前往的朋友非常有帮助。不过，如果能加入更多个人体验或感想，会更吸引其他游客的兴趣哦！,1741891704
77,63,77,,这篇游记生动地描绘了秦皇岛夏日的乐趣，从细腻的沙滩体验到丰富的海滨活动，都让人垂涎欲滴。特别是对于喜欢冲浪和潜水的朋友们来说，文章中推荐的地点尤为实用。,1742457851
78,80,78,,这篇游记深入介绍了秦皇岛丰富的节庆活动文化，从美食节到灯会，每一场活动都展现了当地浓厚的文化氛围。作者细腻地捕捉了每个节日的特色，让人仿佛身临其境。不过，如果能加入一些建议和注意事项，比如最佳旅行时间或交通指南，就更加完美了。,1742616381
