id,user_id,title,content,create_time,update_time,main_category
48,41,秦皇岛必去的老龙头景区景点,"《秦皇岛必去的老龙头景区景点》

初春时节，我们一家三口来到了河北省秦皇岛市的著名旅游景点——老龙头。这里不仅是历史文化的见证者，更是自然风光与人文景观的完美结合。一踏入这片古老而神秘的土地，仿佛穿越回了那段波澜壮阔的历史。

老龙头景区位于渤海之滨，是长城的重要组成部分之一。我们首先参观的是“南海第一关”，它见证了古代海上丝绸之路的辉煌。这里不仅有保存完好的城楼和箭楼，还有讲述着历史故事的雕塑群，让人在欣赏美景的同时也能感受到浓厚的文化氛围。站在城楼上，海风轻拂，波涛汹涌的大海尽收眼底，令人心旷神怡。

随后，我们沿着海岸线散步至“老龙头长城”。这段长城依山傍水而建，景色十分壮丽。沿着蜿蜒的石阶拾级而上，可以近距离欣赏到古人的智慧与创造力。站在高处远眺，可以看到一片蔚蓝的大海，仿佛能听见海浪拍打岩石的声音。",1742116585,1742400634,景点推荐
49,73,秦皇岛一日游：体验古城风貌,"《秦皇岛一日游：体验古城风貌》

秋风轻拂，阳光温暖，我们一家选择了一日游来探索秦皇岛的历史与文化。此次行程，我们把重点放在了“山海关”，这座见证了无数风云变幻的城市要塞上。

首先映入眼帘的是那座雄伟的山海关城楼，它不仅是中国古代军事防御工程的重要组成部分，更承载着厚重的历史记忆。穿过城门，古色古香的街道和店铺映入眼帘，仿佛穿越了时空隧道，回到了那个金戈铁马的时代。在这里，我们体验了传统手工艺制作，亲手体验了制陶的乐趣；还品尝了当地特色的海鲜美食，鲜美无比。

最令人难忘的是参观了老龙头长城，这里的海天一色与蜿蜒的城墙交相辉映，构成了独特的风景线。站在古老的城墙上，可以尽情欣赏壮丽的自然风光和历史遗迹。当夕阳西下，远处的海面泛着金光，更添了几分诗情画意。",1740827533,1741054198,历史遗迹
50,35,秦皇岛动物园探秘亲子攻略,"《秦皇岛动物园探秘亲子攻略》

初春时节，微风习习，正是全家出行的好时机。今天，我们决定探访秦皇岛动物园，这里不仅是一个观赏野生动物的乐园，更是亲子互动的绝佳去处。

一踏入动物园，就仿佛进入了一个生动的自然世界。首先映入眼帘的是猴山，小猴子们活泼可爱，时而跳跃嬉戏，时而攀爬玩耍，孩子们兴奋地尖叫着、欢呼着，与小猴子近距离互动，体验到了大自然的乐趣。随后我们来到熊猫馆，黑白相间的国宝大熊猫悠闲自得，憨态可掬的样子让全家人都忍不住笑了出来。

除了观赏动物外，动物园里还设有各种科普教育活动，如知识讲座和喂食体验等，寓教于乐的方式不仅增长了孩子们的知识面，也让大人收获满满。此外，园区内还有专门为小朋友设计的游乐设施，比如旋转木马、碰碰车等项目，让家长和孩子可以在享受游戏的同时放松心情。",1741699883,1741810482,家庭游玩
51,60,秦皇岛的明代遗迹文化,"《秦皇岛的明代遗迹文化——一场穿越时空的文化之旅》

当晨光初照，我踏上了前往秦皇岛的旅程。这次的目的地不仅仅是体验这座美丽的海滨城市，更是为了探寻它的历史遗迹，感受那积淀了几百年的时光故事。

首先映入眼帘的是山海关，作为中国明长城的重要关隘之一，这里不仅有古朴雄伟的城楼，还有着丰富的历史文化内涵。在这里，你可以和家人一起登高远眺，欣赏壮丽的海景与城池交错的美景；或是走进箭楼、望柱等历史建筑中，感受当年战争的风云变幻，体验那紧张而激动人心的历史氛围。

随后我们前往了老龙头景区，这里的长城遗址是明代长城东部唯一的出海口。登上古老的石阶，仿佛能够穿越回那段烽火连天的历史时期，感受那份英勇无畏的精神。在这里，你可以漫步在古老的城墙下，感受海风拂面的惬意；或者沿着海边小道行走，倾听海浪拍打岸边的声音。",1742310850,1742705263,历史遗迹
52,86,秦皇岛必吃的海胆炒饭美食,"《秦皇岛必吃的海胆炒饭美食》

在秦皇岛，一提到美食，就不得不提那令人垂涎三尺的海胆炒饭。这片美丽的海滨城市不仅风景如画，还藏着让人回味无穷的地方。带上家人一起来一场说走就走的旅行，感受大海的气息与美味的诱惑吧！

我们的行程从北戴河新村开始。这里被誉为“东方夏威夷”，沙质细腻柔软，海水清澈见底，漫步沙滩上，脚下的沙粒轻轻摩挲着肌肤，海风拂过面颊，带来丝丝凉爽，让人忘却城市的喧嚣。

午餐时分，我们来到了一家名叫“海鲜小聚”的小店。店主热情地招待了我们，并推荐了一道招牌菜——海胆炒饭。这是一碗普通的黄灿灿的白米饭，加入了新鲜捕捞的本地海胆、火腿丁以及葱花，用特制的海鲜酱料翻炒而成。当那独特的鲜香从锅中飘出，香气扑鼻而来时，我们已经迫不及待地开动了。",1742043559,1742321313,美食攻略
53,32,秦皇岛凉爽体验避暑攻略,"《秦皇岛凉爽体验避暑攻略》

随着夏日的炎炎热浪逐渐退却，秦皇岛成了我们全家期待已久的避暑胜地。这里不仅拥有碧海蓝天、柔软沙滩，还有丰富多样的游玩项目，让人在享受自然之美的同时，还能轻松打发时间。

一踏入北戴河海滨，清新的海风迎面扑来，夹杂着海水特有的咸香味道，瞬间驱散了都市的闷热。我和家人首先来到了被誉为“中华第一关”的北戴河山海关景区，沿着蜿蜒曲折的长城漫步，不仅感受到历史的厚重，还能在清凉的山间微风中休憩片刻。

随后我们前往了鸽子窝公园，这里有大片郁郁葱葱的树林和五彩斑斓的花海，孩子们可以尽情奔跑、嬉戏。家长们则可以在绿荫下野餐，享受难得的家庭时光。傍晚时分，漫步至观澜园附近的沙滩上，迎着徐徐海风，欣赏壮丽的日落美景，别有一番风味。",1741572441,1741885311,避暑胜地
54,31,带孩子去秦皇岛体验海滨乐园,"《带孩子去秦皇岛体验海滨乐园》

初夏时节，我们一家决定从繁忙的城市生活中暂时抽离出来，来到秦皇岛这座海滨城市享受一番亲子时光。这里的自然风光和丰富的游玩项目让我们收获颇丰。

刚抵达，便被蔚蓝的天空、柔软细腻的沙滩所吸引。带着孩子漫步在金黄色的沙滩上，孩子们兴奋地奔跑着，追逐着海浪留下的水迹，时不时捡起几颗贝壳作为纪念。我们选择了一家环境优雅的家庭旅馆安顿下来，随后驱车前往第一山公园。

第一山公园风景独特、历史悠久，是体验秦皇岛海滨风情的理想之地。我们在导游的带领下，游览了钟声悠扬的龙庆寺，参观了雕刻精美的碑林，还在古色古香的茶楼品茗聊天。这里不仅有丰富的历史文化底蕴，还有儿童乐园和拓展训练区，我们在这里尽情释放活力、挑战自我。",1740950282,1741094332,家庭游玩
55,31,秦皇岛的碣石山风光自然风光,"《秦皇岛的碣石山风光自然风光》

初夏时节，我和家人踏上了一场难忘的旅程——秦皇岛的碣石山之旅。这里不仅有如画的美景，还有丰富的户外活动，让人流连忘返。

刚进入景区，映入眼帘的是绿意盎然的山谷和郁郁葱葱的树木。沿着蜿蜒的小径前行，不时可以看到各种野生花卉点缀其间，微风吹过，花香扑鼻，令人心旷神怡。我们还特地选择了一个清晨，雾气还未散去，山间若隐若现，仿佛置身仙境一般。

我们的第一站是观景台，这里可以俯瞰整个碣石山的美景。站在高处远眺，远处连绵起伏的山脉和近处的翠绿森林在眼前交织成一幅美丽的画卷。在这里我们还体验了登山的乐趣，一路欢声笑语，不仅锻炼了身体，更增进了家人之间的情感交流。

最让人难忘的是，在山顶附近有一片开阔地带，这里是野餐的好地方。",1740337916,1740393116,自然风光
56,13,带孩子去秦皇岛体验动物园探秘,"《带孩子去秦皇岛体验动物园探秘》

夏日炎炎，一家人想要找个地方消暑又寓教于乐？秦皇岛的海港之滨，有着一处神奇的地方——秦皇岛野生动物园。这里不仅环境优美，设施齐全，更是孩子们探索自然、亲近动物的最佳选择。

一踏入园区，映入眼帘的是精心设计的景观和成群结队的小动物们。首先来到的是非洲草原区，斑马悠然自得地啃着草料，鸵鸟昂首挺胸地漫步，不远处还有凶猛的狮子在懒洋洋地晒太阳。孩子们兴奋地跑来跑去，时不时还发出“哇”的惊叹声。

继续向前进，来到了北极熊馆，这里不仅有憨态可掬的北极熊，更有海豹、企鹅等极地动物。特别是喂食时间，工作人员会带着小朋友们亲手给这些可爱的动物喂食，那种互动体验让孩子们既新奇又兴奋。",1741972392,1742231572,家庭游玩
57,52,记录秦皇岛的自驾体验,"《记录秦皇岛的自驾体验》

初夏时节，我们一家踏上了去秦皇岛的自驾之旅。在蔚蓝的大海面前，孩子们兴奋地尖叫着，我和妻子则享受着清新的空气与自然的美好。

抵达的第一站是鸽子窝公园，这里是一片绿意盎然的海滨景区。蓝天白云下，金黄的沙滩上孩子们追逐嬉戏，大人们或漫步海边，或在沙地上建造城堡。我坐在沙滩椅上，望着远方波涛汹涌的大海，思绪飘远。在这里，我们不仅收获了亲子时光的快乐，还感受着秦皇岛独特的海洋文化。

接下来的一站是北戴河野生动物园。园内绿树成荫，鸟语花香，各种各样的动物们在广阔的草地上自由奔跑。孩子们兴致勃勃地参观了大熊猫、金丝猴等国宝级动物，不仅增长了知识，也体验到了人与自然和谐共处的美好。

晚餐我们选择了一家临海的餐厅，在享受海鲜美味的同时，远处的晚霞映射在波光粼粼的海面上，美不胜收。",1742855385,1743199220,旅行日记
58,31,我的秦皇岛海滨漫步之旅,"《我的秦皇岛海滨漫步之旅》

在这个初夏时节，我和家人一起踏上了一段难忘的旅程——探访中国北方的海滨城市——秦皇岛。那里不仅有着细软的沙滩、湛蓝的大海，还有着丰富的历史文化与自然景观，让人流连忘返。

抵达的第一站便是鸽子窝公园，这里是欣赏大海美景的最佳去处之一。清晨，我们在这里散步，感受着清新的空气和微凉的海风拂面而过。远处的群山倒映在碧蓝的海面上，仿佛一幅生动的水墨画。沙滩上，孩子们追逐嬉戏，欢声笑语充满了整个公园。傍晚时分，我们在海边观看了那壮丽的日落，天边的云彩被染成了橘红色，美得令人窒息。

接下来我们又去了北戴河野生动物园，里面动物种类繁多，还有精彩的海豚表演，让全家人看得津津有味。小朋友们兴奋地在动物乐园里跑来跑去，与各种可爱的小动物近距离接触，体验了一把人与自然和谐共处的美好时光。",1742247214,1742285629,旅行日记
59,63,秦皇岛必吃的当地小吃美食,"《秦皇岛必吃的当地小吃美食》

初夏时节，我们一家人决定逃离喧嚣的城市，前往被誉为“北方的海南”的秦皇岛。这里不仅有着辽阔的海岸线，还有着让人垂涎三尺的小吃美食。

我们的第一站是北戴河区的鸽子窝公园，蓝天白云下，海浪轻拍岸边，景色宜人。在这里品尝了一顿热乎乎的海鲜煎饼，薄如蝉翼的饼皮中包裹着新鲜捕捞上来的鱼肉、小虾和葱花，每一口都是大海的味道。

沿着海岸线继续前行，来到了著名的南戴河海滩。我们在一家有着百年历史的老字号——“老渔家”，品尝了当地的烧烤美食。一盘盘烤鱼、烤扇贝、烤鱿鱼……每一种都香气四溢，肉质鲜嫩多汁。这里的海鲜烧烤不仅种类繁多，而且价格公道，让人吃得心满意足。

离开海滩后，我们又来到了山海关区的关城市场，在这里品尝了秦皇岛特色小吃——山海关驴肉火烧和烤鱿鱼串。",1741523012,1741672018,美食攻略
60,92,秦皇岛一日游：体验天下第一关,"《秦皇岛一日游：体验天下第一关》

在阳光明媚的一天里，我们全家驱车来到秦皇岛，首先游览了“天下第一关”的山海关。这里不仅是一个著名的旅游景点，更是中国历史的重要见证。

刚一踏入山海关景区的大门，迎面而来的是雄伟的城楼和厚重的历史气息。我们先参观了明代修建的山海关老龙头长城，这里是明长城的东部起点。在导游的带领下，沿着蜿蜒的石阶而上，脚下是蔚蓝的大海，耳边是呼啸的海风。站在平台上，可以清晰地看到那座古老的城堡，仿佛能听到历史的回声。

最令人难忘的是游览了“天下第一关”城楼。这座城楼建于明朝嘉靖年间，历经风雨沧桑，依然屹立不倒。它的名字来源于“一夫当关，万夫莫开”的典故，象征着这里不仅是军事要塞，更是中华民族抵抗外侮的象征。",1742668872,1743065100,历史遗迹
61,66,秦皇岛夏日乐趣避暑攻略,"《秦皇岛夏日乐趣避暑攻略》

盛夏时节，酷暑难耐。此时，秦皇岛的海风却带着一丝丝凉意，仿佛是大自然赋予我们的天然空调。这里不仅有清澈碧蓝的大海，还有着丰富多彩的活动和美丽的风景，是全家出游的好去处。

在北戴河海滨，你可以尽情享受海滩的乐趣。这里的沙质细腻柔软，海水清澈见底，即使是在炎炎夏日，也能感受到阵阵凉爽。孩子们可以在这里堆沙堡、捉小螃蟹；大人则可以在海边漫步，感受海风的轻抚和浪花拍打的声音。傍晚时分，还可以观看日落，天边的云霞与大海交融，将整个天空染成了金红色。

而如果你对海洋生物感兴趣，不妨去参观海底世界水族馆。这里有各种各样的海洋生物，从五彩斑斓的热带鱼到令人惊叹的大白鲨，每一个生命都散发着独特的魅力。在这里，全家人都能收获满满的知识和乐趣。

当然，秦皇岛还有许多其他值得一游的地方。",1740371652,1740431906,避暑胜地
62,78,带你游览秦皇岛的老龙头景区,"《带你游览秦皇岛的老龙头景区》

初夏的阳光正好，我们一行人来到了位于河北省秦皇岛市北戴河区东部海岸边的老龙头景区。这里不仅是自然风光的宝库，更是充满历史韵味的文化遗址，是家庭游玩的理想去处。

一踏入老龙头景区，首先映入眼帘的是那壮观的大海与蓝天相接的画面，令人心旷神怡。沿着海岸线漫步，脚下的沙滩细腻柔软，不时能捡到五彩斑斓的贝壳，孩子们兴奋地在海边嬉戏玩耍，欢声笑语不断。

来到景点的核心——老龙头景区，这里不仅有保存完好的古建筑群，还有丰富的历史文化展览。走进“田横城”，仿佛穿越回了古代，感受到了那股浓厚的历史气息；而龙回头处则是观景的最佳位置，站在巨石之上，可以远眺大海的壮阔，感受海风拂面的凉爽。

除了欣赏美景、了解历史外，在这里还可以参与一些互动体验活动。",1742522353,1742644198,景点推荐
63,4,探秘秦皇岛的文化遗产历史,"《探秘秦皇岛的文化遗产历史》

随着夏日的第一缕阳光洒在秦皇岛的海面上，一场探索之旅便悄然开启。这里不仅有蓝天白云下的碧海银滩，更有充满故事与沧桑的历史遗迹等待着我们去探寻。

首站是北戴河联峰山，这里是国家4A级旅游景区，也是近代中国著名的避暑胜地之一。登上山顶，不仅可以俯瞰整个秦皇岛的美景，还能在山脚下参观清东陵博物馆。虽然距离较远，但乘坐景区提供的免费观光车十分便捷。在这里，我们仿佛穿越回清朝年间，感受着当年皇帝与王公贵族们的奢华生活。

接下来是老龙头长城，它位于北戴河区东北端的老龙头镇附近，被誉为“中华第一龙”，是我国明代长城的东部起点。虽然历经沧桑，但依然保存完好。登上城墙，脚下的石板路仿佛在诉说着昔日的故事。在这里，你不仅可以徒步行走，还能体验骑马等刺激项目。

当然，秦皇岛的历史遗迹远不止于此。",1741066687,1741257690,历史遗迹
64,92,秦皇岛停车指南自驾体验,"《秦皇岛停车指南自驾体验》

亲爱的家人朋友们，你们好！今天我想和大家分享一下我们的自驾之旅——秦皇岛之旅。这次旅行不仅是对我家人的考验，也是对自我驾车技能的锻炼。秦皇岛这个海滨城市，有着数不尽的美景与乐事，而找到一个合适的停车位置更是必不可少的一环。

首先来到的是北戴河新区。我们选择了一个叫作鸽子窝公园的地方作为临时停靠点，这里不仅环境优美，而且停车区域宽敞，不用担心会找不到车位或者车辆被刮擦。鸽子窝公园以沙滩闻名遐迩，在晴朗的日子里，可以看见一排排帆船在海面上航行，孩子们则尽情地在海边嬉戏玩耍。

接下来是老龙头景区，这里是北戴河的必游之地之一。然而，要找到适合的停车位却是一大难题。我建议大家可以提前在线预订泊车位或者使用一些停车导航软件来帮助规划路线和寻找合适的位置。",1740481926,1740597003,自驾游攻略
65,67,秦皇岛湿地观鸟风光攻略,"《秦皇岛湿地观鸟风光攻略》

初冬的晨光微露，我和家人踏上了前往秦皇岛的旅程。作为北方的一颗璀璨明珠，秦皇岛以其独特的自然风光吸引了无数旅游者。这里不仅有壮丽的海岸线和美丽的海滨城市风貌，还有着丰富多样的生物资源，特别是那些隐匿于湿地深处的美丽鸟类。

来到秦皇岛，我们首选的是秦皇岛湿地公园。这里是观鸟爱好者的天堂，也是家庭游客体验自然的好去处。一进入园区，一股清新湿润的气息便扑面而来，仿佛置身于大自然的心脏之中。这里的植被茂密，湖水清澈见底，为各种鸟类提供了绝佳的栖息地。

我们沿着蜿蜒的小径前行，在观鸟区找到了几处适合观赏的最佳位置。借助公园配备的各种观鸟设备，我不仅看到了平时难得一见的灰鹤、大雁等大型鸟类，还近距离观察到了麻雀、黄鹂等小型鸟类的生活习性。",1740693770,1740954427,自然风光
66,62,秦皇岛黄金海岸景点推荐,"《秦皇岛黄金海岸景点推荐》

在炎热的夏日里，秦皇岛的黄金海岸如同一抹清新凉意，为家人带来无限欢乐。这次旅行，我们全家不仅体验了丰富的水上娱乐项目，还感受到了海洋文化的魅力。

一踏入沙滩，柔软细腻的沙粒仿佛让人心旷神怡。孩子们兴奋地奔跑着，寻找贝壳和海螺；大人们则坐在遮阳伞下享受阳光，远处传来欢声笑语，一片和谐欢乐的景象。海滩上还有各种儿童游乐设施，比如沙雕区、攀爬架等，为小朋友们提供了尽情玩耍的空间。

当然，沙滩上的活动远不止于此。我们尝试了冲浪板和帆船，体验了一把海上冒险的乐趣。海风拂面，波涛拍岸，让人忍不住一次次下水挑战。此外，在黄金海岸的最南端有一座灯塔，作为旅游景点之一，登塔可以俯瞰整个海湾的壮丽景色。

夜幕降临后，我们又来到了附近的海鲜市场，品尝了最新鲜美味的海产品。",1742684691,1743011806,景点推荐
67,24,秦皇岛的游乐场欢乐家庭游,"《秦皇岛的游乐场欢乐家庭游》

初夏时节，我们一行人来到了位于河北省东北部的海滨城市——秦皇岛。这里不仅风景优美，更有着充满欢声笑语的游乐场，成为了亲子旅行的理想之地。

一走进秦皇岛儿童乐园，孩子们就被各式各样的游乐设施所吸引。高高的旋转木马在轻快的音乐中缓缓转动着，仿佛带领我们回到了童年时光；而那座高达数十米的大摆锤则让人体验了一把心跳加速的感觉。此外，还有色彩斑斓的碰碰车、刺激有趣的过山车以及各种小型的游乐项目，总有一款能满足孩子们的好奇心和探索欲。

而对于父母来说，在这里也能够找到不少放松身心的机会。露天咖啡厅里，轻柔的音乐伴着微风拂面而来，可以一边品尝美味饮品，一边观看孩子们尽情玩耍；或者在附近的海滩上漫步，享受海风带来的清凉，感受大自然的魅力。",1742617595,1742753717,家庭游玩
68,58,秦皇岛海景摄影海滨攻略,"《秦皇岛海景摄影海滨攻略》

初夏的阳光温柔地洒在北戴河的沙滩上，轻风拂过，仿佛能听见海浪与海岸间的呢喃。作为一个热爱自然与摄影的家庭游客，这次我们选择了秦皇岛作为我们的海边体验之旅。

一踏上海滩，便被那无边的蔚蓝所吸引，细软的沙子如棉花糖般在脚下轻轻弹起。孩子们兴奋地追逐着海浪，欢声笑语充满了整个海岸。大人则找了一块平坦的地方铺开野餐布，享受着夏日的闲适时光。

我们沿着海边漫步，寻找最佳的拍摄点。金黄色的沙滩与碧蓝的大海相互映衬，构成一幅壮丽的画面。当我们架起相机，捕捉下这些瞬间时，不仅记录下了美丽的风景，更留下了全家人的欢笑和幸福。

在傍晚时分，我们在一家临海的小餐馆品尝了当地特色海鲜大餐。新鲜的渔获搭配着地道的调味品，每一口都是大海的味道，令人回味无穷。",1742057898,1742306453,海滨体验
69,92,秦皇岛烤鱿鱼美食攻略,"《秦皇岛烤鱿鱼美食攻略》

初夏时节，我们一行人来到了被誉为“东方夏威夷”的海滨城市——秦皇岛。这里不仅风景如画，而且拥有着独特的烧烤文化，特别是那家在海边的小店，让我们的旅行增添了几分难忘的美味记忆。

一踏入这家名为“海浪鱿鱼吧”的小店，便被一股扑面而来的海鲜气息所包围。店内装饰简约而不失温馨，墙上挂着渔民出海捕鱼的场景画作，仿佛将我们带入了大海之中。这里的招牌菜——烤鱿鱼，令人印象深刻。鱿鱼经过精心挑选和烹饪，每一口都能品尝到海洋的味道，外焦里嫩、鲜美无比。

不仅如此，在这家店附近还有不少值得一游的地方。比如著名的北戴河鸽子窝公园，这里不仅有美丽的沙滩和海景，还能体验到丰富多彩的水上运动项目。傍晚时分，漫步在沙滩上，吹着海风，看着落日余晖洒满海面，那种宁静与惬意，让人仿佛忘却了都市的喧嚣。",1740634196,1740927422,美食攻略
70,63,秦皇岛海滨度假避暑攻略,"《秦皇岛海滨度假避暑攻略》

夏日炎炎，想要来一场清凉之旅吗？那就去秦皇岛吧！这里不仅有绵延不绝的海岸线，还有众多特色景点等待着您的探索。让我们一起走进这座美丽的城市，感受它独有的清凉与惬意。

从市区出发，沿着滨海大道驱车前行约半小时，您就会到达第一海滩。这里是秦皇岛最著名的避暑胜地之一，每年夏季都会迎来大批游客。海风轻拂，沙滩细腻柔软，碧蓝的海水波光粼粼，让人仿佛置身于世外桃源。您可以赤脚在沙滩上漫步，也可以带着家人一起玩沙、堆城堡。孩子们在这里追逐嬉戏，大人们则享受着海风带来的丝丝凉意。

除了海滩，您还可以前往老龙头景区感受历史的韵味。这里是明代长城的东起点，不仅可以观赏到壮观的长城遗址，还能欣赏到壮丽的海景。沿着石阶而上，一路上可以品尝当地的小吃和海鲜，为您的旅程增添一份别样的风味。",1740411628,1740838103,避暑胜地
