id,user_id,title,content,create_time,update_time,main_category
140,73,秦皇岛的长城文化文化,"《秦皇岛的长城文化之旅》

当晨光初破云层，我踏上了前往秦皇岛的旅程。这里不仅有蔚蓝的大海和细腻的沙滩，更有历经沧桑的长城遗迹。在这座海滨城市中，历史与现代交融，给我留下了深刻的印象。

抵达第一站——老龙头长城，迎面而来的雄伟风光令人震撼。这里是中国万里长城的一个重要组成部分，也是最东端的起点。“老龙头”之名正取自其形似龙首探入大海的独特景观。登上海边的长城，仿佛步入了一个时光隧道，感受到中国古代军事防御工程的伟大与壮丽。站在烽火台上远眺，海天一色、万里无云，令人心旷神怡。

在游览过程中，我还参与了“长城小卫士”的互动体验活动。通过模拟指挥和讲解员的指导，我仿佛穿越回那个时代的战场，感受到了古代将士们的英勇与智慧。这样的亲身体验不仅增长了知识，更让我对这段历史有了更深的理解和感悟。",1741749830,1742170859,历史遗迹
141,76,秦皇岛日落美景海滨攻略,"《秦皇岛日落美景海滨攻略》

当夕阳的最后一缕余晖洒在河北省秦皇岛市的海面上，整个海岸线都披上了一层金色的纱衣。在这里，你不仅可以尽情享受海滩的细腻与广阔，还能体验到一种难以言表的宁静与美好。

首先推荐的是北戴河，这片被誉为“东方夏威夷”的美丽海滨，是家庭游客的首选之地。在日落时分，漫步于金滩之上，脚下的沙粒如同细软的棉花糖，轻柔地包裹着每一步的足迹。孩子们追逐嬉戏在海浪中，欢声笑语为这宁静的海边增添了几分生机。

傍晚时分，你可以选择参加一场海滩瑜伽或是沙滩排球比赛，与家人一同享受户外运动的乐趣。活动结束后，在附近的海滨餐厅品尝一番地道海鲜，那鲜美的味道定会让你流连忘返。

沿着海岸线向前走，你会来到鸽子窝公园，这里不仅有精美的雕琢艺术作品展示着大海的壮观景色，还有许多关于海洋保护的小知识可以学习了解。",1740950145,1741181741,海滨体验
142,82,秦皇岛的黄金海岸自然风光,"《秦皇岛的黄金海岸自然风光》

来到秦皇岛，我们选择了一段难忘的旅程——探索那金色的沙滩与碧蓝的大海。在阳光的照耀下，这里仿佛是大自然最纯净的杰作。

初入黄金海岸，首先映入眼帘的是绵延不绝、金光璀璨的沙滩。细腻的沙粒轻柔地抚过脚底，让人感受到一种难以言喻的舒适与放松。在这里，孩子们可以尽情奔跑玩耍，大人们也可以席地而坐，享受着海风带来的清新和自由。

漫步海边，可以看到一排排整齐的遮阳伞和躺椅。这里是拍照留念的好地方，蓝天、白云、碧海、沙滩，构成了一幅美丽的画卷。此外，还有一些特色小吃摊位，可以品尝到新鲜美味的海鲜，是不可多得的美食体验。

当然，除了享受自然风光之外，黄金海岸还提供了许多有趣的活动项目。比如乘着脚踏船在海面上畅游，或是尝试冲浪，感受迎面而来的海风与波涛带来的刺激与兴奋。",1742591119,1742952452,自然风光
143,42,如何欣赏秦皇岛的北戴河海景,"《如何欣赏秦皇岛的北戴河海景》

在这个金秋十月，我和家人一同踏上了去往秦皇岛北戴河的旅程。在这里，我们不仅能够体验到自然风光的壮丽与宁静，还能感受到海边独有的细腻和温馨。对于追求亲近自然的家庭游客来说，这里无疑是一个放松身心的好去处。

一踏入北戴河，首先映入眼帘的就是那蔚蓝的大海。海水清澈见底，偶尔几只白鹭掠过水面，激起一圈圈的涟漪。我们沿着沙滩漫步，脚下的细沙软绵而温暖。孩子们则兴奋地在海边堆沙堡、捡贝壳，享受着童年的快乐时光。

除了自然风光外，北戴河还有许多可供家庭游客参与的活动。其中最推荐的是骑行。沿途可以看到美丽的海滩和远处连绵起伏的山丘，骑上自行车，在海风中穿梭，感觉非常惬意。傍晚时分，我们选择在海边的一家餐厅用餐，品尝着海鲜大餐，感受着日落的余晖洒满整个海岸线，那一刻所有的烦恼都烟消云散了。",1741040922,1741272558,自然风光
144,43,秦皇岛山海关古道自驾游攻略,"《秦皇岛山海关古道自驾游攻略》

金秋十月，我和家人一起来到了被誉为“人间仙境”的秦皇岛。这里不仅有绵延的海岸线、如画的山水风光，还有丰富的历史遗迹等待我们去探索。其中，我们特别选择了一条以自驾游的方式探访山海关古道。

清晨的第一缕阳光刚刚洒在海面上时，我们就驾车从市区出发，向北行进约30公里便来到了山海关。这里不仅是中国古代长城的重要组成部分，更是连接中国北方和南方的交通要塞，拥有着浓厚的历史文化底蕴。我们沿着蜿蜒曲折的石板古道漫步，感受着脚下每一块石头都承载的历史故事。

在游览了雄伟的关城后，我们还特意安排了一次骑行活动，在绿树成荫的小路上穿梭，两旁是金黄的秋叶和远处连绵起伏的山峦。沿途可以看到一些当地居民正在田间劳作，或是在自家小院中悠闲地喝茶聊天，一幅宁静和谐的画面展现在眼前。",1740740493,1740809183,自驾游攻略
145,37,如何在秦皇岛度过一个凉爽体验假期,"《如何在秦皇岛度过一个凉爽体验假期》

炎炎夏日，海风送爽。选择秦皇岛作为暑期游玩目的地，是一个明智的选择。位于河北省东北部的秦皇岛不仅拥有美丽的海滩，还有丰富的文化遗迹和自然景观等待着你的探索。

一早出发，驱车前往北戴河区。这里有长达数十里的金色沙滩，碧蓝的大海与蓝天白云交相辉映。带上家人一起漫步在柔软细腻的沙粒上，拾起海浪留下的贝壳，感受大海带来的清凉。沿着海岸线散步至联峰山公园，登上山顶可以俯瞰整个海滨风光，欣赏到“东临碣石”的壮丽景色。

午餐后前往鸽子窝公园，这里不仅是拍照打卡的好地方，还可以在专门的儿童乐园里玩耍。晚上，在海边看一场露天电影，享受海风轻拂，品尝海鲜美食，别有一番风味。此外，秦皇岛还有著名的山海关古迹，可以带孩子去走一走老城墙、感受历史文化的厚重。",1741529527,1741630177,避暑胜地
146,62,秦皇岛的黄金海岸自然风光,"《秦皇岛的黄金海岸自然风光》

初夏时节，我和家人一起踏上了前往秦皇岛的旅程。在渤海之滨的金色沙滩上留下足迹，在海风中尽情享受大自然赋予的美好时光。

一踏上黄金海岸景区的大门，眼前便豁然开朗。绵延数里的金黄色沙滩如同一条细腻柔软的地毯铺设于岸边，阳光与海浪交相辉映，美得让人心醉。我和孩子们在细软的沙子上追逐嬉戏，脚下的每一步都留下清晰的痕迹；爸爸和妈妈则漫步在海岸边，享受着轻柔的海风拂面。

沿着海滩前行不远便是“燕塞湖”，湖水清澈见底，鱼儿游弋其中，湖面上的野鸭悠闲自得。我们租了一艘小船，在碧波荡漾中畅游，感受微风带来的凉爽与清新。湖边还有许多亲水平台和木栈道供游客们休憩拍照。

傍晚时分，我们全家来到一家当地特色餐馆品尝海鲜大餐，新鲜的鱼虾贝蟹在厨师手中变得色香味俱佳。",1742455510,1742841430,自然风光
147,54,秦皇岛鸽子窝公园景点推荐,"《秦皇岛鸽子窝公园景点推荐》

初到秦皇岛，便被这座海滨城市的静谧之美所吸引。而今，我有幸走进鸽子窝公园，这里的每一寸土地都散发着自然的魅力。站在沙滩上，海风轻拂过脸颊，带来阵阵咸湿的清新气息。

鸽子窝公园位于河北省秦皇岛市北戴河区，是国家级海洋公园之一。这里不仅环境优美，而且适合全家人共同游玩。首先，不妨前往海滩漫步，感受脚下的细沙与海浪拍打的声音。沿着海岸线一路前行，可以看到一些礁石上栖息着各种鸟类，孩子们可以在这里享受一段难忘的观鸟之旅。

随后，我们来到了鸽子窝公园的核心区域——鸽子窝景区。这里以奇峰、怪石闻名遐迩，其中最为著名的是“仙人晒靴”。据说是古代仙人在山顶晾晒靴子的地方，周围布满了形态各异的岩石。攀爬山间的小径，一路风景如画，偶尔还能看到松鼠和各种鸟类。",1742707139,1742905150,景点推荐
148,18,秦皇岛的森林氧吧体验,"《秦皇岛的森林氧吧体验》

夏日炎炎，秦皇岛以其独特的自然风光和宜人的气候成为众多家庭游客心中的避暑胜地。一次偶然的机会，我和家人一起探访了位于秦皇岛郊区的一片茂密森林——金龙山森林公园。

踏入这片绿意盎然的世界，仿佛进入了一个天然的氧吧。郁郁葱葱的树木遮挡住了刺眼的日光，带来一片阴凉。沿着林间小径前行，两旁是不知名的野花竞相开放，色彩斑斓，空气中弥漫着清新的草木香。我们还看到了几只活泼的小松鼠在树上跳跃，时不时地停下来警惕地看看我们，这给我们的旅程增添了不少乐趣。

最吸引人的莫过于森林公园中那条蜿蜒曲折的登山步道了。这条山路不仅风景优美，而且挑战性适中，适合全家人共同探索。沿着山路拾级而上，沿途风光旖旎，每一处景致都让人流连忘返。",1740731219,1741086863,避暑胜地
149,3,如何在秦皇岛度过一个海滨度假假期,"《如何在秦皇岛度过一个海滨度假假期——走进避暑胜地》

当阳光洒满大地，海风轻拂耳畔时，秦皇岛成为了我们全家期待已久的避暑目的地。这里不仅有着美丽的沙滩，还有着丰富的活动和凉爽的气候，让我们得以享受一段难忘的时光。

抵达秦皇岛后，我们首先被那片绵延不绝的金色沙滩所吸引。金黄色的沙粒细腻柔软，在赤脚踏上时感觉格外舒适。海浪轻轻拍打着岸边，发出阵阵悦耳的声音。我们沿着海边漫步，寻找最佳的游玩地点——北戴河鸽子窝公园。这里的海滩特别适合儿童玩耍，他们可以尽情地在沙堆中挖掘、建造，甚至还可以尝试捉小螃蟹。

除了沙滩上的活动外，秦皇岛还有许多其他值得探索的地方。",1741269588,1741511590,避暑胜地
150,65,秦皇岛的凉爽体验体验,"《秦皇岛的凉爽体验》

在炎炎夏日，我和家人决定去秦皇岛寻找一份凉爽的慰藉。秦皇岛不仅是一个美丽的海滨城市，更是名副其实的避暑胜地。

我们首先来到了北戴河，这里有著名的鸽子窝公园和老虎石公园。鸽子窝公园是一片静谧的绿色空间，漫步其中，可以听到清脆的鸟鸣声和海浪拍打岸边的声音。这里也是观赏日出的好地方，当第一缕阳光穿透云层，将金色洒满整个海岸线时，那种震撼人心的美让人流连忘返。

接着我们去了老虎石公园，在这个公园里，可以看到一块巨大的岩石像一只老虎一样俯瞰着大海。夏天在这里戏水十分凉爽，孩子们在波浪间嬉闹，笑声回荡在空气中，给炎热的夏日带来无限乐趣。这里的沙滩很干净，适合家庭游玩。

午后我们前往了老君顶国家森林公园，这里是避暑的好去处。山林之间空气清新，温度较市区低很多。",1740576414,1740935963,避暑胜地
151,41,如何欣赏秦皇岛的森林公园,"《如何欣赏秦皇岛的森林公园》

在北方的海滨城市秦皇岛，有一个不为人熟知的宝藏之地——森林公园。在这里，不仅能感受到大自然的静谧与生机，还能体验到丰富的户外活动，是家庭游玩的理想选择。

步入公园，首先映入眼帘的是蜿蜒曲折的小径和绿意盎然的林间小道。这些树种丰富多样，从松柏、槐树到枫叶，每一棵树都像是自然界的守护者，静静地伫立在那里，讲述着自己的故事。孩子们可以在这里找到各种各样的植物标本，而大人们则会欣赏沿途的美景，感受大自然的魅力。

森林公园内设有多个休闲区域和体育设施，适合全家一起游玩。例如，公园中心有一片宽阔的草坪，周围环绕着清澈的小溪，是野餐的最佳地点；不远处还有一座小型湖泊，湖水碧绿如玉，偶尔可以看到几只小鸟在水中嬉戏。这里也是孩子们释放天性的乐园，在自然中探索未知的乐趣。",1740526170,1740835045,自然风光
152,50,如何欣赏秦皇岛的北戴河海景,"《如何欣赏秦皇岛的北戴河海景》

夏日炎炎，一场说走就走的旅行让人向往。近日，我和家人踏上了去秦皇岛北戴河的旅程。在这里，我们不仅领略了大海的魅力，更感受到了自然风光与家庭欢乐的完美结合。

一踏入北戴河景区的大门，迎面而来的海风中夹杂着淡淡的盐味，清新而又充满活力。海滩上，金色的沙粒在阳光下闪烁着光芒，波光粼粼的大海仿佛是一块巨大的蓝宝石镶嵌在蓝天之下。在海边漫步，孩子们欢笑着追逐浪花，大人们则席地而坐，享受着海风拂面的惬意。我们选择了租借一艘小船出海，迎着微风，随着海浪起伏摇曳。远处的帆影和近处的鸥群构成了北戴河一幅动人的画面。

傍晚时分，我们在景区内的观景台上欣赏了日落的美景。夕阳将天际染成了金红色，波光粼粼的海面上也反射着绚丽多彩的光芒。此时此刻，时间仿佛凝固，让人不禁感叹大自然的魅力与鬼斧神工。",1741501918,1741614838,自然风光
153,78,秦皇岛必吃的当地小吃美食,"《秦皇岛必吃的当地小吃美食》

来到河北省秦皇岛市，除了欣赏美丽的海滨风光和悠久的历史文化外，这里的地道美食也是不容错过的。对于带着孩子的家庭来说，这里的小吃不仅美味可口，而且价格实惠，非常适合在旅行中品尝。

首先推荐的是海鲜市场附近的海产品烧烤摊。新鲜的虾、蟹、扇贝在这里经过简单的腌制后，直接放在炭火上烤制。肉质鲜嫩多汁，配上当地的辣椒酱和蒜泥，让人回味无穷。特别是傍晚时分，坐在海边的木椅上享受着微风拂面，品尝着热腾腾的小吃，别有一番风味。

接着来到北戴河边的老街，这里的小吃更是琳琅满目。烤生蚝是这里的特色之一，将生蚝用特制的调料腌制后放在铁板上烤至金黄，口感鲜美；还有臭豆腐、煎饼果子等传统小吃，都是孩子们非常喜欢的食物。

当然，来秦皇岛怎么能不品尝一下当地的海鲜火锅呢？",1742221387,1742411617,美食攻略
154,80,如何规划秦皇岛的黄金海岸,"《如何规划秦皇岛的黄金海岸——自驾游攻略》

初夏，阳光正好，微风不燥。与家人一同出发，在驱车150公里后抵达了素有“北方亚特兰大”之称的城市——秦皇岛。这里不仅有着绵延24.3公里的金色沙滩，还有着令人向往的山海风情。

我们在海边找到了一处安静的停车场，停好车，放下行李，迫不及待地来到黄金海岸。脚下是细腻柔软的沙粒，仿佛能将脚印深深地烙在记忆中。不远处的海水碧蓝透明，几只小螃蟹在浅水区穿梭，孩子们兴奋地欢叫着跳进海浪里，尽情玩耍。

沿着海边栈道前行，不时可以看到一些老人悠闲地散步。沿途绿树成荫，鸟鸣声声，空气清新而湿润。我们还特意去了一次鸽子窝公园，公园内不仅有各种各样的鸟类，在这里还能看到不少造型独特的石头雕塑，让人流连忘返。",1741642222,1741688282,自驾游攻略
155,67,秦皇岛的海风吹拂体验,"《秦皇岛的海风吹拂体验》

夏日炎炎，当大多数人还在寻找一处清凉之地的时候，秦皇岛成了我们的首选。这里的海滨风光旖旎，是名副其实的避暑胜地。

一走进秦皇岛的景区，首先映入眼帘的是那无边无际的大海。天蓝与海蓝融为一体，微风轻轻吹过，带来阵阵凉意。我们漫步在沙滩上，脚下的沙子柔软细腻，不时还能感受到海浪轻拍岸边的节奏。海边的活动丰富多彩，孩子们可以尽情地堆沙堡、捉螃蟹；大人们则可以享受着大海赠予的清凉与宁静。

除了海滩，北戴河新区也是一个值得一去的地方。这里的树木郁郁葱葱，绿意盎然。沿着林间小道缓缓前行，清新的空气令人心旷神怡。更令人惊喜的是，在此还能看到成群结队的海鸟栖息于此，它们或低飞觅食，或在空中盘旋嬉戏，构成一幅生动和谐的画面。",1742279940,1742570017,避暑胜地
156,59,秦皇岛老龙头景区景点推荐,"《秦皇岛老龙头景区景点推荐》

初夏时节，我带着家人踏上了一段探寻历史文化的旅程。目的地是位于河北省秦皇岛市的著名景点——老龙头。这里不仅风景优美，还承载着丰富的历史文化，非常适合家庭出游。

一踏入老龙头景区，首先映入眼帘的是那壮观的长城。长城蜿蜒曲折，与碧海蓝天交相辉映，给人以强烈的视觉震撼。我们沿着青石铺就的小道缓缓前行，在这里可以感受长城的雄伟壮丽，还能聆听导游对这段历史故事的讲述。

除了欣赏美景外，孩子们在景区内的游乐设施也能找到乐趣。比如“飞翔体验馆”，通过先进的VR技术让孩子们仿佛置身于飞翔之中；还有模拟海盗船、过山车等项目，为孩子们带来刺激与欢乐。

最令人难忘的是傍晚时分，我们沿着海岸线散步。夕阳西下，海面上波光粼粼，远处的天空渐渐染上了一抹橙红。",1741454208,1741842479,景点推荐
157,67,秦皇岛采摘体验亲子攻略,"《秦皇岛采摘体验亲子攻略》

阳光温暖地洒在身上，我们一家四口踏上了前往秦皇岛采摘基地的旅程。这次旅行的目的不仅仅是欣赏美景，更是一次充满乐趣的家庭探险。

一进入采摘园，映入眼帘的是连片的果园和菜地。孩子们兴奋地跑向草莓田，迫不及待地想要品尝大自然的馈赠。我们选择了几个不同品种的草莓地，每一口都是甜蜜多汁的享受。在这过程中，我和妻子也加入其中，一边挑选，一边指导孩子如何分辨出又大又甜的果实。

除了草莓采摘，果园内还设有各种有趣的亲子活动。比如亲子套圈、农事体验等游戏项目。孩子们积极参与，脸上洋溢着纯真的笑容。尤其是参与了摘苹果和玉米的活动后，他们不仅了解了农作物的成长过程，也体会到了劳动的乐趣。

傍晚时分，我们来到了采摘园附近的一家农家乐，享受了一顿丰盛的农家宴。",1741778617,1741993955,家庭游玩
158,82,秦皇岛的碣石山传说历史,"《秦皇岛的碣石山传说历史——一次文化和探险之旅》

初夏的清晨，一行人踏上了探访秦皇岛的旅程。车窗外，绿意盎然，微风拂过，带来丝丝清凉与自然的气息。我们的目的地是有着悠久历史文化的碣石山。

碣石山位于河北省秦皇岛市，是一处集自然风光与人文景观于一体的著名旅游景点。一进入景区，便被其独特的山形地貌所吸引，奇峰怪石、古木参天，让人仿佛置身于世外桃源之中。更有那碧绿的溪流穿行其间，潺潺流水声宛如天籁之音。

我们首先参观了位于山顶上的碣石宫，这里曾是东汉时期曹操吟诵《观沧海》之处。站在高处俯瞰山下风光，不禁让人想起曹操“日月之行，若出其中；星汉灿烂，若出其里”的壮丽诗篇。随后，在导游的带领下我们沿着蜿蜒的小路深入山谷，穿过茂密的树林，到达一处刻有“碣石”二字的巨大岩石前。",1742546670,1742887590,文化探索
159,64,秦皇岛的明代遗迹文化,"《秦皇岛的明代遗迹文化》

在金秋十月，我们全家踏上了前往河北省秦皇岛市的旅程。这座城市不仅风景如画，更是拥有着悠久的历史与丰富的文化遗产。特别是那些保留完好的明代遗迹，让这里的每一砖一瓦都充满了历史的气息。

首站便是北戴河海滨的联峰山炮台遗址。这处历史悠久的军事防御工事，见证了明清时期抵御外敌入侵的英勇斗争。站在高高的炮台上，不仅能远眺波澜壮阔的大海，更能感受到那份历史的厚重与庄重。孩子们在炮位前嬉戏打闹，仿佛穿越回了那个战火纷飞的时代。

离开联峰山炮台遗址后，我们来到了老龙头长城脚下。这里是明代长城东部最南端的起点，也是中国乃至世界现存最早、规模最大的石筑长城之一。漫步于青砖砌成的城墙之上，仿佛能听到历史的低语。沿着蜿蜒曲折的城墙前行，每一处景致都充满了故事感，让人驻足流连。",1740553918,1740568223,历史遗迹
160,14,我的秦皇岛亲子时光之旅,"《我的秦皇岛亲子时光之旅》

在金秋十月的一天，我和家人踏上了前往秦皇岛的旅程。我们计划了一次充满乐趣与欢笑的家庭旅行，不仅想让我们放松心情，更希望通过这次旅行增进家庭之间的感情。

一进入秦皇岛市区，迎面而来的是一片蔚蓝的天空和清新的海风。驱车行驶在整洁的海滨大道上，沿途的高楼大厦和葱郁的树木交相辉映，美不胜收。我们迫不及待地来到鸽子窝公园，这是一个集自然景观与娱乐设施为一体的大型公园。孩子们兴奋地奔跑在草坪上，追逐着风筝；大人则坐在长椅上享受这份难得的宁静。

继续前行，我们来到了北戴河旅游区，在这里体验了冲浪、帆船等水上活动。碧海蓝天间，白色的帆船划过水面，如同精灵般轻盈飘逸。我与孩子一起尝试了冲浪板，尽管初次接触有些笨拙，但那种迎着海风、奋力向前的感觉让人兴奋不已。",1740996718,1741026197,旅行日记
161,72,秦皇岛海鲜大餐美食攻略,"《秦皇岛海鲜大餐美食攻略》

初夏时节，微风轻拂，带着丝丝凉意。这个周末，我们一家四口选择了一次说走就走的旅行——前往被誉为“东方夏威夷”的秦皇岛，探秘那里的美味佳肴与独特风情。

一踏进秦皇岛，便被这里的海天一色所吸引。清晨时分，在老街市场挑选新鲜的海鲜，龙虾、扇贝、海螺、螃蟹……品种繁多，令人眼花缭乱。我们决定在一家本地人推荐的小吃店品尝海鲜烤制，刚出炉的烤生蚝，鲜美无比，肉质饱满，让人忍不住连壳一起吞下。

午餐后，驱车前往鸽子窝公园游玩。沿着海边漫步，海风轻轻拂过脸庞，带来阵阵凉爽。中午时分，在一家临街的海鲜餐馆享用丰盛的大餐。餐馆老板是当地人，他向我们推荐了几道必尝的特色菜：蒜蓉蒸扇贝、清蒸大黄鱼以及虾饺皇等，每一口都让人回味无穷。",1741674363,1741693604,美食攻略
162,64,秦皇岛的长城文化文化,"《秦皇岛的长城文化之旅》

在金秋十月，我们一家人踏上了去秦皇岛的长城之行。这个季节的山海之间，碧空如洗，天高云淡，阳光透过薄雾洒在蜿蜒起伏的长城上，仿佛为古迹披上了一层金色的纱衣。

这次旅行的核心当然是参观北戴河区的金山岭长城了。金山岭长城是明长城的重要组成部分，这里保存着较为完好的古代建筑群落和丰富的历史文化遗迹。我们沿着青石铺设的小道拾级而上，呼吸着新鲜空气，听着脚下踏出的咯吱声，每一步都仿佛能感受到历史的气息。

沿途，你可以看到各种有趣的设施设置，比如休息亭、观景台等，为游客提供了歇脚与欣赏风景的机会。爬到最高点时，映入眼帘的是连绵不断的群山和蜿蜒曲折的长城，不禁让人感叹古代工匠们的智慧与勇气。站在烽火台上远眺，蓝天白云下，长城宛如一条巨龙横卧于崇山峻岭之间。",1741457527,1741833093,历史遗迹
