id,user_id,title,content,create_time,update_time,main_category
1,3,感受秦皇岛的港口历史魅力,"《感受秦皇岛的港口历史魅力》

初夏的阳光温柔地洒在河北省秦皇岛市的海岸线上，这里不仅是一片美丽的海滨风光带，更是一个充满故事与文化的旅游胜地。作为一座历史悠久的城市，秦皇岛不仅仅是自然美景的展示窗口，更是中国港口发展史的一个重要见证者。

我们首先漫步在抚宁县的山海关老城区，那里古色古香的老建筑诉说着历史的沧桑变迁。古老的街道两旁，商铺林立，仿佛让人穿越回了数百年前的繁华景象。在这里，我们可以深入了解长城文化以及古代海上丝绸之路的重要节点之一——山海关的历史故事。

随后，我们乘坐观光巴士前往秦皇岛港，这里是近代中国最早对外开放的通商口岸之一，也是目前我国重要的现代化综合性港口之一。在码头上，我们可以近距离观察各式各样的船舶，感受现代港口繁忙的作业场景。",1742119721,1742372368,文化探索
2,51,如何玩转秦皇岛的日落美景,"《如何玩转秦皇岛的日落美景》

初夏的一天，我们一行人踏上了前往秦皇岛的旅程。这次旅行的目的不仅是为了欣赏这里的壮丽海景，更是为了寻找那个能让人久久驻足的日落时刻。秦皇岛，这座拥有着悠久历史和美丽海岸线的城市，等待着我们的是一场关于海洋与天空之间最温柔对话的盛宴。

抵达秦皇岛后，我们首先选择了北戴河新区作为日出日落观赏的最佳位置之一——联峰山公园。这里不仅风景秀丽，还有多个观景台可以俯瞰整个海面。傍晚时分，夕阳逐渐西下，金黄色的余晖洒满了整个海岸线，天空中泛起了层层叠叠的云霞。在这样一个时刻，我建议大家不妨登上山顶，找到一处视野开阔的地方坐下，闭上眼睛感受微风拂过耳畔，让身心完全放松。

除了观赏日落外，秦皇岛还有许多有趣的活动等待着你去探索。",1741573078,1741991853,海滨体验
3,29,感受秦皇岛的秦始皇东巡魅力,"《感受秦皇岛的秦始皇东巡魅力》

在炎炎夏日里，我们全家选择了一次特别的旅行——到河北省秦皇岛市探访古都遗迹。这次之旅不仅让我们感受到秦始皇的辉煌历史，更是一次文化与自然的完美融合。

一踏入山海关景区，映入眼帘的是高耸入云的长城和巍峨壮观的关隘，让人瞬间穿越回了那个充满英雄气概的时代。我们沿着蜿蜒的石阶缓缓而上，在古朴的建筑中穿行，仿佛可以听到历史的回响。站在望海楼前，眺望远方连绵不绝的大山与浩瀚无垠的大海交相辉映，不禁让人感叹大自然的鬼斧神工。

随后，我们前往了秦始皇行宫遗址公园，这里虽然经过修复和重建，但仍能感受到当年皇家园林的宏伟气派。园内有数不尽的文化展览，通过生动的历史场景再现了秦始皇东巡期间的生活点滴，让我们对这位中国历史上第一位皇帝有了更加深刻的理解。",1740648149,1740984115,文化探索
4,60,如何玩转秦皇岛的日落美景,"《如何玩转秦皇岛的日落美景——海滨体验》

当第一缕晨光逐渐隐去，秦皇岛便迎来了它一天中最迷人的时刻。在这个充满海风与阳光的地方，日落成为了一个不可错过的美好时光。

傍晚时分，我们一行人前往位于北戴河的鸽子窝公园，这里被誉为观赏日落的最佳地点之一。登上观景台，只见远处的海天一色，蔚蓝与金黄交织，太阳仿佛被大海轻轻托起，在即将沉入地平线的最后一刻洒下最后一抹余晖。

在享受着美景的同时，孩子们可以在沙滩上尽情玩耍，堆沙堡、捡贝壳，或者是在海边放风筝。而大人们则可以选择漫步在海滨长廊，感受海风拂面的惬意。偶尔还可以遇到当地人举办的各种小型音乐节或文化活动，现场的乐队演奏和手工艺展示为这个宁静的傍晚增添了几分热闹。",1741603935,1741682290,海滨体验
5,12,如何玩转秦皇岛的海上运动,"《如何玩转秦皇岛的海上运动》

初夏时节，我们一家决定逃离城市的喧嚣，驱车来到了秦皇岛——这个拥有丰富海岸资源的城市。在这里，不仅有美丽的海滨风光，还有丰富多彩的海上运动项目等待着我们的探索。

首先来到的是“老龙头景区”，这里是万里长城东端起点的遗迹所在地，也是观赏海边日出和夕阳落海最佳地点之一。站在高高的平台上，远眺大海，碧波万顷，鸥鸟翱翔，让人感到心旷神怡。

接着是北戴河区，这里有中国最著名的海滩之一——黄金海岸。这里的沙质细腻洁白，水清见底，适合游泳、冲浪和沙滩排球等户外运动。尤其是下午时分，海风轻拂，带着一丝凉爽，让人感觉特别惬意。孩子们在海边嬉戏打闹，欢声笑语不断。

最令人兴奋的是尝试海上摩托艇，这是一种速度与激情并存的体验项目。",1741990422,1742313666,海滨体验
6,40,秦皇岛必去的鸽子窝公园景点,"《秦皇岛必去的鸽子窝公园景点》

初夏时节，我踏上了一段寻找自然之美的旅程，这次的目的地是位于河北秦皇岛的鸽子窝公园。这里不仅风景如画，更是家庭游客不容错过的好地方。

一踏入鸽子窝公园的大门，清新的空气迎面而来，耳边传来阵阵海风和浪花拍打岩石的声音，仿佛在欢迎每一位到访的朋友。沿着蜿蜒的小径前行，两旁是郁郁葱葱的树木和五彩斑斓的花朵，鸟语花香，令人心旷神怡。

鸽子窝公园最吸引人的莫过于那片金色沙滩和无垠的大海了。孩子们在这里尽情奔跑嬉戏，享受着阳光与海水带来的快乐；家长则可以带着孩子一起搭建沙堡、捡拾贝壳，或是漫步在海岸边，感受海浪轻轻拍打着脚下的感觉。对于喜欢探险的家庭来说，在海边寻找各种小生物也是别有一番趣味。

除了海滩上的活动外，鸽子窝公园内还设有多条步行道供游客们欣赏沿途的美景。",1740376832,1740747874,景点推荐
7,92,秦皇岛夏日乐趣避暑攻略,"《秦皇岛夏日乐趣避暑攻略》

炎炎夏日，秦皇岛成为了众多家庭游客的心仪之选。这里不仅风景如画，气候宜人，还拥有丰富的娱乐项目，使全家人都能度过一个凉爽惬意的假期。

一踏入北戴河海滩，便仿佛置身于一片清新的绿洲之中。蔚蓝的大海与洁白的沙滩交相辉映，让人瞬间忘却都市的喧嚣。孩子们在沙滩上尽情堆沙堡、挖贝壳；父母则可以沿着海岸线散步或是在海边享受日光浴。夜晚时分，海滩边还会举行露天电影放映活动，将一天的疲惫洗去。

除了海滩，秦皇岛还有众多值得一探究竟的地方。北戴河动物园里住着各种可爱的动物们，它们在郁郁葱葱的环境中自由自在地生活。亲子互动区更是充满乐趣，小朋友们可以亲手喂食、抚摸动物，与自然亲密接触；此外，在野生动物救助中心还能了解到更多关于保护野生动物的知识。",1741945486,1742044050,避暑胜地
8,84,秦皇岛必吃的扇贝烧烤美食,"《秦皇岛必吃的扇贝烧烤美食》

夏日的微风轻抚着海面，带来一抹清凉。我们一家三口选择在秦皇岛这个海滨城市享受了一次难忘的家庭游。这里的美景与美食同样令人惊叹。

来到北戴河新区的海边，首先映入眼帘的是那片绵延的沙滩和一排排整齐的烧烤摊位。在这里，扇贝成为了最受欢迎的食物之一。摊主们将新鲜捕捞上来的扇贝清洗干净后，用特制的炭火烤至外皮微焦，内里鲜嫩多汁。再配上特调的酱料，吃起来那叫一个鲜美。我们全家人都赞不绝口。

不仅如此，烧烤区旁边还有一座小型的儿童乐园，孩子们在这里尽情地玩耍，释放着童年的活力与欢乐。远处是蔚蓝的大海和金色的沙滩，让我们感受到了大自然的魅力。傍晚时分，夕阳将天边染成了橘红色，我们在海边漫步，享受着温暖的海风，感受着大海带来的宁静与美好。",1740330025,1740531808,美食攻略
9,73,秦皇岛夏日乐趣避暑攻略,"《秦皇岛夏日乐趣避暑攻略》

初夏时节，当热浪席卷而来，秦皇岛却成了一个理想的度假圣地。这里不仅有着迷人的海滩风光，还有着丰富的文化体验，让全家人都能享受到清凉的乐趣。

首先，让我们走进鸽子窝公园。这里是远离城市喧嚣的一片净土。园内的松树林郁郁葱葱，夏日的微风轻拂，带来阵阵凉意。在沙滩上赤脚漫步，感受细软的沙粒，孩子们可以尽情地堆沙堡、打水仗。而夕阳下的鸽子窝海滩更是美不胜收，海浪轻轻拍打着岸边，与家人一起追逐日落的余晖，这样的画面无疑是夏日最美好的记忆。

紧接着，沿着海岸线向北行进，便是具有百年历史的老龙头长城了。这里是明代万里长城的起点，站在城墙上，你可以俯瞰壮丽的大海，感受古今交融的魅力。",1742306295,1742667322,避暑胜地
10,92,记录秦皇岛的海滨漫步,"《记录秦皇岛的海滨漫步》

初夏的清晨，阳光正好，微风不燥。我们一家三口来到了位于河北省东北部的秦皇岛市，开启了这次难忘的海滨之旅。

来到海边的第一站是北戴河海滩，一望无际的蓝天与碧海相接，海面上波光粼粼，让人心旷神怡。我们租了一辆沙滩车，在细软的沙地上尽情驰骋，感受着大自然带来的乐趣。孩子们更是兴奋地在海边追逐嬉戏，笑声传遍了整个海滩。

午后时分，我们在鸽子窝公园中漫步。这里有一片茂密的松树林，郁郁葱葱，是观鸟和摄影爱好者的好去处。我们沿着林间小道散步，不时有可爱的小鸟从身边掠过，还有几只鸽子悠闲地在草地上觅食。

傍晚时分，我们来到了秦皇岛老龙头景区。这里不仅景色优美，而且历史悠久。站在龙尾城墙上向远处眺望，可以看到连绵起伏的山峦和一望无际的大海相映成趣。夕阳的余晖洒落在海面上，金光闪闪，美不胜收。",1741452975,1741846751,旅行日记
11,96,秦皇岛海上运动海滨攻略,"《秦皇岛海上运动海滨攻略》

在金秋十月，我和家人一起踏上了一段难忘的旅程——来到了被誉为“东方夏威夷”的秦皇岛。这里不仅有着绵延不绝的金色沙滩，还有丰富的海上海上活动等待着我们去探索。

一到海边，最吸引我的是那片广阔无垠的大海，微风轻轻吹过，海浪拍打着沙滩，发出哗哗的声音。我们迫不及待地换上了泳装，在专业教练的带领下开始了海滩排球、足球和沙雕创作等有趣的活动。其中，我最喜欢的是体验冲浪板上的快感，站在冲浪板上随着海浪起伏前进的感觉，让人心旷神怡。

除了丰富的陆上海上游玩项目，秦皇岛还为游客准备了各种海上运动。在专业人士的指导下，我们尝试了帆船、摩托艇和潜水等充满挑战性的活动。尤其是在浮潜时，我看到了色彩斑斓的海底世界，五彩缤纷的珊瑚礁和活泼可爱的小鱼群，仿佛置身于一个梦幻般的水下王国。",1741359935,1741495585,海滨体验
12,41,如何玩转秦皇岛的海景摄影,"《如何玩转秦皇岛的海景摄影》

初夏时节，我们一行人踏上了秦皇岛这片古老而神奇的土地。在这里，你可以尽情地享受海滨风光，也可以拿起相机捕捉这份自然之美。这次的旅行，不仅让我们收获了满满的欢乐记忆，更是一次难忘的海景摄影之旅。

一进入北戴河新区，我们就被眼前的景象所震撼：碧蓝的大海与蔚蓝的天空交汇，海浪轻拍着金色的沙滩，远处的山峦若隐若现。我们首先来到了老虎石公园，在这个以奇石闻名的地方，巨大的礁石在海浪中屹立不倒，与蓝天白云相映成趣。我架好相机，调整焦距，将这壮观的一幕定格下来。

接下来，我们沿着海岸线继续前行。海面上的帆船和冲浪板构成了生动的画面，仿佛在诉说着一个个冒险故事。在这里，你可以尝试不同的拍摄角度，如从高处俯瞰大海与城市的交接之处，或是在日落时分捕捉天边那抹温柔的橙红。",1742507923,1742674516,海滨体验
13,33,秦皇岛的海景摄影海滨体验,"《秦皇岛的海景摄影海滨体验》

初夏时节，我们一行人踏上了前往秦皇岛的旅程。阳光正好，微风轻拂，这里不仅有美丽的海岸线，还有丰富的海滩活动，让这个假期充满乐趣与惊喜。

一踏入北戴河海滩，映入眼帘的是连绵不绝的金色沙滩和碧蓝的大海。我们在海边漫步，沙粒细腻柔软，脚下的每一步都留下了深深浅浅的足迹。海风轻拂过脸庞，带着丝丝咸味，令人心旷神怡。

摄影爱好者们迅速摆好姿势，调整相机角度，在这独特的海滨风光中寻找灵感。海浪拍打着礁石，仿佛在演奏一曲自然界的交响乐，而远处的帆船和游人则为这画面添上了生动的一笔。我们将这一幕定格下来，成为旅途中最珍贵的记忆之一。

午后时分，我们来到海边观景台，这里视野开阔，能够一览无余地欣赏海天一线的壮丽景色。夕阳西下，金色的阳光洒在波光粼粼的海面上，营造出梦幻般的效果。",1740594940,1740986408,海滨体验
14,19,带你游览秦皇岛的老龙头景区,"《带你游览秦皇岛的老龙头景区》

初春时节，我怀着激动的心情踏入了秦皇岛老龙头景区。这里是长城脚下的一片瑰宝，也是家人出游的理想之地。从城市驱车仅需30分钟的车程，就能感受到一种远离喧嚣的新鲜感。

一进入景区，迎面而来的是壮观的海天一色之景。站在观海台前，望着无边无际的大海和远处连绵起伏的山脉，心中的浮躁仿佛都被这壮丽景象洗涤干净了。在这里，孩子们可以尽情地奔跑玩耍，在沙滩上挖掘“宝藏”，或是堆砌属于他们自己的城堡。家长则可以选择沿着海边漫步，享受着微风拂面的惬意。

而最令人难忘的莫过于登上老龙头的城楼。这里不仅是明代长城的起点，也是全国保存最完整的沿海军事防御体系之一。站在城楼上向下望去，可以看到那蜿蜒曲折的长城如同一条巨龙般潜入海中，守护着这片土地和人民。历史在这里仿佛凝固了时间，让人不禁心生敬畏。",1742043018,1742357517,景点推荐
15,75,记录秦皇岛的亲子时光,"《记录秦皇岛的亲子时光》

初夏时节，我们全家决定到秦皇岛走一遭。这里不仅风景如画，而且是一个充满乐趣的家庭度假胜地。在这里，我记录下了与家人共度的美好时光。

抵达当天，我们就迫不及待地来到了鸽子窝公园。这个被誉为“中国最美八大海岸之一”的地方，以它独特的自然美景吸引着无数游客。沙滩细腻柔软，海风轻拂，孩子们在海边嬉戏玩耍，欢声笑语充满了整个海岸线。我们还尝试了沙雕制作，与孩子们一起堆砌出一个个生动有趣的沙雕作品，仿佛自己也变成了一个小小的艺术家。

接着，我们前往了老虎石公园。这里是家庭游客的绝佳去处，不仅有各种游乐设施，还有许多适合亲子互动的游戏项目。在欢乐谷中，我和孩子们一起体验了摩天轮、海盗船等娱乐项目，既刺激又有趣。特别是摩天轮，从高空俯瞰整个海边城市，景色如画，让人流连忘返。",1742744594,1743128833,旅行日记
16,66,秦皇岛沙滩玩耍亲子攻略,"《秦皇岛沙滩玩耍亲子攻略》

夏日炎炎，一场说走就走的旅行怎能少得了秦皇岛这座海滨城市。这里不仅有蓝天白云下绵延不绝的金色沙滩，还有丰富多彩的家庭游玩项目，让每一个亲子游都充满欢声笑语。

来到黄金海岸，首先映入眼帘的是那片辽阔无垠的沙滩和蔚蓝的大海。带上小铲子、沙桶以及色彩鲜艳的沙雕玩具，孩子们可以尽情在海边堆砌起属于自己的沙堡王国；而家长们则可以在不远处的椰林下享受一份凉爽，品尝着冰镇果汁或甜品，享受难得的悠闲时光。

别忘了租一艘帆船或皮划艇，在海浪中嬉戏追逐。当微风拂过脸庞，海面上的波光粼粼为这一天画上了完美的句号。傍晚时分，与家人一起漫步在沙滩上，感受着海风轻抚面颊的感觉，远处夕阳将天边染成了金红色，美不胜收。

夜幕降临后，不妨去听一听老街上的“渔家乐”音乐会。",1741436985,1741443578,家庭游玩
17,53,带你游览秦皇岛的渔岛风景区,"《带你游览秦皇岛的渔岛风景区》

初春时节，我们一行人踏上了去往秦皇岛渔岛风景区的旅程。这里不仅是亲子游的理想选择，更是与家人共享美好时光的最佳场所。

一进入景区，首先映入眼帘的是那片碧蓝的海水和绵延不绝的沙滩。漫步于细软如丝的沙粒间，孩子们兴奋地跑来跑去，与海浪嬉戏玩耍。不远处的浅水区里，成群结队的小鱼在游弋，仿佛是大海的孩子们，在享受着春天的温暖。

接着我们来到了渔岛的中心地带——观景台。站在这里，可以将整个渔岛的美景尽收眼底：远处的海天一色，近处的绿树红瓦，还有那不断涌动的海浪，构成了一幅壮丽的画面。游客们纷纷在此留影纪念，记录下这美好的一刻。

当然，除了自然风光外，渔岛还有许多有趣的活动等你来体验。",1742091024,1742310509,景点推荐
18,1,秦皇岛一日游：体验军事历史,"《秦皇岛一日游：体验军事历史》

今年的暑假，我和家人来到了位于河北省东北部的秦皇岛市。这里不仅风景秀丽，而且有着丰富的历史文化遗迹，尤其是对于喜欢军事历史的人来说，是一个不可多得的好去处。

我们首先来到的是北戴河的老虎石炮台遗址公园。这里是清朝光绪年间修建的一座防御工事，虽然历经风雨侵蚀，但其巍峨的气势依旧能让人感受到昔日的辉煌。我们在炮台遗址间穿行，感受着那股浓厚的历史氛围。特别是一些具有代表性的建筑和雕塑，仿佛将我们带回到了那个动荡的时代。

下午，我们又前往了山海关老龙头景区。作为中国万里长城东端起点的老龙头，不仅拥有悠久的历史背景，还融合了许多军事防御的功能。在这里，我们参观了敌台、月牙城等遗址，并且体验了攀爬长城的乐趣。站在城墙上俯瞰海面，不禁让人感慨万千：历史的沧桑与自然的壮丽在此刻交汇。",1742369059,1742617237,历史遗迹
19,14,秦皇岛渔岛风景区景点推荐,"《秦皇岛渔岛风景区景点推荐》

在夏日炎炎的午后，我们一行人驱车来到了秦皇岛的渔岛风景区。在这里，清新的海风与明媚的日光交织成一幅生动的画面，让人心旷神怡。

一进入景区，首先映入眼帘的是那片绵延不绝的金色沙滩。细软的沙子在脚下轻轻摩擦着，孩子们欢笑着奔跑其间，而家长们则或席地而坐享受片刻宁静，或是在椰林树影下乘凉休憩。远处海浪拍打着岸边，发出哗哗的声音，仿佛是大自然最动听的乐章。

沿着海岸线漫步，我们来到了海上牧场。这里可以体验到划船、海钓等项目，大人小孩都能找到自己喜欢的娱乐方式。其中，最吸引眼球的是那些色彩斑斓的人造鱼群雕塑，它们在水中自由游弋，与真实的海洋生物和谐共存，给游客带来不少惊喜。

随后，我们参观了渔岛生态园。",1741385703,1741744234,景点推荐
20,64,秦皇岛夏日乐趣避暑攻略,"《秦皇岛夏日乐趣避暑攻略》

盛夏七月，酷热难耐，寻找一处清凉之地，便成了无数人的心愿。此时的秦皇岛，正如同一张绿色的画卷，缓缓铺展开来，将你引领至一个充满凉爽与欢笑的世界。

清晨的第一缕阳光还未完全驱散夜的余寒，我便迫不及待地来到了北戴河海滩。柔软细腻的沙子在脚底轻轻揉搓，海浪轻拍着沙滩的声音如同天籁之音。赤足走在海边，清凉的海水触感仿佛能带走所有的烦恼与疲倦。带上泳镜和浮板，在浅水中嬉戏玩耍，或是静静躺在沙滩椅上享受阳光，让身心得到彻底放松。

午后时分，来到山海关老龙头公园，这里不仅有悠久的历史文化，更有令人赞叹的自然美景。漫步于绿树成荫的小径之间，呼吸着夹杂着草木清香的新鲜空气，耳畔是远处海浪的声音与鸟鸣相和，仿佛置身于一幅宁静而和谐的画面之中。",1742857414,1743191360,避暑胜地
21,15,如何玩转秦皇岛的海滨漫步,"《如何玩转秦皇岛的海滨漫步》

初夏时节，与家人一起踏上秦皇岛之旅，这里不仅有壮丽的海岸线，还有众多亲海体验项目，让全家人都能在这里找到属于自己的乐趣。作为中国四大避暑胜地之一，秦皇岛以其得天独厚的自然风光吸引着无数游客。

抵达酒店后，我们首先选择的是鸽子窝公园。这里的沙滩金黄细腻，波浪轻拍岸边，一派宁静祥和景象。孩子们在沙滩上尽情奔跑、堆沙堡，大人们则悠闲地散步或坐在海边聊天，享受着海风的温柔拂面。沿着海岸线漫步至老虎石公园，这里不仅有形态各异的礁石，还设有观景平台，站在高处眺望，辽阔的海面与天边仿佛连成一片。

午后时分，我们前往老龙头长城进行参观游览。虽然已是非旅游高峰期，但老龙头依然热闹非凡。",1740716698,1741110067,海滨体验
22,55,秦皇岛渔岛美景风光攻略,"《秦皇岛渔岛美景风光攻略》

初夏时节，我带着全家一起来到了秦皇岛渔岛。这里既有壮阔的大海，也有细腻的沙滩，是家庭游的好去处。

踏上渔岛的第一步，就是沿着海边的小路漫步。这里的海水清澈见底，偶尔可以看到水里游动的小鱼和珊瑚。孩子们兴奋地捡起贝壳，或是捉住从脚下溜走的小螃蟹，每一步都充满了探索的乐趣。我则坐在沙滩上，看着海浪轻轻拍打着岸边，耳边传来阵阵海鸥的叫声，那一刻仿佛时间静止了。

傍晚时分，我们来到了渔岛上的观景台。此时天边霞光映照在海面上，如同一片金色的海洋，美不胜收。孩子们兴奋地欢呼着，纷纷拿出手机记录下这美好瞬间。晚上，我们在沙滩上生起篝火，围坐在一起分享一天的经历，享受这份难得的家庭时光。

此外，渔岛还有丰富的水上活动等着我们去体验。滑翔伞、摩托艇……这些都让全家人都感受到了刺激与乐趣。",1740776457,1741008821,自然风光
23,13,秦皇岛的渔民文化历史,"《秦皇岛的渔民文化历史——一次文化的深度探索之旅》

在蔚蓝的大海拥抱之下，有着这样一座古老而充满魅力的城市——秦皇岛。它不仅拥有着壮观的海岸线，还承载着深厚的历史文化底蕴，特别是那独特的渔民文化。这是一次对于海洋文明与传统文化交融的独特体验，适合家庭游客一同前往。

我们首先漫步于乐岛海洋公园，这里是探索渔民文化的绝佳起点。一进入园区，仿佛穿越回了古老的渔村，海边渔网、风车和渔船模型让人仿佛置身于过去的生活场景中。孩子们可以亲自参与捕鱼游戏，了解传统捕鱼工具的使用方法；而成年人则可以在“渔文化博物馆”里，通过各种展品深入学习渔民生活的方方面面。

紧接着，我们前往北戴河新区，探访了当地著名的北戴河渔村。这里保留着许多原汁原味的渔家风貌，游客可以参与各种特色的体验项目，比如亲手制作海产品、品尝鲜美的海鲜大餐等。",1740737644,1740838733,文化探索
24,74,带你游览秦皇岛的北戴河海滨,"《带你游览秦皇岛的北戴河海滨》

暑假期间，我有幸与家人一同来到了有着“东方夏威夷”美誉的秦皇岛北戴河海滨。这里海风轻拂，沙滩细腻柔软，碧海蓝天交相辉映，令人心旷神怡。

我们首先去了鸽子窝公园，这里的景色十分迷人。鸽子窝公园是观赏日出的最佳地点之一，清晨，当第一缕阳光穿透云层，洒在海岸线上，金色的光芒与波光粼粼的大海相互交融，美不胜收。此外，这里还有许多雕塑和鸽舍，每到周末，成群结队的和平鸽就会飞来此地觅食，非常可爱。

沿着海岸线前行，我们来到了联峰山公园，这里有独特的岩石地貌、茂密的森林以及清澈见底的小溪。在山顶的观景台上，可以俯瞰整个海滨景色，感受大自然的魅力。这里还有专门为孩子们准备的攀爬设施和小动物观赏区，适合带孩子来的家庭游客。

晚上，我们漫步在海心公园，欣赏着绚丽的夜景。",1742572190,1742620692,景点推荐
