id,user_id,title,content,create_time,update_time,main_category
94,88,我的秦皇岛自驾体验之旅,"《我的秦皇岛自驾体验之旅》

驱车踏上这场与家人共度的美好旅程，我们选择了秦皇岛作为目的地。这是一座位于河北省东北部的海滨城市，拥有壮丽的海景和丰富的旅游资源，是家庭出游的理想之地。

第一站，我们来到北戴河新区的鸽子窝公园。这里以壮观的日出而闻名，晨曦中，金色的阳光洒在波光粼粼的大海上，美得让人心醉。公园内还有各种娱乐设施，如攀岩、沙滩排球等，孩子们在欢声笑语中尽情释放着活力。

接下来，我们前往北戴河野生动物园。这是一片与自然为邻的乐园，各种珍稀动物在这里自由地生活着。在专业讲解员的带领下，我和家人近距离观看了北极熊、黑猩猩等动物的生活习性，不仅增长了知识，也让心灵得到了极大的满足。

晚上，我们在一家有着海边风情的小餐馆享用晚餐。海风轻轻拂过脸庞，海鲜的鲜美滋味让人回味无穷。",1742113684,1742371190,旅行日记
95,1,秦皇岛自驾注意事项自驾游攻略,"《秦皇岛自驾游攻略：享受海滨风情的惬意之旅》

在这个金秋时节，我们选择了一次说走就走的旅行——秦皇岛。这里不仅风景如画，而且自驾游的方式让这次旅程变得轻松愉快。让我们一起来看看我们的旅途经历吧！

从城市出发，驱车前往北戴河区，沿途可以欣赏到碧海蓝天、松林苍翠。到达后，第一站就是鸽子窝公园。作为秦皇岛的地标性景点之一，这里不仅可以感受到浓郁的文化气息，还能在海边吹拂着和煦的海风，体验与大自然亲密接触的乐趣。

接着前往黄金海岸景区。这里的沙滩宽广且细腻，清澈见底的海水让人忍不住想要下水畅游一番。孩子们在这里尽情奔跑玩耍，留下欢乐的记忆；而大人则可以享受一下悠闲的海风浴或者参与一些水上运动，比如摩托艇、帆船等，感受刺激与激情。

当然，在旅途中我们还体验了北戴河野生动物园以及老龙头景区。",1741719125,1742095073,自驾游攻略
96,75,秦皇岛碣石山景点推荐,"《秦皇岛碣石山景点推荐》

初春的清晨，我们一行人踏上了前往秦皇岛碣石山的旅程。这是一次充满期待的家庭出游，不仅因为碣石山作为中国四大名山之一的历史底蕴，更因为它能够为我们提供一次亲近自然、放松心情的机会。

一踏入碣石山景区，便被这里的自然美景深深吸引。沿着蜿蜒的小径向上攀登，两侧是郁郁葱葱的树木和各式各样的花卉，阳光透过树梢洒落下来，如同为大自然披上了一层金色的纱衣。途中，我们还惊喜地发现了几处潺潺流水的瀑布，清澈见底，仿佛是山间最灵动的生命之歌。

抵达山顶后，站在高处眺望四周，秦皇岛市区尽收眼底，远处的海岸线在晨光中显得格外迷人。而脚下则是被绿树包围的宁静小径，沿着它继续前行，可以探索更多的秘密和惊喜。我们还参观了山上的古迹，了解了许多关于碣石山的历史故事，感受到了中国古代文化的博大精深。",1742110584,1742520420,景点推荐
97,100,探秘秦皇岛的渔民文化文化,"《探秘秦皇岛的渔民文化文化》

初秋时节，我和家人踏上了一段充满期待的文化之旅。这次的目的地是有着“东方夏威夷”美誉的秦皇岛。在这里，我们不仅感受到了海滨城市的浪漫风情，更深入体验了当地的渔民文化。

一踏入老码头景区，迎面而来的是一座古朴的木制观景台，仿佛穿越回了古代商船靠岸的年代。参观者们可以在此处驻足休憩，欣赏着碧海蓝天和远处的点点渔船。随后，我们跟随导游的脚步来到了渔民文化馆，馆内陈列着各式各样的渔具、传统工艺品以及捕捞工具，每一件展品都承载着渔民的生活智慧与艰辛劳作的记忆。

特别吸引我的是一个互动体验区，在这里可以亲手模拟捕鱼过程，感受到从海上搏击风浪到岸边卸货的不易。此外，还能品尝到地道的海鲜大餐，其中不乏用当地特色食材制作的独特佳肴，让人回味无穷。",1741324473,1741581436,文化探索
98,84,秦皇岛黄金海岸自驾游攻略,"《秦皇岛黄金海岸自驾游攻略》

在夏日的微风中，驱车驶向秦皇岛的黄金海岸，仿佛进入了一个充满阳光与海浪的世界。这里不仅有碧蓝的天空、清澈的海水，还有丰富多样的活动和美丽的海滩风光，是家庭出游的理想之地。

一踏入这片土地，首先映入眼帘的是绵延不绝的金色沙滩。在这里，可以尽情地赤脚走在软绵绵的沙子上，与家人一起建造城堡，嬉戏玩耍，体验海浪拍打身侧的快感。而孩子们更是能在此释放无限活力。

除了海滩活动之外，金海岸还拥有多个特色景点等待着你的探索。位于海边的鸽子窝公园就是一个不可错过的地方。在这里，不仅可以看到壮观的海洋景色，还能欣赏到五彩斑斓的沙滩排球比赛、精彩的海鸥表演和独特的风筝展览。傍晚时分，不妨选择一处临海观景台，与家人一起观赏日落时刻的壮丽景象，享受着一天中最宁静美好的时光。",1742812491,1743005262,自驾游攻略
99,14,如何欣赏秦皇岛的北戴河海景,"《如何欣赏秦皇岛的北戴河海景》

夏日炎炎，与家人一同踏上旅途。秦皇岛的北戴河以其独特的自然风光，成为了旅游者心中的胜地。今天，我想分享一下如何更好地欣赏这里的海景。

抵达北戴河的第一站是鸽子窝公园。这里不仅有广阔的沙滩，还有丰富的海洋生物。孩子们可以在这里尽情玩耍、堆沙堡，而成年人则可以在海边悠闲散步或享受日光浴。傍晚时分，海面上夕阳余晖与蓝天交相辉映，美不胜收。

除了观赏自然美景外，还可以选择参加一些水上活动。在东戴河沙滩附近，有很多提供冲浪板和潜水装备的租赁服务点。租上一套潜水设备，潜入海底世界，与五彩斑斓的热带鱼共舞，探索神秘的珊瑚礁，定会让你流连忘返。

当然，在北戴河游玩期间，别忘了品尝当地的海鲜美食。在一家靠海的小餐馆里，尝一尝刚捕捞上来的新鲜海螺、螃蟹和扇贝，味道绝对让你回味无穷。",1741387968,1741519245,自然风光
100,30,秦皇岛的海滨漫步海滨体验,"《秦皇岛的海滨漫步——海滨体验之旅》

初夏的阳光洒在了秦皇岛的沙滩上，我们一家人踏上了这次海滨体验之旅。清晨的第一缕阳光尚未完全照亮天际时，我们就迫不及待地启程出发了。

来到北戴河，我们首先选择了鸽子窝公园作为我们的第一站。站在海边，迎面而来的是海风带来的清新气息，远处的帆船和航标灯在晨雾中若隐若现。鸽子窝公园不仅风景宜人，还有着丰富的娱乐设施，孩子们可以在此尽情地玩耍，体验各种水上活动。

午后的阳光照得人有些心烦意乱，我们来到了附近的山海关古城游览。这里的每一块砖瓦都承载着历史的厚重与沧桑，仿佛在讲述着关于海防的故事。走在青石板铺就的路上，看着古朴的城门和城墙，感受着那份来自古老中国的韵味。

傍晚时分，我们乘坐游船出海，享受了壮观的日落景色。",1742826584,1742885655,海滨体验
101,60,秦皇岛的老龙头入海文化,"《秦皇岛的老龙头入海文化》

初夏的清晨，我们一行人踏上了前往秦皇岛老龙头的旅程。这座位于河北省秦皇岛市山海关区的小城，不仅是海上长城的重要组成部分，更是历史遗迹与自然美景交织的地方。

一踏入老龙头景区，迎面而来的是一种浓厚的文化气息。这里的城墙遗址被海水轻轻拍打着，仿佛在诉说着过去的故事。我们沿着蜿蜒的栈道缓缓前行，时而驻足凝视着那些历经沧桑的石刻、碑文，心中不禁涌起对历史文化的敬仰之情。

除了历史遗迹外，老龙头景区还设有多种适合家庭游客参与的活动。比如，在海边沙滩上搭建沙堡、寻找海洋生物或是尝试冲浪等。这些有趣的项目不仅让大人小孩都乐在其中，也让大家在游玩中感受到自然的魅力。

最令人难忘的是站在老龙头观海台上眺望远方。只见蔚蓝的大海上波光粼粼，与不远处的长城相映成趣。",1741703045,1742075058,历史遗迹
102,15,带你游览秦皇岛的山海关古城,"《带你游览秦皇岛的山海关古城》

当秋风轻拂，我带着家人走进了位于河北省秦皇岛市的山海关。这里不仅是中国长城的起点，也是历史文化与自然风光交融之地。对于爱好探索历史文化的家庭游客来说，这是一次不可多得的文化之旅。

首先，我们来到了举世闻名的关城。这座由砖石构筑而成的城市要塞，虽然历经数百年风雨洗礼，却依然坚固挺拔。站在山海关脚下仰望，那高耸入云的古城墙仿佛在诉说着过往的故事。我们沿着蜿蜒曲折的长城前行，在城墙上漫步，感受着那份穿越时空的历史厚重感。

随后，我们参观了老龙头景区，这里保留有明代的古建筑和遗迹，尤其是壮观的老龙头三关亭，让人大开眼界。在这里，孩子们可以亲手触摸历史，体验古人建造的智慧与艰辛。而站在海边眺望，碧海蓝天、金浪轻拍，令人心旷神怡。

傍晚时分，我们参加了山海关古城夜市活动。",1742573436,1742780947,景点推荐
103,70,感受秦皇岛的历史遗迹魅力,"《感受秦皇岛的历史遗迹魅力——文化探索之旅》

初到秦皇岛，仿佛步入了一个时光穿梭机。这里不仅拥有壮美的海岸线与浪漫的沙滩，还蕴藏着丰富的历史文化遗产。我们一行人踏上了为期三天的文化探索之旅，细细品味了这座城市独有的韵味。

首日，我们来到了北戴河区的联峰山。登上山顶的联峰山公园，眼前豁然开朗。满目苍翠中，一座座古色古香的建筑与郁郁葱葱的树木交相辉映，仿若一幅精致的水墨画。我们沿着蜿蜒的小径漫步，在历史长廊中穿梭。这里曾是北戴河别墅群之一，见证了民国时期的历史风云，如今已修复成集文化展示和休闲娱乐为一体的景区。游客不仅可以参观别墅内部展陈，还能在山间小道上呼吸清新的空气、聆听鸟鸣虫吟，感受那份宁静与自然之美。

次日，我们前往鸽子窝公园，在这里可以近距离接触海浪。",1740827349,1740924792,文化探索
104,19,我的秦皇岛海滨漫步之旅,"《我的秦皇岛海滨漫步之旅》

夏日的午后，我带着家人一起踏上了前往秦皇岛的旅程。这座位于北戴河东部沿海的城市，以其优美的海岸线和丰富的旅游资源闻名于世。这次旅行，我们不仅享受了海边的清新空气，还体验了各种适合家庭游玩的活动。

一踏入海滩，迎面而来的就是海风拂过的清爽气息，浪花轻拍着沙滩，发出悦耳的声音。孩子们兴奋地在海边奔跑、戏水，欢声笑语中充满了童真的快乐。我们沿着海岸线漫步，欣赏着蓝天白云下的碧海蓝天，拍照留念，留下了许多美好的回忆。

午后时分，我们在一家临海的餐厅享用了海鲜大餐。新鲜的虾蟹、鱼排、扇贝等海鲜都是从海边直送过来的，味道鲜美无比，令人回味无穷。饭后，我们还参观了北戴河海洋公园，里面不仅有各种海洋生物展览，还有精彩的水下表演，整个家庭都沉浸在欢乐的氛围中。",1741309018,1741347938,旅行日记
105,23,秦皇岛必吃的当地小吃美食,"《秦皇岛必吃的当地小吃美食》

夏日炎炎，一家大小踏上旅程，到北国海滨城市秦皇岛一探究竟。这里不仅风景宜人，还有许多让人垂涎三尺的小吃美食等待着我们。

出发前，妈妈特别嘱咐要品尝一下当地的烧烤美食。果然，在海阳镇的小吃街，各种海鲜串、羊排和羊肉串琳琅满目，香气四溢。坐在露天餐桌旁，一边享受清风徐来，一边品味肥美多汁的烤肉，真是既过瘾又清凉。

而说到秦皇岛的特色美食，不得不提的是当地独有的“山海关豆腐脑”。这是一碗用细嫩的豆花搭配特制甜酱、花生碎和芝麻酱制成的小吃。品尝时，软滑细腻的豆花配上浓郁的酱料，在口中瞬间化开，带来独特的口感体验。

当然，秦皇岛的海鲜也不容错过！在渔人码头附近的小摊上，你可以亲手选择新鲜的海鲜，然后交给店家进行简单烹饪。",1741684129,1741687550,美食攻略
106,50,我的秦皇岛美食之旅之旅,"《我的秦皇岛美食之旅》

去年十月，我和家人一起踏上了一场充满惊喜的秦皇岛美食之旅。这次旅行不仅让我们领略了这座海滨城市的美景，更是一次味蕾上的盛宴。

旅程的第一站是老龙头景区，这里作为万里长城的起点之一，有着浓厚的历史文化底蕴。漫步在古老的城墙上，我们不仅可以感受到历史的气息，还能偶尔闻到远处传来的海鲜味道。这让我对接下来的美食之旅充满了期待。

晚餐时分，我们在一家名为“渔家乐”的餐馆享受了一顿丰盛的海鲜大餐。桌上摆满了新鲜捕捞上来的海鱼、虾蟹以及各种贝类，令人目不暇接。每一道菜都由经验丰富的厨师精心烹制，不仅保留了食材原有的鲜美，还巧妙地融合了本地独特的调味方法。特别是那道烤生蚝，外焦里嫩，搭配特制的蒜蓉酱汁，让人回味无穷。

此外，秦皇岛还以其美味的小吃闻名遐迩。",1742209608,1742596140,旅行日记
107,42,如何在秦皇岛度过一个凉爽体验假期,"《如何在秦皇岛度过一个凉爽体验假期》

随着夏日炎炎的到来，寻找一片清幽之地成为许多人的心愿。今年夏天，我选择了一次特殊的旅程——在秦皇岛度过了一个令人难忘的清凉假期。

秦皇岛位于河北省东北部，是中国著名的避暑胜地之一。这里不仅有美丽的海滨风光，还有丰富的历史文化遗迹和各种户外活动，适合家庭游客共同体验。

清晨的第一缕阳光还未完全驱散海面的雾气时，我们就来到了北戴河沙滩。金黄色细腻的沙粒在脚下轻轻蠕动，细软如丝。海水清澈见底，海浪轻拍着海岸，带来一丝丝凉爽。在这里，全家人可以一起在海边嬉戏玩耍，或者漫步在海岸线上，感受微风拂面。

午后，我们前往北戴河海滨浴场西侧的鸽子窝公园游玩。公园内有一座小山丘，站在山顶俯瞰整个海滩，尽收眼底的是无边的海天一色和远处若隐若现的群山，让人流连忘返。",1741949302,1742017301,避暑胜地
108,55,秦皇岛的湿地观鸟自然风光,"《秦皇岛的湿地观鸟自然风光》

初夏时节，我与家人一同来到了河北省秦皇岛市。这次旅行的目的地是北戴河国家湿地公园，这里不仅环境优美，更是观鸟爱好者的天堂。

一踏入这片占地800多公顷的绿色天地，就能感受到大自然的气息扑面而来。公园内植被茂密，水系纵横，各种鸟类在这里自由飞翔、栖息。我们沿着栈道漫步前行，听着潺潺流水声和远处不时传来的鸟鸣声，仿佛进入了一个静谧而又生机勃勃的世界。

最吸引我们的当然是观鸟活动了。在工作人员的指引下，我们手持望远镜，仔细观察着水面上嬉戏的白鹭、天空中翱翔的苍鹰以及树丛间穿梭的斑鸠……每一种鸟类都有其独特的习性和姿态。通过这次近距离接触自然的机会，孩子们对各种鸟类产生了浓厚的兴趣。",1740417897,1740550468,自然风光
109,22,秦皇岛山海关古道自驾游攻略,"《秦皇岛山海关古道自驾游攻略》

阳光轻抚着海面，蔚蓝如画。这个周末，我们驾车来到了中国历史文化名城——秦皇岛，开启了一场穿越时空的自驾之旅。

一进入山海关古城，仿佛历史的气息扑面而来。在景区内，我们将车停靠在青砖黛瓦之间，沿着蜿蜒的古道缓缓前行。这是一条充满故事的小径，两侧是古老的建筑和石阶，每一步都踏着厚重的历史沉淀。我们跟随导游的脚步，穿过箭楼、东门城楼等重要历史遗迹，感受着这座“天下第一关”的雄伟与沧桑。

随后，我们来到了山海关老龙头景区，这里是明长城的东部终点站，也是万里长城唯一的一处临海地段。站在古色古香的城楼上，眺望远方波光粼粼的大海，心中不禁涌起一股豪迈之情。“不到老龙头，不算到秦皇岛”，这句话绝非虚言。

晚餐时间，我们选择了一家当地特色餐馆，品尝了美味的海鲜和特色小吃。",1742837623,1743054271,自驾游攻略
110,91,带你游览秦皇岛的山海关古城,"《带你游览秦皇岛的山海关古城》

夏日的一天，我和家人一起踏上了去秦皇岛的旅程。我们来到了山海关古城，这座历史悠久的城市像一位时光守护者，静静地诉说着过往的故事。

进入山海关城门，首先映入眼帘的是雄伟壮观的关隘。这里曾是明代重要的军事防御要地，城墙上镌刻着历史的印记。我们沿着古老的城墙漫步，感受到了古代边塞生活的艰苦与壮丽。

游览了古城之后，我们来到了老龙头景区。这里不仅有壮观的长城遗址，还有美丽的海滩。沙滩上的沙粒细腻柔软，海水清澈见底。孩子们在海边尽情玩耍，欢声笑语充满了整个海滩。大人则坐在凉亭中享受海风的轻抚，让心灵得到了放松。

午后，我们在山海关古城的街头巷尾品尝了当地的特色小吃。从香喷喷的烤生蚝到鲜美的海鲜粥，每一种美食都让人回味无穷。",1742337811,1742553081,景点推荐
111,89,秦皇岛避暑山庄避暑攻略,"《秦皇岛避暑山庄避暑攻略》

随着夏日的热浪渐渐逼近，寻找一处清凉之地成了许多人的迫切愿望。秦皇岛，这座位于中国北方海滨的城市，凭借其独特的地理位置与丰富的人文景观，成为了理想的避暑胜地。而其中的避暑山庄更是不可错过的地方。

走进景区，首先映入眼帘的是那郁郁葱葱的树木和错落有致的建筑群。这里是中国传统园林艺术的杰作之一，亭台楼阁、小桥流水，每一处都充满了古典之美。漫步于青石铺就的小径上，微风吹过，带着淡淡的花香与海的气息，让人心旷神怡。

在避暑山庄中，有许多适合家庭游客参与的活动。比如乘坐竹筏穿梭于碧波荡漾的人工湖面，或者是在绿树环绕的草坪上放风筝、踢足球，孩子们在这里能找到属于他们的快乐天地。此外，还有传统表演和手工艺品制作体验等丰富多彩的文化活动，让大人小孩都能找到乐趣。",1742083178,1742383538,避暑胜地
112,44,秦皇岛的避暑山庄体验,"《秦皇岛的避暑山庄体验》

初夏时节，我带着家人来到了被誉为“东方瑞士”的秦皇岛，特别是那座闻名遐迩的避暑山庄。这里不仅自然风光秀美，更是夏日里的一片清凉天地。

一踏入景区，就能感受到它与世无争的静谧。山脚下的松林间，凉风习习，空气清新，仿佛能洗去夏日的烦躁。我们先来到了著名的“五龙宫”，它是整个避暑山庄内最具代表性的建筑之一，古朴典雅，殿宇错落有致，每一处都透露着皇家园林的独特韵味。

穿过五龙宫，沿着蜿蜒的小路漫步至湖边，碧波荡漾、绿树成荫。我们租了一条小船，在湖面上悠闲地游弋。微风吹过，水面泛起层层涟漪，远处的山峦在湖水中若隐若现，如同一幅淡淡的水墨画。孩子们更是兴奋不已，不时划动手中的桨，激起一圈圈水花。

午后，我们在山庄内的茶室里品茗聊天，享受着这份难得的宁静与清凉。",1741833398,1741900920,避暑胜地
113,38,秦皇岛海滨乐园亲子攻略,"《秦皇岛海滨乐园亲子攻略》

在这个阳光明媚的日子里，我们一家三口踏上了一场特别的家庭旅行——秦皇岛之旅。这里不仅有绵延的海岸线，还有丰富多彩的游玩项目，让我们享受了一个难忘的家庭时光。

一到海边，首先映入眼帘的是金黄色的沙滩和蔚蓝的大海。孩子们兴奋地在沙滩上奔跑、堆沙堡，偶尔还能捡到一些漂亮的贝壳。我们沿着海岸线慢慢走着，呼吸着清新的空气，感受着海风拂面的惬意。

不远处就是著名的南戴河海洋公园，这里有专门为家庭游客设计的各种游乐设施和互动项目。其中，海洋馆里的海底世界让孩子们惊叹不已，各种海洋生物在水下灯照的映衬下显得格外生动有趣；而儿童水上游乐区则提供了一个清凉消暑的好去处，各式各样的滑梯、喷泉和造浪池让孩子和大人们都玩得不亦乐乎。

傍晚时分，我们乘坐了南戴河的夜游船。",1741020712,1741030746,家庭游玩
114,38,秦皇岛海风吹拂避暑攻略,"《秦皇岛海风吹拂避暑攻略》

夏日炎炎，寻找一处清凉之地成了许多人的愿望。位于河北省东北部的秦皇岛，凭借其得天独厚的地理位置，成为了一处不可多得的避暑胜地。这里不仅有湛蓝的天空和碧绿的大海交相辉映的自然风光，还有丰富的游玩项目等待着每一位家庭游客。

来到秦皇岛，首先不能错过的便是北戴河国家地质公园。这里的海岸线长达25公里，拥有细腻柔软的沙质海滩，漫步在金色沙滩上，感受海风轻拂，仿佛所有的炎热都随之消散了。此外，在这里还可以体验到丰富的户外活动，如沙滩排球、冲浪等，让全家人都能在海边尽情享受夏日的乐趣。

北戴河国家地质公园不远处便是鸽子窝公园。这座公园因园内有数十只野生海鸥而得名“鸽子窝”。这里是观赏日出和日落的绝佳地点之一。清晨的第一缕阳光与傍晚最后一抹余晖，洒在这片金色沙滩上，美不胜收。",1740635101,1740734883,避暑胜地
115,12,如何规划秦皇岛的沿途美景,"《如何规划秦皇岛的沿途美景》

当你在寻找一个充满海风气息的地方时，不妨考虑一下秦皇岛。这个拥有丰富历史文化和绝美海岸线的城市，是自驾游的理想选择。在这里，你可以与家人一起探索自然的奇迹和城市的魅力。

从市区出发向北，第一站我们来到南戴河。这片海滩以其细腻柔软的沙子著称，海水清澈见底，是游泳、日光浴的好去处。沿着海岸线继续前行，你会看到一片片绿色植被覆盖的小丘陵——黄金海岸。这里不仅可以散步，还能体验射箭、骑马等户外活动。

紧接着，我们向北驶向山海关。这不仅是中国著名的古战场遗址，也是万里长城的起点之一。站在城楼上远眺，可以将海与山交织成一幅美丽的画卷尽收眼底。漫步在古城中，感受那份历史沉淀下来的庄重与肃穆。

结束一天的探索后，在回程途中别忘了品尝一下当地特色的海鲜大餐。",1742179206,1742437299,自驾游攻略
116,70,我的秦皇岛海滨漫步之旅,"《我的秦皇岛海滨漫步之旅》

这个周末，我带着家人去了美丽的秦皇岛海滨。这次旅行不仅让我们全家度过了一个难忘的假日时光，也让我深深领略了秦皇岛的魅力。

早晨，当第一缕阳光洒在海面上时，我们就踏上旅程。我们首先来到了南戴河景区，这里被誉为“东方瑞士”。沙滩绵延数公里，金色的沙粒细腻柔软，踩上去有种说不出的舒适感。孩子们兴奋地追逐着退潮后留在沙滩上的小蟹和小鱼，而大人们则或躺或坐享受着海风拂面的惬意。

午后，我们来到了鸽子窝公园，这里不仅景色优美，还有不少有趣的活动。公园内郁郁葱葱的树木、形态各异的岩石以及精心设计的小景观，都让人流连忘返。午餐后，我们还参加了公园内的徒步活动，沿着蜿蜒曲折的小路漫步在绿树丛中，呼吸着清新的空气，感受大自然的美好。

傍晚时分，我们前往了北戴河新区，这里的海滩别有一番风味。",1742523481,1742820290,旅行日记
